07:02:03.207979 IP 10.0.0.2.55555 > 10.0.0.1.domain: 0+ A? www.fffffffffff.com. (37)
07:02:03.208965 IP 10.0.0.1.domain > 10.0.0.2.55555: 0 1/0/0 A 111.111.111.111 (53)
07:02:03.222172 IP 10.0.0.2.55555 > 10.0.0.1.domain: 0+ A? www.fffffffffff.com. (37)
07:02:03.222301 IP 10.0.0.1.domain > 10.0.0.2.55555: 0 1/0/0 A 111.111.111.111 (53)
07:02:03.230555 IP 10.0.0.2.55555 > 10.0.0.1.domain: 0+ A? www.fffffffffff.com. (37)
07:02:03.230734 IP 10.0.0.1.domain > 10.0.0.2.55555: 0 1/0/0 A 111.111.111.111 (53)
07:02:03.235354 IP 10.0.0.2.55555 > 10.0.0.1.domain: 0+ A? www.fffffffffff.com. (37)
07:02:03.235497 IP 10.0.0.1.domain > 10.0.0.2.55555: 0 1/0/0 A 111.111.111.111 (53)
07:02:03.238418 IP 10.0.0.2.55555 > 10.0.0.1.domain: 0+ A? www.fffffffffff.com. (37)
07:02:03.238528 IP 10.0.0.1.domain > 10.0.0.2.55555: 0 1/0/0 A 111.111.111.111 (53)
07:02:03.242735 IP 10.0.0.2.55555 > 10.0.0.1.domain: 0+ A? www.fffffffffff.com. (37)
07:02:03.242860 IP 10.0.0.1.domain > 10.0.0.2.55555: 0 1/0/0 A 111.111.111.111 (53)
07:02:03.246021 IP 10.0.0.2.55555 > 10.0.0.1.domain: 0+ A? www.fffffffffff.com. (37)
07:02:03.246130 IP 10.0.0.1.domain > 10.0.0.2.55555: 0 1/0/0 A 111.111.111.111 (53)
07:02:03.250242 IP 10.0.0.2.55555 > 10.0.0.1.domain: 0+ A? www.fffffffffff.com. (37)
07:02:03.250353 IP 10.0.0.1.domain > 10.0.0.2.55555: 0 1/0/0 A 111.111.111.111 (53)
07:02:03.256702 IP 10.0.0.2.55555 > 10.0.0.1.domain: 0+ A? www.fffffffffff.com. (37)
07:02:03.256818 IP 10.0.0.1.domain > 10.0.0.2.55555: 0 1/0/0 A 111.111.111.111 (53)
07:02:03.264780 IP 10.0.0.2.55555 > 10.0.0.1.domain: 0+ A? www.fffffffffff.com. (37)
07:02:03.264945 IP 10.0.0.1.domain > 10.0.0.2.55555: 0 1/0/0 A 111.111.111.111 (53)
07:02:03.271239 IP 10.0.0.2.55555 > 10.0.0.1.domain: 0+ A? www.fffffffffff.com. (37)
07:02:03.271461 IP 10.0.0.1.domain > 10.0.0.2.55555: 0 1/0/0 A 111.111.111.111 (53)
07:02:03.275472 IP 10.0.0.2.55555 > 10.0.0.1.domain: 0+ A? www.fffffffffff.com. (37)
07:02:03.275630 IP 10.0.0.1.domain > 10.0.0.2.55555: 0 1/0/0 A 111.111.111.111 (53)
07:02:03.279314 IP 10.0.0.2.55555 > 10.0.0.1.domain: 0+ A? www.fffffffffff.com. (37)
07:02:03.279433 IP 10.0.0.1.domain > 10.0.0.2.55555: 0 1/0/0 A 111.111.111.111 (53)
07:02:03.282648 IP 10.0.0.2.55555 > 10.0.0.1.domain: 0+ A? www.fffffffffff.com. (37)
07:02:03.282757 IP 10.0.0.1.domain > 10.0.0.2.55555: 0 1/0/0 A 111.111.111.111 (53)
07:02:03.286321 IP 10.0.0.2.55555 > 10.0.0.1.domain: 0+ A? www.fffffffffff.com. (37)
07:02:03.286433 IP 10.0.0.1.domain > 10.0.0.2.55555: 0 1/0/0 A 111.111.111.111 (53)
07:02:03.290267 IP 10.0.0.2.55555 > 10.0.0.1.domain: 0+ A? www.fffffffffff.com. (37)
07:02:03.290382 IP 10.0.0.1.domain > 10.0.0.2.55555: 0 1/0/0 A 111.111.111.111 (53)
07:02:03.296549 IP 10.0.0.2.55555 > 10.0.0.1.domain: 0+ A? www.fffffffffff.com. (37)
07:02:03.296702 IP 10.0.0.1.domain > 10.0.0.2.55555: 0 1/0/0 A 111.111.111.111 (53)
07:02:03.301295 IP 10.0.0.2.55555 > 10.0.0.1.domain: 0+ A? www.fffffffffff.com. (37)
07:02:03.301423 IP 10.0.0.1.domain > 10.0.0.2.55555: 0 1/0/0 A 111.111.111.111 (53)
07:02:03.304978 IP 10.0.0.2.55555 > 10.0.0.1.domain: 0+ A? www.fffffffffff.com. (37)
07:02:03.305130 IP 10.0.0.1.domain > 10.0.0.2.55555: 0 1/0/0 A 111.111.111.111 (53)
07:02:03.312702 IP 10.0.0.2.55555 > 10.0.0.1.domain: 0+ A? www.fffffffffff.com. (37)
07:02:03.312890 IP 10.0.0.1.domain > 10.0.0.2.55555: 0 1/0/0 A 111.111.111.111 (53)
07:02:03.320106 IP 10.0.0.2.55555 > 10.0.0.1.domain: 0+ A? www.fffffffffff.com. (37)
07:02:03.320293 IP 10.0.0.1.domain > 10.0.0.2.55555: 0 1/0/0 A 111.111.111.111 (53)
07:02:03.324005 IP 10.0.0.2.55555 > 10.0.0.1.domain: 0+ A? www.fffffffffff.com. (37)
07:02:03.324196 IP 10.0.0.1.domain > 10.0.0.2.55555: 0 1/0/0 A 111.111.111.111 (53)
07:02:03.328735 IP 10.0.0.2.55555 > 10.0.0.1.domain: 0+ A? www.fffffffffff.com. (37)
07:02:03.328853 IP 10.0.0.1.domain > 10.0.0.2.55555: 0 1/0/0 A 111.111.111.111 (53)
07:02:03.335509 IP 10.0.0.2.55555 > 10.0.0.1.domain: 0+ A? www.fffffffffff.com. (37)
07:02:03.335668 IP 10.0.0.1.domain > 10.0.0.2.55555: 0 1/0/0 A 111.111.111.111 (53)
07:02:03.339263 IP 10.0.0.2.55555 > 10.0.0.1.domain: 0+ A? www.fffffffffff.com. (37)
07:02:03.339457 IP 10.0.0.1.domain > 10.0.0.2.55555: 0 1/0/0 A 111.111.111.111 (53)
07:02:03.344062 IP 10.0.0.2.55555 > 10.0.0.1.domain: 0+ A? www.fffffffffff.com. (37)
07:02:03.344245 IP 10.0.0.1.domain > 10.0.0.2.55555: 0 1/0/0 A 111.111.111.111 (53)
07:02:03.350984 IP 10.0.0.2.55555 > 10.0.0.1.domain: 0+ A? www.fffffffffff.com. (37)
07:02:03.351102 IP 10.0.0.1.domain > 10.0.0.2.55555: 0 1/0/0 A 111.111.111.111 (53)
07:02:03.354169 IP 10.0.0.2.55555 > 10.0.0.1.domain: 0+ A? www.fffffffffff.com. (37)
07:02:03.354341 IP 10.0.0.1.domain > 10.0.0.2.55555: 0 1/0/0 A 111.111.111.111 (53)
07:02:03.358169 IP 10.0.0.2.55555 > 10.0.0.1.domain: 0+ A? www.fffffffffff.com. (37)
07:02:03.358313 IP 10.0.0.1.domain > 10.0.0.2.55555: 0 1/0/0 A 111.111.111.111 (53)
07:02:03.361893 IP 10.0.0.2.55555 > 10.0.0.1.domain: 0+ A? www.fffffffffff.com. (37)
07:02:03.362015 IP 10.0.0.1.domain > 10.0.0.2.55555: 0 1/0/0 A 111.111.111.111 (53)
07:02:03.366357 IP 10.0.0.2.55555 > 10.0.0.1.domain: 0+ A? www.fffffffffff.com. (37)
07:02:03.366444 IP 10.0.0.1.domain > 10.0.0.2.55555: 0 1/0/0 A 111.111.111.111 (53)
07:02:03.369539 IP 10.0.0.2.55555 > 10.0.0.1.domain: 0+ A? www.fffffffffff.com. (37)
07:02:03.369646 IP 10.0.0.1.domain > 10.0.0.2.55555: 0 1/0/0 A 111.111.111.111 (53)
07:02:03.378007 IP 10.0.0.2.55555 > 10.0.0.1.domain: 0+ A? www.fffffffffff.com. (37)
07:02:03.378165 IP 10.0.0.1.domain > 10.0.0.2.55555: 0 1/0/0 A 111.111.111.111 (53)
07:02:03.383072 IP 10.0.0.2.55555 > 10.0.0.1.domain: 0+ A? www.fffffffffff.com. (37)
07:02:03.383307 IP 10.0.0.1.domain > 10.0.0.2.55555: 0 1/0/0 A 111.111.111.111 (53)
07:02:03.390507 IP 10.0.0.2.55555 > 10.0.0.1.domain: 0+ A? www.fffffffffff.com. (37)
07:02:03.390847 IP 10.0.0.1.domain > 10.0.0.2.55555: 0 1/0/0 A 111.111.111.111 (53)
07:02:03.395877 IP 10.0.0.2.55555 > 10.0.0.1.domain: 0+ A? www.fffffffffff.com. (37)
07:02:03.396033 IP 10.0.0.1.domain > 10.0.0.2.55555: 0 1/0/0 A 111.111.111.111 (53)
07:02:03.399592 IP 10.0.0.2.55555 > 10.0.0.1.domain: 0+ A? www.fffffffffff.com. (37)
07:02:03.399706 IP 10.0.0.1.domain > 10.0.0.2.55555: 0 1/0/0 A 111.111.111.111 (53)
07:02:03.403377 IP 10.0.0.2.55555 > 10.0.0.1.domain: 0+ A? www.fffffffffff.com. (37)
07:02:03.403605 IP 10.0.0.1.domain > 10.0.0.2.55555: 0 1/0/0 A 111.111.111.111 (53)
07:02:03.408031 IP 10.0.0.2.55555 > 10.0.0.1.domain: 0+ A? www.fffffffffff.com. (37)
07:02:03.408160 IP 10.0.0.1.domain > 10.0.0.2.55555: 0 1/0/0 A 111.111.111.111 (53)
07:02:03.413035 IP 10.0.0.2.55555 > 10.0.0.1.domain: 0+ A? www.fffffffffff.com. (37)
07:02:03.413378 IP 10.0.0.1.domain > 10.0.0.2.55555: 0 1/0/0 A 111.111.111.111 (53)
07:02:03.420230 IP 10.0.0.2.55555 > 10.0.0.1.domain: 0+ A? www.fffffffffff.com. (37)
07:02:03.420382 IP 10.0.0.1.domain > 10.0.0.2.55555: 0 1/0/0 A 111.111.111.111 (53)
07:02:03.424386 IP 10.0.0.2.55555 > 10.0.0.1.domain: 0+ A? www.fffffffffff.com. (37)
07:02:03.424542 IP 10.0.0.1.domain > 10.0.0.2.55555: 0 1/0/0 A 111.111.111.111 (53)
07:02:03.428268 IP 10.0.0.2.55555 > 10.0.0.1.domain: 0+ A? www.fffffffffff.com. (37)
07:02:03.428621 IP 10.0.0.1.domain > 10.0.0.2.55555: 0 1/0/0 A 111.111.111.111 (53)
07:02:03.435250 IP 10.0.0.2.55555 > 10.0.0.1.domain: 0+ A? www.fffffffffff.com. (37)
07:02:03.435399 IP 10.0.0.1.domain > 10.0.0.2.55555: 0 1/0/0 A 111.111.111.111 (53)
07:02:03.441260 IP 10.0.0.2.55555 > 10.0.0.1.domain: 0+ A? www.fffffffffff.com. (37)
07:02:03.441411 IP 10.0.0.1.domain > 10.0.0.2.55555: 0 1/0/0 A 111.111.111.111 (53)
07:02:03.446334 IP 10.0.0.2.55555 > 10.0.0.1.domain: 0+ A? www.fffffffffff.com. (37)
07:02:03.446604 IP 10.0.0.1.domain > 10.0.0.2.55555: 0 1/0/0 A 111.111.111.111 (53)
07:02:03.449744 IP 10.0.0.2.55555 > 10.0.0.1.domain: 0+ A? www.fffffffffff.com. (37)
07:02:03.449912 IP 10.0.0.1.domain > 10.0.0.2.55555: 0 1/0/0 A 111.111.111.111 (53)
07:02:03.453730 IP 10.0.0.2.55555 > 10.0.0.1.domain: 0+ A? www.fffffffffff.com. (37)
07:02:03.453858 IP 10.0.0.1.domain > 10.0.0.2.55555: 0 1/0/0 A 111.111.111.111 (53)
07:02:03.461207 IP 10.0.0.2.55555 > 10.0.0.1.domain: 0+ A? www.fffffffffff.com. (37)
07:02:03.461389 IP 10.0.0.1.domain > 10.0.0.2.55555: 0 1/0/0 A 111.111.111.111 (53)
07:02:03.464756 IP 10.0.0.2.55555 > 10.0.0.1.domain: 0+ A? www.fffffffffff.com. (37)
07:02:03.464892 IP 10.0.0.1.domain > 10.0.0.2.55555: 0 1/0/0 A 111.111.111.111 (53)
07:02:03.470354 IP 10.0.0.2.55555 > 10.0.0.1.domain: 0+ A? www.fffffffffff.com. (37)
07:02:03.470563 IP 10.0.0.1.domain > 10.0.0.2.55555: 0 1/0/0 A 111.111.111.111 (53)
07:02:03.473768 IP 10.0.0.2.55555 > 10.0.0.1.domain: 0+ A? www.fffffffffff.com. (37)
07:02:03.473875 IP 10.0.0.1.domain > 10.0.0.2.55555: 0 1/0/0 A 111.111.111.111 (53)
07:02:03.481636 IP 10.0.0.2.55555 > 10.0.0.1.domain: 0+ A? www.fffffffffff.com. (37)
07:02:03.481800 IP 10.0.0.1.domain > 10.0.0.2.55555: 0 1/0/0 A 111.111.111.111 (53)
07:02:03.486216 IP 10.0.0.2.55555 > 10.0.0.1.domain: 0+ A? www.fffffffffff.com. (37)
07:02:03.486371 IP 10.0.0.1.domain > 10.0.0.2.55555: 0 1/0/0 A 111.111.111.111 (53)
07:02:03.490727 IP 10.0.0.2.55555 > 10.0.0.1.domain: 0+ A? www.fffffffffff.com. (37)
07:02:03.490970 IP 10.0.0.1.domain > 10.0.0.2.55555: 0 1/0/0 A 111.111.111.111 (53)
07:02:03.495462 IP 10.0.0.2.55555 > 10.0.0.1.domain: 0+ A? www.fffffffffff.com. (37)
07:02:03.495591 IP 10.0.0.1.domain > 10.0.0.2.55555: 0 1/0/0 A 111.111.111.111 (53)
07:02:03.502952 IP 10.0.0.2.55555 > 10.0.0.1.domain: 0+ A? www.fffffffffff.com. (37)
07:02:03.503107 IP 10.0.0.1.domain > 10.0.0.2.55555: 0 1/0/0 A 111.111.111.111 (53)
07:02:03.506961 IP 10.0.0.2.55555 > 10.0.0.1.domain: 0+ A? www.fffffffffff.com. (37)
07:02:03.507127 IP 10.0.0.1.domain > 10.0.0.2.55555: 0 1/0/0 A 111.111.111.111 (53)
07:02:03.511033 IP 10.0.0.2.55555 > 10.0.0.1.domain: 0+ A? www.fffffffffff.com. (37)
07:02:03.511196 IP 10.0.0.1.domain > 10.0.0.2.55555: 0 1/0/0 A 111.111.111.111 (53)
07:02:03.514864 IP 10.0.0.2.55555 > 10.0.0.1.domain: 0+ A? www.fffffffffff.com. (37)
07:02:03.515011 IP 10.0.0.1.domain > 10.0.0.2.55555: 0 1/0/0 A 111.111.111.111 (53)
07:02:03.518215 IP 10.0.0.2.55555 > 10.0.0.1.domain: 0+ A? www.fffffffffff.com. (37)
07:02:03.518324 IP 10.0.0.1.domain > 10.0.0.2.55555: 0 1/0/0 A 111.111.111.111 (53)
07:02:03.525419 IP 10.0.0.2.55555 > 10.0.0.1.domain: 0+ A? www.fffffffffff.com. (37)
07:02:03.525547 IP 10.0.0.1.domain > 10.0.0.2.55555: 0 1/0/0 A 111.111.111.111 (53)
07:02:03.532583 IP 10.0.0.2.55555 > 10.0.0.1.domain: 0+ A? www.fffffffffff.com. (37)
07:02:03.532709 IP 10.0.0.1.domain > 10.0.0.2.55555: 0 1/0/0 A 111.111.111.111 (53)
07:02:03.537768 IP 10.0.0.2.55555 > 10.0.0.1.domain: 0+ A? www.fffffffffff.com. (37)
07:02:03.537900 IP 10.0.0.1.domain > 10.0.0.2.55555: 0 1/0/0 A 111.111.111.111 (53)
07:02:03.544037 IP 10.0.0.2.55555 > 10.0.0.1.domain: 0+ A? www.fffffffffff.com. (37)
07:02:03.544202 IP 10.0.0.1.domain > 10.0.0.2.55555: 0 1/0/0 A 111.111.111.111 (53)
07:02:03.551040 IP 10.0.0.2.55555 > 10.0.0.1.domain: 0+ A? www.fffffffffff.com. (37)
07:02:03.551202 IP 10.0.0.1.domain > 10.0.0.2.55555: 0 1/0/0 A 111.111.111.111 (53)
07:02:03.555763 IP 10.0.0.2.55555 > 10.0.0.1.domain: 0+ A? www.fffffffffff.com. (37)
07:02:03.555905 IP 10.0.0.1.domain > 10.0.0.2.55555: 0 1/0/0 A 111.111.111.111 (53)
07:02:03.560184 IP 10.0.0.2.55555 > 10.0.0.1.domain: 0+ A? www.fffffffffff.com. (37)
07:02:03.560325 IP 10.0.0.1.domain > 10.0.0.2.55555: 0 1/0/0 A 111.111.111.111 (53)
07:02:03.565912 IP 10.0.0.2.55555 > 10.0.0.1.domain: 0+ A? www.fffffffffff.com. (37)
07:02:03.566076 IP 10.0.0.1.domain > 10.0.0.2.55555: 0 1/0/0 A 111.111.111.111 (53)
07:02:03.572594 IP 10.0.0.2.55555 > 10.0.0.1.domain: 0+ A? www.fffffffffff.com. (37)
07:02:03.572766 IP 10.0.0.1.domain > 10.0.0.2.55555: 0 1/0/0 A 111.111.111.111 (53)
07:02:03.577239 IP 10.0.0.2.55555 > 10.0.0.1.domain: 0+ A? www.fffffffffff.com. (37)
07:02:03.577390 IP 10.0.0.1.domain > 10.0.0.2.55555: 0 1/0/0 A 111.111.111.111 (53)
07:02:03.581273 IP 10.0.0.2.55555 > 10.0.0.1.domain: 0+ A? www.fffffffffff.com. (37)
07:02:03.581436 IP 10.0.0.1.domain > 10.0.0.2.55555: 0 1/0/0 A 111.111.111.111 (53)
07:02:03.585080 IP 10.0.0.2.55555 > 10.0.0.1.domain: 0+ A? www.fffffffffff.com. (37)
07:02:03.585199 IP 10.0.0.1.domain > 10.0.0.2.55555: 0 1/0/0 A 111.111.111.111 (53)
07:02:03.591638 IP 10.0.0.2.55555 > 10.0.0.1.domain: 0+ A? www.fffffffffff.com. (37)
07:02:03.591806 IP 10.0.0.1.domain > 10.0.0.2.55555: 0 1/0/0 A 111.111.111.111 (53)
07:02:03.596671 IP 10.0.0.2.55555 > 10.0.0.1.domain: 0+ A? www.fffffffffff.com. (37)
07:02:03.596817 IP 10.0.0.1.domain > 10.0.0.2.55555: 0 1/0/0 A 111.111.111.111 (53)
07:02:03.600911 IP 10.0.0.2.55555 > 10.0.0.1.domain: 0+ A? www.fffffffffff.com. (37)
07:02:03.601028 IP 10.0.0.1.domain > 10.0.0.2.55555: 0 1/0/0 A 111.111.111.111 (53)
07:02:03.603641 IP 10.0.0.2.55555 > 10.0.0.1.domain: 0+ A? www.fffffffffff.com. (37)
07:02:03.603733 IP 10.0.0.1.domain > 10.0.0.2.55555: 0 1/0/0 A 111.111.111.111 (53)
07:02:03.605436 IP 10.0.0.2.55555 > 10.0.0.1.domain: 0+ A? www.fffffffffff.com. (37)
07:02:03.605492 IP 10.0.0.1.domain > 10.0.0.2.55555: 0 1/0/0 A 111.111.111.111 (53)
07:02:03.610419 IP 10.0.0.2.55555 > 10.0.0.1.domain: 0+ A? www.fffffffffff.com. (37)
07:02:03.610627 IP 10.0.0.1.domain > 10.0.0.2.55555: 0 1/0/0 A 111.111.111.111 (53)
07:02:03.615826 IP 10.0.0.2.55555 > 10.0.0.1.domain: 0+ A? www.fffffffffff.com. (37)
07:02:03.616229 IP 10.0.0.1.domain > 10.0.0.2.55555: 0 1/0/0 A 111.111.111.111 (53)
07:02:03.622693 IP 10.0.0.2.55555 > 10.0.0.1.domain: 0+ A? www.fffffffffff.com. (37)
07:02:03.622849 IP 10.0.0.1.domain > 10.0.0.2.55555: 0 1/0/0 A 111.111.111.111 (53)
07:02:03.629997 IP 10.0.0.2.55555 > 10.0.0.1.domain: 0+ A? www.fffffffffff.com. (37)
07:02:03.630141 IP 10.0.0.1.domain > 10.0.0.2.55555: 0 1/0/0 A 111.111.111.111 (53)
07:02:03.633802 IP 10.0.0.2.55555 > 10.0.0.1.domain: 0+ A? www.fffffffffff.com. (37)
07:02:03.633972 IP 10.0.0.1.domain > 10.0.0.2.55555: 0 1/0/0 A 111.111.111.111 (53)
07:02:03.642638 IP 10.0.0.2.55555 > 10.0.0.1.domain: 0+ A? www.fffffffffff.com. (37)
07:02:03.642768 IP 10.0.0.1.domain > 10.0.0.2.55555: 0 1/0/0 A 111.111.111.111 (53)
07:02:03.645889 IP 10.0.0.2.55555 > 10.0.0.1.domain: 0+ A? www.fffffffffff.com. (37)
07:02:03.646014 IP 10.0.0.1.domain > 10.0.0.2.55555: 0 1/0/0 A 111.111.111.111 (53)
07:02:03.652556 IP 10.0.0.2.55555 > 10.0.0.1.domain: 0+ A? www.fffffffffff.com. (37)
07:02:03.652718 IP 10.0.0.1.domain > 10.0.0.2.55555: 0 1/0/0 A 111.111.111.111 (53)
07:02:03.656683 IP 10.0.0.2.55555 > 10.0.0.1.domain: 0+ A? www.fffffffffff.com. (37)
07:02:03.656801 IP 10.0.0.1.domain > 10.0.0.2.55555: 0 1/0/0 A 111.111.111.111 (53)
07:02:03.660103 IP 10.0.0.2.55555 > 10.0.0.1.domain: 0+ A? www.fffffffffff.com. (37)
07:02:03.660245 IP 10.0.0.1.domain > 10.0.0.2.55555: 0 1/0/0 A 111.111.111.111 (53)
07:02:03.664592 IP 10.0.0.2.55555 > 10.0.0.1.domain: 0+ A? www.fffffffffff.com. (37)
07:02:03.664710 IP 10.0.0.1.domain > 10.0.0.2.55555: 0 1/0/0 A 111.111.111.111 (53)
07:02:03.668636 IP 10.0.0.2.55555 > 10.0.0.1.domain: 0+ A? www.fffffffffff.com. (37)
07:02:03.668758 IP 10.0.0.1.domain > 10.0.0.2.55555: 0 1/0/0 A 111.111.111.111 (53)
07:02:03.671656 IP 10.0.0.2.55555 > 10.0.0.1.domain: 0+ A? www.fffffffffff.com. (37)
07:02:03.671733 IP 10.0.0.1.domain > 10.0.0.2.55555: 0 1/0/0 A 111.111.111.111 (53)
07:02:03.677235 IP 10.0.0.2.55555 > 10.0.0.1.domain: 0+ A? www.fffffffffff.com. (37)
07:02:03.677368 IP 10.0.0.1.domain > 10.0.0.2.55555: 0 1/0/0 A 111.111.111.111 (53)
07:02:03.684128 IP 10.0.0.2.55555 > 10.0.0.1.domain: 0+ A? www.fffffffffff.com. (37)
07:02:03.684254 IP 10.0.0.1.domain > 10.0.0.2.55555: 0 1/0/0 A 111.111.111.111 (53)
07:02:03.688157 IP 10.0.0.2.55555 > 10.0.0.1.domain: 0+ A? www.fffffffffff.com. (37)
07:02:03.688273 IP 10.0.0.1.domain > 10.0.0.2.55555: 0 1/0/0 A 111.111.111.111 (53)
07:02:03.692467 IP 10.0.0.2.55555 > 10.0.0.1.domain: 0+ A? www.fffffffffff.com. (37)
07:02:03.692616 IP 10.0.0.1.domain > 10.0.0.2.55555: 0 1/0/0 A 111.111.111.111 (53)
07:02:03.696090 IP 10.0.0.2.55555 > 10.0.0.1.domain: 0+ A? www.fffffffffff.com. (37)
07:02:03.696220 IP 10.0.0.1.domain > 10.0.0.2.55555: 0 1/0/0 A 111.111.111.111 (53)
07:02:03.699904 IP 10.0.0.2.55555 > 10.0.0.1.domain: 0+ A? www.fffffffffff.com. (37)
07:02:03.700031 IP 10.0.0.1.domain > 10.0.0.2.55555: 0 1/0/0 A 111.111.111.111 (53)
07:02:03.703527 IP 10.0.0.2.55555 > 10.0.0.1.domain: 0+ A? www.fffffffffff.com. (37)
07:02:03.703660 IP 10.0.0.1.domain > 10.0.0.2.55555: 0 1/0/0 A 111.111.111.111 (53)
07:02:03.707515 IP 10.0.0.2.55555 > 10.0.0.1.domain: 0+ A? www.fffffffffff.com. (37)
07:02:03.707655 IP 10.0.0.1.domain > 10.0.0.2.55555: 0 1/0/0 A 111.111.111.111 (53)
07:02:03.711233 IP 10.0.0.2.55555 > 10.0.0.1.domain: 0+ A? www.fffffffffff.com. (37)
07:02:03.711346 IP 10.0.0.1.domain > 10.0.0.2.55555: 0 1/0/0 A 111.111.111.111 (53)
07:02:06.252643 IP 10.0.0.2.55555 > 10.0.0.1.domain: 0+ A? www.ggg.com. (29)
07:02:06.252836 IP 10.0.0.1.domain > 10.0.0.2.55555: 0 1/0/0 A 222.222.222.222 (45)
07:02:06.261847 IP 10.0.0.2.55555 > 10.0.0.1.domain: 0+ A? www.ggg.com. (29)
07:02:06.262006 IP 10.0.0.1.domain > 10.0.0.2.55555: 0 1/0/0 A 222.222.222.222 (45)
07:02:06.272033 IP 10.0.0.2.55555 > 10.0.0.1.domain: 0+ A? www.ggg.com. (29)
07:02:06.272197 IP 10.0.0.1.domain > 10.0.0.2.55555: 0 1/0/0 A 222.222.222.222 (45)
07:02:06.276054 IP 10.0.0.2.55555 > 10.0.0.1.domain: 0+ A? www.ggg.com. (29)
07:02:06.276200 IP 10.0.0.1.domain > 10.0.0.2.55555: 0 1/0/0 A 222.222.222.222 (45)
07:02:06.281214 IP 10.0.0.2.55555 > 10.0.0.1.domain: 0+ A? www.ggg.com. (29)
07:02:06.281335 IP 10.0.0.1.domain > 10.0.0.2.55555: 0 1/0/0 A 222.222.222.222 (45)
07:02:06.284992 IP 10.0.0.2.55555 > 10.0.0.1.domain: 0+ A? www.ggg.com. (29)
07:02:06.285156 IP 10.0.0.1.domain > 10.0.0.2.55555: 0 1/0/0 A 222.222.222.222 (45)
07:02:06.289491 IP 10.0.0.2.55555 > 10.0.0.1.domain: 0+ A? www.ggg.com. (29)
07:02:06.289606 IP 10.0.0.1.domain > 10.0.0.2.55555: 0 1/0/0 A 222.222.222.222 (45)
07:02:06.295692 IP 10.0.0.2.55555 > 10.0.0.1.domain: 0+ A? www.ggg.com. (29)
07:02:06.295868 IP 10.0.0.1.domain > 10.0.0.2.55555: 0 1/0/0 A 222.222.222.222 (45)
07:02:06.302524 IP 10.0.0.2.55555 > 10.0.0.1.domain: 0+ A? www.ggg.com. (29)
07:02:06.303588 IP 10.0.0.1.domain > 10.0.0.2.55555: 0 1/0/0 A 222.222.222.222 (45)
07:02:06.309873 IP 10.0.0.2.55555 > 10.0.0.1.domain: 0+ A? www.ggg.com. (29)
07:02:06.310028 IP 10.0.0.1.domain > 10.0.0.2.55555: 0 1/0/0 A 222.222.222.222 (45)

