22:13:18.177606 IP 10.0.0.2.55555 > 10.0.0.1.domain: 0+ A? www.ggg.com. (29)
22:13:18.185673 IP 10.0.0.1.domain > 10.0.0.2.55555: 0 1/0/0 A 222.222.222.222 (45)
22:13:18.305555 IP 10.0.0.2.55555 > 10.0.0.1.domain: 0+ A? www.ggg.com. (29)
22:13:18.308168 IP 10.0.0.1.domain > 10.0.0.2.55555: 0 1/0/0 A 222.222.222.222 (45)
22:13:18.436878 IP 10.0.0.2.55555 > 10.0.0.1.domain: 0+ A? www.ggg.com. (29)
22:13:18.441917 IP 10.0.0.1.domain > 10.0.0.2.55555: 0 1/0/0 A 222.222.222.222 (45)
22:13:18.509020 IP 10.0.0.2.55555 > 10.0.0.1.domain: 0+ A? www.ggg.com. (29)
22:13:18.514085 IP 10.0.0.1.domain > 10.0.0.2.55555: 0 1/0/0 A 222.222.222.222 (45)
22:13:18.579904 IP 10.0.0.2.55555 > 10.0.0.1.domain: 0+ A? www.ggg.com. (29)
22:13:18.584459 IP 10.0.0.1.domain > 10.0.0.2.55555: 0 1/0/0 A 222.222.222.222 (45)
22:13:18.629860 IP 10.0.0.2.55555 > 10.0.0.1.domain: 0+ A? www.ggg.com. (29)
22:13:18.641780 IP 10.0.0.1.domain > 10.0.0.2.55555: 0 1/0/0 A 222.222.222.222 (45)
22:13:18.691881 IP 10.0.0.2.55555 > 10.0.0.1.domain: 0+ A? www.ggg.com. (29)
22:13:18.697399 IP 10.0.0.1.domain > 10.0.0.2.55555: 0 1/0/0 A 222.222.222.222 (45)
22:13:18.739956 IP 10.0.0.2.55555 > 10.0.0.1.domain: 0+ A? www.ggg.com. (29)
22:13:18.748893 IP 10.0.0.1.domain > 10.0.0.2.55555: 0 1/0/0 A 222.222.222.222 (45)
22:13:18.814136 IP 10.0.0.2.55555 > 10.0.0.1.domain: 0+ A? www.ggg.com. (29)
22:13:18.828415 IP 10.0.0.1.domain > 10.0.0.2.55555: 0 1/0/0 A 222.222.222.222 (45)
22:13:18.927873 IP 10.0.0.2.55555 > 10.0.0.1.domain: 0+ A? www.ggg.com. (29)
22:13:18.937961 IP 10.0.0.1.domain > 10.0.0.2.55555: 0 1/0/0 A 222.222.222.222 (45)
22:13:19.010636 IP 10.0.0.2.55555 > 10.0.0.1.domain: 0+ A? www.ggg.com. (29)
22:13:19.020602 IP 10.0.0.1.domain > 10.0.0.2.55555: 0 1/0/0 A 222.222.222.222 (45)
22:13:19.078958 IP 10.0.0.2.55555 > 10.0.0.1.domain: 0+ A? www.ggg.com. (29)
22:13:19.091498 IP 10.0.0.1.domain > 10.0.0.2.55555: 0 1/0/0 A 222.222.222.222 (45)
22:13:19.214958 IP 10.0.0.2.55555 > 10.0.0.1.domain: 0+ A? www.ggg.com. (29)
22:13:19.221224 IP 10.0.0.1.domain > 10.0.0.2.55555: 0 1/0/0 A 222.222.222.222 (45)
22:13:19.314020 IP 10.0.0.2.55555 > 10.0.0.1.domain: 0+ A? www.ggg.com. (29)
22:13:19.326683 IP 10.0.0.1.domain > 10.0.0.2.55555: 0 1/0/0 A 222.222.222.222 (45)
22:13:19.439007 IP 10.0.0.2.55555 > 10.0.0.1.domain: 0+ A? www.ggg.com. (29)
22:13:19.446526 IP 10.0.0.1.domain > 10.0.0.2.55555: 0 1/0/0 A 222.222.222.222 (45)
22:13:19.538991 IP 10.0.0.2.55555 > 10.0.0.1.domain: 0+ A? www.ggg.com. (29)
22:13:19.546941 IP 10.0.0.1.domain > 10.0.0.2.55555: 0 1/0/0 A 222.222.222.222 (45)
22:13:19.641266 IP 10.0.0.2.55555 > 10.0.0.1.domain: 0+ A? www.ggg.com. (29)
22:13:19.643867 IP 10.0.0.1.domain > 10.0.0.2.55555: 0 1/0/0 A 222.222.222.222 (45)
22:13:19.727844 IP 10.0.0.2.55555 > 10.0.0.1.domain: 0+ A? www.ggg.com. (29)
22:13:19.753829 IP 10.0.0.1.domain > 10.0.0.2.55555: 0 1/0/0 A 222.222.222.222 (45)
22:13:19.879288 IP 10.0.0.2.55555 > 10.0.0.1.domain: 0+ A? www.ggg.com. (29)
22:13:19.893729 IP 10.0.0.1.domain > 10.0.0.2.55555: 0 1/0/0 A 222.222.222.222 (45)
22:13:19.995263 IP 10.0.0.2.55555 > 10.0.0.1.domain: 0+ A? www.ggg.com. (29)
22:13:20.003635 IP 10.0.0.1.domain > 10.0.0.2.55555: 0 1/0/0 A 222.222.222.222 (45)
22:13:20.117124 IP 10.0.0.2.55555 > 10.0.0.1.domain: 0+ A? www.ggg.com. (29)
22:13:20.124875 IP 10.0.0.1.domain > 10.0.0.2.55555: 0 1/0/0 A 222.222.222.222 (45)
22:13:20.251062 IP 10.0.0.2.55555 > 10.0.0.1.domain: 0+ A? www.ggg.com. (29)
22:13:20.263574 IP 10.0.0.1.domain > 10.0.0.2.55555: 0 1/0/0 A 222.222.222.222 (45)
22:13:20.363250 IP 10.0.0.2.55555 > 10.0.0.1.domain: 0+ A? www.ggg.com. (29)
22:13:20.377837 IP 10.0.0.1.domain > 10.0.0.2.55555: 0 1/0/0 A 222.222.222.222 (45)
22:13:20.487085 IP 10.0.0.2.55555 > 10.0.0.1.domain: 0+ A? www.ggg.com. (29)
22:13:20.492240 IP 10.0.0.1.domain > 10.0.0.2.55555: 0 1/0/0 A 222.222.222.222 (45)
22:13:20.556066 IP 10.0.0.2.55555 > 10.0.0.1.domain: 0+ A? www.ggg.com. (29)
22:13:20.558340 IP 10.0.0.1.domain > 10.0.0.2.55555: 0 1/0/0 A 222.222.222.222 (45)
22:13:20.634952 IP 10.0.0.2.55555 > 10.0.0.1.domain: 0+ A? www.ggg.com. (29)
22:13:20.665334 IP 10.0.0.1.domain > 10.0.0.2.55555: 0 1/0/0 A 222.222.222.222 (45)
22:13:20.779434 IP 10.0.0.2.55555 > 10.0.0.1.domain: 0+ A? www.ggg.com. (29)
22:13:20.793919 IP 10.0.0.1.domain > 10.0.0.2.55555: 0 1/0/0 A 222.222.222.222 (45)
22:13:20.879368 IP 10.0.0.2.55555 > 10.0.0.1.domain: 0+ A? www.ggg.com. (29)
22:13:20.886319 IP 10.0.0.1.domain > 10.0.0.2.55555: 0 1/0/0 A 222.222.222.222 (45)
22:13:20.945153 IP 10.0.0.2.55555 > 10.0.0.1.domain: 0+ A? www.ggg.com. (29)
22:13:20.952390 IP 10.0.0.1.domain > 10.0.0.2.55555: 0 1/0/0 A 222.222.222.222 (45)
22:13:20.975871 IP 10.0.0.2.55555 > 10.0.0.1.domain: 0+ A? www.ggg.com. (29)
22:13:20.989276 IP 10.0.0.1.domain > 10.0.0.2.55555: 0 1/0/0 A 222.222.222.222 (45)
22:13:21.043504 IP 10.0.0.2.55555 > 10.0.0.1.domain: 0+ A? www.ggg.com. (29)
22:13:21.056912 IP 10.0.0.1.domain > 10.0.0.2.55555: 0 1/0/0 A 222.222.222.222 (45)
22:13:21.140977 IP 10.0.0.2.55555 > 10.0.0.1.domain: 0+ A? www.ggg.com. (29)
22:13:21.153691 IP 10.0.0.1.domain > 10.0.0.2.55555: 0 1/0/0 A 222.222.222.222 (45)
22:13:21.287401 IP 10.0.0.2.55555 > 10.0.0.1.domain: 0+ A? www.ggg.com. (29)
22:13:21.295982 IP 10.0.0.1.domain > 10.0.0.2.55555: 0 1/0/0 A 222.222.222.222 (45)
22:13:21.414568 IP 10.0.0.2.55555 > 10.0.0.1.domain: 0+ A? www.ggg.com. (29)
22:13:21.417803 IP 10.0.0.1.domain > 10.0.0.2.55555: 0 1/0/0 A 222.222.222.222 (45)
22:13:21.488882 IP 10.0.0.2.55555 > 10.0.0.1.domain: 0+ A? www.ggg.com. (29)
22:13:21.498943 IP 10.0.0.1.domain > 10.0.0.2.55555: 0 1/0/0 A 222.222.222.222 (45)
22:13:21.549689 IP 10.0.0.2.55555 > 10.0.0.1.domain: 0+ A? www.ggg.com. (29)
22:13:21.552729 IP 10.0.0.1.domain > 10.0.0.2.55555: 0 1/0/0 A 222.222.222.222 (45)
22:13:21.621659 IP 10.0.0.2.55555 > 10.0.0.1.domain: 0+ A? www.ggg.com. (29)
22:13:21.624317 IP 10.0.0.1.domain > 10.0.0.2.55555: 0 1/0/0 A 222.222.222.222 (45)
22:13:21.674428 IP 10.0.0.2.55555 > 10.0.0.1.domain: 0+ A? www.ggg.com. (29)
22:13:21.685488 IP 10.0.0.1.domain > 10.0.0.2.55555: 0 1/0/0 A 222.222.222.222 (45)
22:13:21.778293 IP 10.0.0.2.55555 > 10.0.0.1.domain: 0+ A? www.ggg.com. (29)
22:13:21.783811 IP 10.0.0.1.domain > 10.0.0.2.55555: 0 1/0/0 A 222.222.222.222 (45)
22:13:21.849712 IP 10.0.0.2.55555 > 10.0.0.1.domain: 0+ A? www.ggg.com. (29)
22:13:21.858795 IP 10.0.0.1.domain > 10.0.0.2.55555: 0 1/0/0 A 222.222.222.222 (45)
22:13:21.902945 IP 10.0.0.2.55555 > 10.0.0.1.domain: 0+ A? www.ggg.com. (29)
22:13:21.907787 IP 10.0.0.1.domain > 10.0.0.2.55555: 0 1/0/0 A 222.222.222.222 (45)
22:13:21.988554 IP 10.0.0.2.55555 > 10.0.0.1.domain: 0+ A? www.ggg.com. (29)
22:13:21.990362 IP 10.0.0.1.domain > 10.0.0.2.55555: 0 1/0/0 A 222.222.222.222 (45)
22:13:22.059444 IP 10.0.0.2.55555 > 10.0.0.1.domain: 0+ A? www.ggg.com. (29)
22:13:22.078501 IP 10.0.0.1.domain > 10.0.0.2.55555: 0 1/0/0 A 222.222.222.222 (45)
22:13:22.147223 IP 10.0.0.2.55555 > 10.0.0.1.domain: 0+ A? www.ggg.com. (29)
22:13:22.151023 IP 10.0.0.1.domain > 10.0.0.2.55555: 0 1/0/0 A 222.222.222.222 (45)
22:13:22.209947 IP 10.0.0.2.55555 > 10.0.0.1.domain: 0+ A? www.ggg.com. (29)
22:13:22.213422 IP 10.0.0.1.domain > 10.0.0.2.55555: 0 1/0/0 A 222.222.222.222 (45)
22:13:22.303569 IP 10.0.0.2.55555 > 10.0.0.1.domain: 0+ A? www.ggg.com. (29)
22:13:22.306996 IP 10.0.0.1.domain > 10.0.0.2.55555: 0 1/0/0 A 222.222.222.222 (45)
22:13:22.372086 IP 10.0.0.2.55555 > 10.0.0.1.domain: 0+ A? www.ggg.com. (29)
22:13:22.374491 IP 10.0.0.1.domain > 10.0.0.2.55555: 0 1/0/0 A 222.222.222.222 (45)
22:13:22.416488 IP 10.0.0.2.55555 > 10.0.0.1.domain: 0+ A? www.ggg.com. (29)
22:13:22.421880 IP 10.0.0.1.domain > 10.0.0.2.55555: 0 1/0/0 A 222.222.222.222 (45)
22:13:22.469990 IP 10.0.0.2.55555 > 10.0.0.1.domain: 0+ A? www.ggg.com. (29)
22:13:22.480613 IP 10.0.0.1.domain > 10.0.0.2.55555: 0 1/0/0 A 222.222.222.222 (45)
22:13:22.554707 IP 10.0.0.2.55555 > 10.0.0.1.domain: 0+ A? www.ggg.com. (29)
22:13:22.556999 IP 10.0.0.1.domain > 10.0.0.2.55555: 0 1/0/0 A 222.222.222.222 (45)
22:13:22.625920 IP 10.0.0.2.55555 > 10.0.0.1.domain: 0+ A? www.ggg.com. (29)
22:13:22.638437 IP 10.0.0.1.domain > 10.0.0.2.55555: 0 1/0/0 A 222.222.222.222 (45)
22:13:22.690209 IP 10.0.0.2.55555 > 10.0.0.1.domain: 0+ A? www.ggg.com. (29)
22:13:22.692380 IP 10.0.0.1.domain > 10.0.0.2.55555: 0 1/0/0 A 222.222.222.222 (45)
22:13:22.734796 IP 10.0.0.2.55555 > 10.0.0.1.domain: 0+ A? www.ggg.com. (29)
22:13:22.750499 IP 10.0.0.1.domain > 10.0.0.2.55555: 0 1/0/0 A 222.222.222.222 (45)
22:13:22.831821 IP 10.0.0.2.55555 > 10.0.0.1.domain: 0+ A? www.ggg.com. (29)
22:13:22.851366 IP 10.0.0.1.domain > 10.0.0.2.55555: 0 1/0/0 A 222.222.222.222 (45)
22:13:22.938389 IP 10.0.0.2.55555 > 10.0.0.1.domain: 0+ A? www.ggg.com. (29)
22:13:22.956046 IP 10.0.0.1.domain > 10.0.0.2.55555: 0 1/0/0 A 222.222.222.222 (45)
22:13:23.059089 IP 10.0.0.2.55555 > 10.0.0.1.domain: 0+ A? www.ggg.com. (29)
22:13:23.064450 IP 10.0.0.1.domain > 10.0.0.2.55555: 0 1/0/0 A 222.222.222.222 (45)
22:13:23.184650 IP 10.0.0.2.55555 > 10.0.0.1.domain: 0+ A? www.ggg.com. (29)
22:13:23.190017 IP 10.0.0.1.domain > 10.0.0.2.55555: 0 1/0/0 A 222.222.222.222 (45)
22:13:23.278491 IP 10.0.0.2.55555 > 10.0.0.1.domain: 0+ A? www.ggg.com. (29)
22:13:23.281902 IP 10.0.0.1.domain > 10.0.0.2.55555: 0 1/0/0 A 222.222.222.222 (45)
22:13:23.359317 IP 10.0.0.2.55555 > 10.0.0.1.domain: 0+ A? www.ggg.com. (29)
22:13:23.362684 IP 10.0.0.1.domain > 10.0.0.2.55555: 0 1/0/0 A 222.222.222.222 (45)
22:13:23.464978 IP 10.0.0.2.55555 > 10.0.0.1.domain: 0+ A? www.ggg.com. (29)
22:13:23.467772 IP 10.0.0.1.domain > 10.0.0.2.55555: 0 1/0/0 A 222.222.222.222 (45)
22:13:23.547586 IP 10.0.0.2.55555 > 10.0.0.1.domain: 0+ A? www.ggg.com. (29)
22:13:23.557987 IP 10.0.0.1.domain > 10.0.0.2.55555: 0 1/0/0 A 222.222.222.222 (45)
22:13:23.679701 IP 10.0.0.2.55555 > 10.0.0.1.domain: 0+ A? www.ggg.com. (29)
22:13:23.697412 IP 10.0.0.1.domain > 10.0.0.2.55555: 0 1/0/0 A 222.222.222.222 (45)
22:13:23.778876 IP 10.0.0.2.55555 > 10.0.0.1.domain: 0+ A? www.ggg.com. (29)
22:13:23.786408 IP 10.0.0.1.domain > 10.0.0.2.55555: 0 1/0/0 A 222.222.222.222 (45)
22:13:23.884150 IP 10.0.0.2.55555 > 10.0.0.1.domain: 0+ A? www.ggg.com. (29)
22:13:23.886719 IP 10.0.0.1.domain > 10.0.0.2.55555: 0 1/0/0 A 222.222.222.222 (45)
22:13:23.975108 IP 10.0.0.2.55555 > 10.0.0.1.domain: 0+ A? www.ggg.com. (29)
22:13:23.988966 IP 10.0.0.1.domain > 10.0.0.2.55555: 0 1/0/0 A 222.222.222.222 (45)
22:13:24.026579 IP 10.0.0.2.55555 > 10.0.0.1.domain: 0+ A? www.ggg.com. (29)
22:13:24.028962 IP 10.0.0.1.domain > 10.0.0.2.55555: 0 1/0/0 A 222.222.222.222 (45)
22:13:24.092427 IP 10.0.0.2.55555 > 10.0.0.1.domain: 0+ A? www.ggg.com. (29)
22:13:24.100506 IP 10.0.0.1.domain > 10.0.0.2.55555: 0 1/0/0 A 222.222.222.222 (45)
22:13:24.203002 IP 10.0.0.2.55555 > 10.0.0.1.domain: 0+ A? www.ggg.com. (29)
22:13:24.211932 IP 10.0.0.1.domain > 10.0.0.2.55555: 0 1/0/0 A 222.222.222.222 (45)
22:13:24.302579 IP 10.0.0.2.55555 > 10.0.0.1.domain: 0+ A? www.ggg.com. (29)
22:13:24.309213 IP 10.0.0.1.domain > 10.0.0.2.55555: 0 1/0/0 A 222.222.222.222 (45)
22:13:24.389760 IP 10.0.0.2.55555 > 10.0.0.1.domain: 0+ A? www.ggg.com. (29)
22:13:24.402800 IP 10.0.0.1.domain > 10.0.0.2.55555: 0 1/0/0 A 222.222.222.222 (45)
22:13:24.466284 IP 10.0.0.2.55555 > 10.0.0.1.domain: 0+ A? www.ggg.com. (29)
22:13:24.470912 IP 10.0.0.1.domain > 10.0.0.2.55555: 0 1/0/0 A 222.222.222.222 (45)
22:13:24.517099 IP 10.0.0.2.55555 > 10.0.0.1.domain: 0+ A? www.ggg.com. (29)
22:13:24.519750 IP 10.0.0.1.domain > 10.0.0.2.55555: 0 1/0/0 A 222.222.222.222 (45)
22:13:24.569889 IP 10.0.0.2.55555 > 10.0.0.1.domain: 0+ A? www.ggg.com. (29)
22:13:24.597463 IP 10.0.0.1.domain > 10.0.0.2.55555: 0 1/0/0 A 222.222.222.222 (45)
22:13:24.698472 IP 10.0.0.2.55555 > 10.0.0.1.domain: 0+ A? www.ggg.com. (29)
22:13:24.703486 IP 10.0.0.1.domain > 10.0.0.2.55555: 0 1/0/0 A 222.222.222.222 (45)
22:13:24.762863 IP 10.0.0.2.55555 > 10.0.0.1.domain: 0+ A? www.ggg.com. (29)
22:13:24.773309 IP 10.0.0.1.domain > 10.0.0.2.55555: 0 1/0/0 A 222.222.222.222 (45)
22:13:24.819698 IP 10.0.0.2.55555 > 10.0.0.1.domain: 0+ A? www.ggg.com. (29)
22:13:24.823215 IP 10.0.0.1.domain > 10.0.0.2.55555: 0 1/0/0 A 222.222.222.222 (45)
22:13:24.862040 IP 10.0.0.2.55555 > 10.0.0.1.domain: 0+ A? www.ggg.com. (29)
22:13:24.868721 IP 10.0.0.1.domain > 10.0.0.2.55555: 0 1/0/0 A 222.222.222.222 (45)
22:13:24.911449 IP 10.0.0.2.55555 > 10.0.0.1.domain: 0+ A? www.ggg.com. (29)
22:13:24.926557 IP 10.0.0.1.domain > 10.0.0.2.55555: 0 1/0/0 A 222.222.222.222 (45)
22:13:24.987816 IP 10.0.0.2.55555 > 10.0.0.1.domain: 0+ A? www.ggg.com. (29)
22:13:25.001713 IP 10.0.0.1.domain > 10.0.0.2.55555: 0 1/0/0 A 222.222.222.222 (45)
22:13:25.077516 IP 10.0.0.2.55555 > 10.0.0.1.domain: 0+ A? www.ggg.com. (29)
22:13:25.081407 IP 10.0.0.1.domain > 10.0.0.2.55555: 0 1/0/0 A 222.222.222.222 (45)
22:13:25.140924 IP 10.0.0.2.55555 > 10.0.0.1.domain: 0+ A? www.ggg.com. (29)
22:13:25.143629 IP 10.0.0.1.domain > 10.0.0.2.55555: 0 1/0/0 A 222.222.222.222 (45)
22:13:25.185477 IP 10.0.0.2.55555 > 10.0.0.1.domain: 0+ A? www.ggg.com. (29)
22:13:25.188084 IP 10.0.0.1.domain > 10.0.0.2.55555: 0 1/0/0 A 222.222.222.222 (45)
22:13:25.255712 IP 10.0.0.2.55555 > 10.0.0.1.domain: 0+ A? www.ggg.com. (29)
22:13:25.266260 IP 10.0.0.1.domain > 10.0.0.2.55555: 0 1/0/0 A 222.222.222.222 (45)
22:13:25.310442 IP 10.0.0.2.55555 > 10.0.0.1.domain: 0+ A? www.ggg.com. (29)
22:13:25.315362 IP 10.0.0.1.domain > 10.0.0.2.55555: 0 1/0/0 A 222.222.222.222 (45)
22:13:25.358755 IP 10.0.0.2.55555 > 10.0.0.1.domain: 0+ A? www.ggg.com. (29)
22:13:25.376531 IP 10.0.0.1.domain > 10.0.0.2.55555: 0 1/0/0 A 222.222.222.222 (45)
22:13:25.459907 IP 10.0.0.2.55555 > 10.0.0.1.domain: 0+ A? www.ggg.com. (29)
22:13:25.467761 IP 10.0.0.1.domain > 10.0.0.2.55555: 0 1/0/0 A 222.222.222.222 (45)
22:13:25.514060 IP 10.0.0.2.55555 > 10.0.0.1.domain: 0+ A? www.ggg.com. (29)
22:13:25.517593 IP 10.0.0.1.domain > 10.0.0.2.55555: 0 1/0/0 A 222.222.222.222 (45)
22:13:25.573413 IP 10.0.0.2.55555 > 10.0.0.1.domain: 0+ A? www.ggg.com. (29)
22:13:25.578230 IP 10.0.0.1.domain > 10.0.0.2.55555: 0 1/0/0 A 222.222.222.222 (45)
22:13:25.628510 IP 10.0.0.2.55555 > 10.0.0.1.domain: 0+ A? www.ggg.com. (29)
22:13:25.634943 IP 10.0.0.1.domain > 10.0.0.2.55555: 0 1/0/0 A 222.222.222.222 (45)
22:13:25.733679 IP 10.0.0.2.55555 > 10.0.0.1.domain: 0+ A? www.ggg.com. (29)
22:13:25.743985 IP 10.0.0.1.domain > 10.0.0.2.55555: 0 1/0/0 A 222.222.222.222 (45)
22:13:25.854237 IP 10.0.0.2.55555 > 10.0.0.1.domain: 0+ A? www.ggg.com. (29)
22:13:25.857161 IP 10.0.0.1.domain > 10.0.0.2.55555: 0 1/0/0 A 222.222.222.222 (45)
22:13:25.946868 IP 10.0.0.2.55555 > 10.0.0.1.domain: 0+ A? www.ggg.com. (29)
22:13:25.951087 IP 10.0.0.1.domain > 10.0.0.2.55555: 0 1/0/0 A 222.222.222.222 (45)
22:13:26.020526 IP 10.0.0.2.55555 > 10.0.0.1.domain: 0+ A? www.ggg.com. (29)
22:13:26.028659 IP 10.0.0.1.domain > 10.0.0.2.55555: 0 1/0/0 A 222.222.222.222 (45)
22:13:26.108165 IP 10.0.0.2.55555 > 10.0.0.1.domain: 0+ A? www.ggg.com. (29)
22:13:26.110470 IP 10.0.0.1.domain > 10.0.0.2.55555: 0 1/0/0 A 222.222.222.222 (45)
22:13:26.224570 IP 10.0.0.2.55555 > 10.0.0.1.domain: 0+ A? www.ggg.com. (29)
22:13:26.229030 IP 10.0.0.1.domain > 10.0.0.2.55555: 0 1/0/0 A 222.222.222.222 (45)
22:13:26.368998 IP 10.0.0.2.55555 > 10.0.0.1.domain: 0+ A? www.ggg.com. (29)
22:13:26.371214 IP 10.0.0.1.domain > 10.0.0.2.55555: 0 1/0/0 A 222.222.222.222 (45)
22:13:26.463931 IP 10.0.0.2.55555 > 10.0.0.1.domain: 0+ A? www.ggg.com. (29)
22:13:26.467619 IP 10.0.0.1.domain > 10.0.0.2.55555: 0 1/0/0 A 222.222.222.222 (45)
22:13:26.531599 IP 10.0.0.2.55555 > 10.0.0.1.domain: 0+ A? www.ggg.com. (29)
22:13:26.542053 IP 10.0.0.1.domain > 10.0.0.2.55555: 0 1/0/0 A 222.222.222.222 (45)
22:13:26.634130 IP 10.0.0.2.55555 > 10.0.0.1.domain: 0+ A? www.ggg.com. (29)
22:13:26.643074 IP 10.0.0.1.domain > 10.0.0.2.55555: 0 1/0/0 A 222.222.222.222 (45)
22:13:26.723349 IP 10.0.0.2.55555 > 10.0.0.1.domain: 0+ A? www.ggg.com. (29)
22:13:26.729910 IP 10.0.0.1.domain > 10.0.0.2.55555: 0 1/0/0 A 222.222.222.222 (45)

