22:16:04.701064 IP 10.0.0.2.55555 > 10.0.0.1.domain: 0+ A? www.ggg.com. (29)
22:16:04.721393 IP 10.0.0.1.domain > 10.0.0.2.55555: 0 1/0/0 A 222.222.222.222 (45)
22:16:04.921561 IP 10.0.0.2.55555 > 10.0.0.1.domain: 0+ A? www.ggg.com. (29)
22:16:04.930753 IP 10.0.0.1.domain > 10.0.0.2.55555: 0 1/0/0 A 222.222.222.222 (45)
22:16:05.039087 IP 10.0.0.2.55555 > 10.0.0.1.domain: 0+ A? www.ggg.com. (29)
22:16:05.043622 IP 10.0.0.1.domain > 10.0.0.2.55555: 0 1/0/0 A 222.222.222.222 (45)
22:16:05.254541 IP 10.0.0.2.55555 > 10.0.0.1.domain: 0+ A? www.ggg.com. (29)
22:16:05.258784 IP 10.0.0.1.domain > 10.0.0.2.55555: 0 1/0/0 A 222.222.222.222 (45)
22:16:05.383303 IP 10.0.0.2.55555 > 10.0.0.1.domain: 0+ A? www.ggg.com. (29)
22:16:05.394096 IP 10.0.0.1.domain > 10.0.0.2.55555: 0 1/0/0 A 222.222.222.222 (45)
22:16:05.538621 IP 10.0.0.2.55555 > 10.0.0.1.domain: 0+ A? www.ggg.com. (29)
22:16:05.550478 IP 10.0.0.1.domain > 10.0.0.2.55555: 0 1/0/0 A 222.222.222.222 (45)
22:16:05.723674 IP 10.0.0.2.55555 > 10.0.0.1.domain: 0+ A? www.ggg.com. (29)
22:16:05.739250 IP 10.0.0.1.domain > 10.0.0.2.55555: 0 1/0/0 A 222.222.222.222 (45)
22:16:05.907486 IP 10.0.0.2.55555 > 10.0.0.1.domain: 0+ A? www.ggg.com. (29)
22:16:05.923821 IP 10.0.0.1.domain > 10.0.0.2.55555: 0 1/0/0 A 222.222.222.222 (45)
22:16:06.145898 IP 10.0.0.2.55555 > 10.0.0.1.domain: 0+ A? www.ggg.com. (29)
22:16:06.163911 IP 10.0.0.1.domain > 10.0.0.2.55555: 0 1/0/0 A 222.222.222.222 (45)
22:16:06.326146 IP 10.0.0.2.55555 > 10.0.0.1.domain: 0+ A? www.ggg.com. (29)
22:16:06.334424 IP 10.0.0.1.domain > 10.0.0.2.55555: 0 1/0/0 A 222.222.222.222 (45)
22:16:06.503288 IP 10.0.0.2.55555 > 10.0.0.1.domain: 0+ A? www.ggg.com. (29)
22:16:06.511362 IP 10.0.0.1.domain > 10.0.0.2.55555: 0 1/0/0 A 222.222.222.222 (45)
22:16:06.682520 IP 10.0.0.2.55555 > 10.0.0.1.domain: 0+ A? www.ggg.com. (29)
22:16:06.698995 IP 10.0.0.1.domain > 10.0.0.2.55555: 0 1/0/0 A 222.222.222.222 (45)
22:16:06.853448 IP 10.0.0.2.55555 > 10.0.0.1.domain: 0+ A? www.ggg.com. (29)
22:16:06.860040 IP 10.0.0.1.domain > 10.0.0.2.55555: 0 1/0/0 A 222.222.222.222 (45)
22:16:07.014229 IP 10.0.0.2.55555 > 10.0.0.1.domain: 0+ A? www.ggg.com. (29)
22:16:07.024641 IP 10.0.0.1.domain > 10.0.0.2.55555: 0 1/0/0 A 222.222.222.222 (45)
22:16:07.196106 IP 10.0.0.2.55555 > 10.0.0.1.domain: 0+ A? www.ggg.com. (29)
22:16:07.209631 IP 10.0.0.1.domain > 10.0.0.2.55555: 0 1/0/0 A 222.222.222.222 (45)
22:16:07.392120 IP 10.0.0.2.55555 > 10.0.0.1.domain: 0+ A? www.ggg.com. (29)
22:16:07.396733 IP 10.0.0.1.domain > 10.0.0.2.55555: 0 1/0/0 A 222.222.222.222 (45)
22:16:07.575367 IP 10.0.0.2.55555 > 10.0.0.1.domain: 0+ A? www.ggg.com. (29)
22:16:07.586328 IP 10.0.0.1.domain > 10.0.0.2.55555: 0 1/0/0 A 222.222.222.222 (45)
22:16:07.825872 IP 10.0.0.2.55555 > 10.0.0.1.domain: 0+ A? www.ggg.com. (29)
22:16:07.851603 IP 10.0.0.1.domain > 10.0.0.2.55555: 0 1/0/0 A 222.222.222.222 (45)
22:16:08.043635 IP 10.0.0.2.55555 > 10.0.0.1.domain: 0+ A? www.ggg.com. (29)
22:16:08.046580 IP 10.0.0.1.domain > 10.0.0.2.55555: 0 1/0/0 A 222.222.222.222 (45)
22:16:08.207638 IP 10.0.0.2.55555 > 10.0.0.1.domain: 0+ A? www.ggg.com. (29)
22:16:08.242667 IP 10.0.0.1.domain > 10.0.0.2.55555: 0 1/0/0 A 222.222.222.222 (45)
22:16:08.427972 IP 10.0.0.2.55555 > 10.0.0.1.domain: 0+ A? www.ggg.com. (29)
22:16:08.442099 IP 10.0.0.1.domain > 10.0.0.2.55555: 0 1/0/0 A 222.222.222.222 (45)
22:16:08.672760 IP 10.0.0.2.55555 > 10.0.0.1.domain: 0+ A? www.ggg.com. (29)
22:16:08.677073 IP 10.0.0.1.domain > 10.0.0.2.55555: 0 1/0/0 A 222.222.222.222 (45)
22:16:08.790301 IP 10.0.0.2.55555 > 10.0.0.1.domain: 0+ A? www.ggg.com. (29)
22:16:08.796426 IP 10.0.0.1.domain > 10.0.0.2.55555: 0 1/0/0 A 222.222.222.222 (45)
22:16:08.887133 IP 10.0.0.2.55555 > 10.0.0.1.domain: 0+ A? www.ggg.com. (29)
22:16:08.890545 IP 10.0.0.1.domain > 10.0.0.2.55555: 0 1/0/0 A 222.222.222.222 (45)
22:16:08.941199 IP 10.0.0.2.55555 > 10.0.0.1.domain: 0+ A? www.ggg.com. (29)
22:16:08.942806 IP 10.0.0.1.domain > 10.0.0.2.55555: 0 1/0/0 A 222.222.222.222 (45)
22:16:09.022463 IP 10.0.0.2.55555 > 10.0.0.1.domain: 0+ A? www.ggg.com. (29)
22:16:09.028586 IP 10.0.0.1.domain > 10.0.0.2.55555: 0 1/0/0 A 222.222.222.222 (45)
22:16:09.262445 IP 10.0.0.2.55555 > 10.0.0.1.domain: 0+ A? www.ggg.com. (29)
22:16:09.292359 IP 10.0.0.1.domain > 10.0.0.2.55555: 0 1/0/0 A 222.222.222.222 (45)
22:16:09.451856 IP 10.0.0.2.55555 > 10.0.0.1.domain: 0+ A? www.ggg.com. (29)
22:16:09.459346 IP 10.0.0.1.domain > 10.0.0.2.55555: 0 1/0/0 A 222.222.222.222 (45)
22:16:09.552257 IP 10.0.0.2.55555 > 10.0.0.1.domain: 0+ A? www.ggg.com. (29)
22:16:09.583192 IP 10.0.0.1.domain > 10.0.0.2.55555: 0 1/0/0 A 222.222.222.222 (45)
22:16:09.714388 IP 10.0.0.2.55555 > 10.0.0.1.domain: 0+ A? www.ggg.com. (29)
22:16:09.736414 IP 10.0.0.1.domain > 10.0.0.2.55555: 0 1/0/0 A 222.222.222.222 (45)
22:16:09.858022 IP 10.0.0.2.55555 > 10.0.0.1.domain: 0+ A? www.ggg.com. (29)
22:16:09.870610 IP 10.0.0.1.domain > 10.0.0.2.55555: 0 1/0/0 A 222.222.222.222 (45)
22:16:09.967273 IP 10.0.0.2.55555 > 10.0.0.1.domain: 0+ A? www.ggg.com. (29)
22:16:09.979735 IP 10.0.0.1.domain > 10.0.0.2.55555: 0 1/0/0 A 222.222.222.222 (45)
22:16:10.018622 IP 10.0.0.2.55555 > 10.0.0.1.domain: 0+ A? www.ggg.com. (29)
22:16:10.039514 IP 10.0.0.1.domain > 10.0.0.2.55555: 0 1/0/0 A 222.222.222.222 (45)
22:16:10.097198 IP 10.0.0.2.55555 > 10.0.0.1.domain: 0+ A? www.ggg.com. (29)
22:16:10.106721 IP 10.0.0.1.domain > 10.0.0.2.55555: 0 1/0/0 A 222.222.222.222 (45)
22:16:10.247102 IP 10.0.0.2.55555 > 10.0.0.1.domain: 0+ A? www.ggg.com. (29)
22:16:10.260532 IP 10.0.0.1.domain > 10.0.0.2.55555: 0 1/0/0 A 222.222.222.222 (45)
22:16:10.399281 IP 10.0.0.2.55555 > 10.0.0.1.domain: 0+ A? www.ggg.com. (29)
22:16:10.416178 IP 10.0.0.1.domain > 10.0.0.2.55555: 0 1/0/0 A 222.222.222.222 (45)
22:16:10.577902 IP 10.0.0.2.55555 > 10.0.0.1.domain: 0+ A? www.ggg.com. (29)
22:16:10.581636 IP 10.0.0.1.domain > 10.0.0.2.55555: 0 1/0/0 A 222.222.222.222 (45)
22:16:10.681133 IP 10.0.0.2.55555 > 10.0.0.1.domain: 0+ A? www.ggg.com. (29)
22:16:10.691641 IP 10.0.0.1.domain > 10.0.0.2.55555: 0 1/0/0 A 222.222.222.222 (45)
22:16:10.810455 IP 10.0.0.2.55555 > 10.0.0.1.domain: 0+ A? www.ggg.com. (29)
22:16:10.827734 IP 10.0.0.1.domain > 10.0.0.2.55555: 0 1/0/0 A 222.222.222.222 (45)
22:16:10.965383 IP 10.0.0.2.55555 > 10.0.0.1.domain: 0+ A? www.ggg.com. (29)
22:16:10.974170 IP 10.0.0.1.domain > 10.0.0.2.55555: 0 1/0/0 A 222.222.222.222 (45)
22:16:11.107379 IP 10.0.0.2.55555 > 10.0.0.1.domain: 0+ A? www.ggg.com. (29)
22:16:11.128181 IP 10.0.0.1.domain > 10.0.0.2.55555: 0 1/0/0 A 222.222.222.222 (45)
22:16:11.241811 IP 10.0.0.2.55555 > 10.0.0.1.domain: 0+ A? www.ggg.com. (29)
22:16:11.251637 IP 10.0.0.1.domain > 10.0.0.2.55555: 0 1/0/0 A 222.222.222.222 (45)
22:16:11.366624 IP 10.0.0.2.55555 > 10.0.0.1.domain: 0+ A? www.ggg.com. (29)
22:16:11.371649 IP 10.0.0.1.domain > 10.0.0.2.55555: 0 1/0/0 A 222.222.222.222 (45)
22:16:11.527834 IP 10.0.0.2.55555 > 10.0.0.1.domain: 0+ A? www.ggg.com. (29)
22:16:11.549484 IP 10.0.0.1.domain > 10.0.0.2.55555: 0 1/0/0 A 222.222.222.222 (45)
22:16:11.666452 IP 10.0.0.2.55555 > 10.0.0.1.domain: 0+ A? www.ggg.com. (29)
22:16:11.668747 IP 10.0.0.1.domain > 10.0.0.2.55555: 0 1/0/0 A 222.222.222.222 (45)
22:16:11.817039 IP 10.0.0.2.55555 > 10.0.0.1.domain: 0+ A? www.ggg.com. (29)
22:16:11.828882 IP 10.0.0.1.domain > 10.0.0.2.55555: 0 1/0/0 A 222.222.222.222 (45)
22:16:11.975318 IP 10.0.0.2.55555 > 10.0.0.1.domain: 0+ A? www.ggg.com. (29)
22:16:11.991719 IP 10.0.0.1.domain > 10.0.0.2.55555: 0 1/0/0 A 222.222.222.222 (45)
22:16:12.156145 IP 10.0.0.2.55555 > 10.0.0.1.domain: 0+ A? www.ggg.com. (29)
22:16:12.196183 IP 10.0.0.1.domain > 10.0.0.2.55555: 0 1/0/0 A 222.222.222.222 (45)
22:16:12.409049 IP 10.0.0.2.55555 > 10.0.0.1.domain: 0+ A? www.ggg.com. (29)
22:16:12.443121 IP 10.0.0.1.domain > 10.0.0.2.55555: 0 1/0/0 A 222.222.222.222 (45)
22:16:12.654645 IP 10.0.0.2.55555 > 10.0.0.1.domain: 0+ A? www.ggg.com. (29)
22:16:12.697122 IP 10.0.0.1.domain > 10.0.0.2.55555: 0 1/0/0 A 222.222.222.222 (45)
22:16:12.918342 IP 10.0.0.2.55555 > 10.0.0.1.domain: 0+ A? www.ggg.com. (29)
22:16:12.934589 IP 10.0.0.1.domain > 10.0.0.2.55555: 0 1/0/0 A 222.222.222.222 (45)
22:16:13.195105 IP 10.0.0.2.55555 > 10.0.0.1.domain: 0+ A? www.ggg.com. (29)
22:16:13.214937 IP 10.0.0.1.domain > 10.0.0.2.55555: 0 1/0/0 A 222.222.222.222 (45)
22:16:13.402950 IP 10.0.0.2.55555 > 10.0.0.1.domain: 0+ A? www.ggg.com. (29)
22:16:13.406369 IP 10.0.0.1.domain > 10.0.0.2.55555: 0 1/0/0 A 222.222.222.222 (45)
22:16:13.572670 IP 10.0.0.2.55555 > 10.0.0.1.domain: 0+ A? www.ggg.com. (29)
22:16:13.585500 IP 10.0.0.1.domain > 10.0.0.2.55555: 0 1/0/0 A 222.222.222.222 (45)
22:16:13.773390 IP 10.0.0.2.55555 > 10.0.0.1.domain: 0+ A? www.ggg.com. (29)
22:16:13.776023 IP 10.0.0.1.domain > 10.0.0.2.55555: 0 1/0/0 A 222.222.222.222 (45)
22:16:13.924845 IP 10.0.0.2.55555 > 10.0.0.1.domain: 0+ A? www.ggg.com. (29)
22:16:13.932414 IP 10.0.0.1.domain > 10.0.0.2.55555: 0 1/0/0 A 222.222.222.222 (45)
22:16:14.101409 IP 10.0.0.2.55555 > 10.0.0.1.domain: 0+ A? www.ggg.com. (29)
22:16:14.109485 IP 10.0.0.1.domain > 10.0.0.2.55555: 0 1/0/0 A 222.222.222.222 (45)
22:16:14.300312 IP 10.0.0.2.55555 > 10.0.0.1.domain: 0+ A? www.ggg.com. (29)
22:16:14.306400 IP 10.0.0.1.domain > 10.0.0.2.55555: 0 1/0/0 A 222.222.222.222 (45)
22:16:14.514285 IP 10.0.0.2.55555 > 10.0.0.1.domain: 0+ A? www.ggg.com. (29)
22:16:14.521699 IP 10.0.0.1.domain > 10.0.0.2.55555: 0 1/0/0 A 222.222.222.222 (45)
22:16:14.675644 IP 10.0.0.2.55555 > 10.0.0.1.domain: 0+ A? www.ggg.com. (29)
22:16:14.686872 IP 10.0.0.1.domain > 10.0.0.2.55555: 0 1/0/0 A 222.222.222.222 (45)
22:16:14.851458 IP 10.0.0.2.55555 > 10.0.0.1.domain: 0+ A? www.ggg.com. (29)
22:16:14.873111 IP 10.0.0.1.domain > 10.0.0.2.55555: 0 1/0/0 A 222.222.222.222 (45)
22:16:15.055529 IP 10.0.0.2.55555 > 10.0.0.1.domain: 0+ A? www.ggg.com. (29)
22:16:15.057339 IP 10.0.0.1.domain > 10.0.0.2.55555: 0 1/0/0 A 222.222.222.222 (45)
22:16:15.129312 IP 10.0.0.2.55555 > 10.0.0.1.domain: 0+ A? www.ggg.com. (29)
22:16:15.148321 IP 10.0.0.1.domain > 10.0.0.2.55555: 0 1/0/0 A 222.222.222.222 (45)
22:16:15.342981 IP 10.0.0.2.55555 > 10.0.0.1.domain: 0+ A? www.ggg.com. (29)
22:16:15.346463 IP 10.0.0.1.domain > 10.0.0.2.55555: 0 1/0/0 A 222.222.222.222 (45)
22:16:15.506500 IP 10.0.0.2.55555 > 10.0.0.1.domain: 0+ A? www.ggg.com. (29)
22:16:15.512059 IP 10.0.0.1.domain > 10.0.0.2.55555: 0 1/0/0 A 222.222.222.222 (45)
22:16:15.677049 IP 10.0.0.2.55555 > 10.0.0.1.domain: 0+ A? www.ggg.com. (29)
22:16:15.698013 IP 10.0.0.1.domain > 10.0.0.2.55555: 0 1/0/0 A 222.222.222.222 (45)
22:16:15.806239 IP 10.0.0.2.55555 > 10.0.0.1.domain: 0+ A? www.ggg.com. (29)
22:16:15.835070 IP 10.0.0.1.domain > 10.0.0.2.55555: 0 1/0/0 A 222.222.222.222 (45)
22:16:15.952014 IP 10.0.0.2.55555 > 10.0.0.1.domain: 0+ A? www.ggg.com. (29)
22:16:15.973991 IP 10.0.0.1.domain > 10.0.0.2.55555: 0 1/0/0 A 222.222.222.222 (45)
22:16:16.073649 IP 10.0.0.2.55555 > 10.0.0.1.domain: 0+ A? www.ggg.com. (29)
22:16:16.081109 IP 10.0.0.1.domain > 10.0.0.2.55555: 0 1/0/0 A 222.222.222.222 (45)
22:16:16.223497 IP 10.0.0.2.55555 > 10.0.0.1.domain: 0+ A? www.ggg.com. (29)
22:16:16.239884 IP 10.0.0.1.domain > 10.0.0.2.55555: 0 1/0/0 A 222.222.222.222 (45)
22:16:16.395695 IP 10.0.0.2.55555 > 10.0.0.1.domain: 0+ A? www.ggg.com. (29)
22:16:16.405528 IP 10.0.0.1.domain > 10.0.0.2.55555: 0 1/0/0 A 222.222.222.222 (45)
22:16:16.563181 IP 10.0.0.2.55555 > 10.0.0.1.domain: 0+ A? www.ggg.com. (29)
22:16:16.574033 IP 10.0.0.1.domain > 10.0.0.2.55555: 0 1/0/0 A 222.222.222.222 (45)
22:16:16.783897 IP 10.0.0.2.55555 > 10.0.0.1.domain: 0+ A? www.ggg.com. (29)
22:16:16.790425 IP 10.0.0.1.domain > 10.0.0.2.55555: 0 1/0/0 A 222.222.222.222 (45)
22:16:16.923942 IP 10.0.0.2.55555 > 10.0.0.1.domain: 0+ A? www.ggg.com. (29)
22:16:16.940132 IP 10.0.0.1.domain > 10.0.0.2.55555: 0 1/0/0 A 222.222.222.222 (45)
22:16:17.142016 IP 10.0.0.2.55555 > 10.0.0.1.domain: 0+ A? www.ggg.com. (29)
22:16:17.153123 IP 10.0.0.1.domain > 10.0.0.2.55555: 0 1/0/0 A 222.222.222.222 (45)
22:16:17.286850 IP 10.0.0.2.55555 > 10.0.0.1.domain: 0+ A? www.ggg.com. (29)
22:16:17.294086 IP 10.0.0.1.domain > 10.0.0.2.55555: 0 1/0/0 A 222.222.222.222 (45)
22:16:17.477952 IP 10.0.0.2.55555 > 10.0.0.1.domain: 0+ A? www.ggg.com. (29)
22:16:17.491560 IP 10.0.0.1.domain > 10.0.0.2.55555: 0 1/0/0 A 222.222.222.222 (45)
22:16:17.647746 IP 10.0.0.2.55555 > 10.0.0.1.domain: 0+ A? www.ggg.com. (29)
22:16:17.659791 IP 10.0.0.1.domain > 10.0.0.2.55555: 0 1/0/0 A 222.222.222.222 (45)
22:16:17.881031 IP 10.0.0.2.55555 > 10.0.0.1.domain: 0+ A? www.ggg.com. (29)
22:16:17.887291 IP 10.0.0.1.domain > 10.0.0.2.55555: 0 1/0/0 A 222.222.222.222 (45)
22:16:18.060778 IP 10.0.0.2.55555 > 10.0.0.1.domain: 0+ A? www.ggg.com. (29)
22:16:18.071723 IP 10.0.0.1.domain > 10.0.0.2.55555: 0 1/0/0 A 222.222.222.222 (45)
22:16:18.238873 IP 10.0.0.2.55555 > 10.0.0.1.domain: 0+ A? www.ggg.com. (29)
22:16:18.249021 IP 10.0.0.1.domain > 10.0.0.2.55555: 0 1/0/0 A 222.222.222.222 (45)
22:16:18.378407 IP 10.0.0.2.55555 > 10.0.0.1.domain: 0+ A? www.ggg.com. (29)
22:16:18.403799 IP 10.0.0.1.domain > 10.0.0.2.55555: 0 1/0/0 A 222.222.222.222 (45)
22:16:18.554832 IP 10.0.0.2.55555 > 10.0.0.1.domain: 0+ A? www.ggg.com. (29)
22:16:18.561346 IP 10.0.0.1.domain > 10.0.0.2.55555: 0 1/0/0 A 222.222.222.222 (45)
22:16:18.706189 IP 10.0.0.2.55555 > 10.0.0.1.domain: 0+ A? www.ggg.com. (29)
22:16:18.721724 IP 10.0.0.1.domain > 10.0.0.2.55555: 0 1/0/0 A 222.222.222.222 (45)
22:16:18.927723 IP 10.0.0.2.55555 > 10.0.0.1.domain: 0+ A? www.ggg.com. (29)
22:16:18.939572 IP 10.0.0.1.domain > 10.0.0.2.55555: 0 1/0/0 A 222.222.222.222 (45)
22:16:19.154680 IP 10.0.0.2.55555 > 10.0.0.1.domain: 0+ A? www.ggg.com. (29)
22:16:19.159898 IP 10.0.0.1.domain > 10.0.0.2.55555: 0 1/0/0 A 222.222.222.222 (45)
22:16:19.325374 IP 10.0.0.2.55555 > 10.0.0.1.domain: 0+ A? www.ggg.com. (29)
22:16:19.327919 IP 10.0.0.1.domain > 10.0.0.2.55555: 0 1/0/0 A 222.222.222.222 (45)
22:16:19.489298 IP 10.0.0.2.55555 > 10.0.0.1.domain: 0+ A? www.ggg.com. (29)
22:16:19.510053 IP 10.0.0.1.domain > 10.0.0.2.55555: 0 1/0/0 A 222.222.222.222 (45)
22:16:19.690891 IP 10.0.0.2.55555 > 10.0.0.1.domain: 0+ A? www.ggg.com. (29)
22:16:19.703714 IP 10.0.0.1.domain > 10.0.0.2.55555: 0 1/0/0 A 222.222.222.222 (45)
22:16:19.915723 IP 10.0.0.2.55555 > 10.0.0.1.domain: 0+ A? www.ggg.com. (29)
22:16:19.941175 IP 10.0.0.1.domain > 10.0.0.2.55555: 0 1/0/0 A 222.222.222.222 (45)
22:16:20.116220 IP 10.0.0.2.55555 > 10.0.0.1.domain: 0+ A? www.ggg.com. (29)
22:16:20.126925 IP 10.0.0.1.domain > 10.0.0.2.55555: 0 1/0/0 A 222.222.222.222 (45)
22:16:20.297055 IP 10.0.0.2.55555 > 10.0.0.1.domain: 0+ A? www.ggg.com. (29)
22:16:20.298753 IP 10.0.0.1.domain > 10.0.0.2.55555: 0 1/0/0 A 222.222.222.222 (45)
22:16:20.439507 IP 10.0.0.2.55555 > 10.0.0.1.domain: 0+ A? www.ggg.com. (29)
22:16:20.460992 IP 10.0.0.1.domain > 10.0.0.2.55555: 0 1/0/0 A 222.222.222.222 (45)
22:16:20.694509 IP 10.0.0.2.55555 > 10.0.0.1.domain: 0+ A? www.ggg.com. (29)
22:16:20.760015 IP 10.0.0.1.domain > 10.0.0.2.55555: 0 1/0/0 A 222.222.222.222 (45)
22:16:21.054878 IP 10.0.0.2.55555 > 10.0.0.1.domain: 0+ A? www.ggg.com. (29)
22:16:21.078556 IP 10.0.0.1.domain > 10.0.0.2.55555: 0 1/0/0 A 222.222.222.222 (45)
22:16:21.243892 IP 10.0.0.2.55555 > 10.0.0.1.domain: 0+ A? www.ggg.com. (29)
22:16:21.257293 IP 10.0.0.1.domain > 10.0.0.2.55555: 0 1/0/0 A 222.222.222.222 (45)
22:16:21.480025 IP 10.0.0.2.55555 > 10.0.0.1.domain: 0+ A? www.ggg.com. (29)
22:16:21.512946 IP 10.0.0.1.domain > 10.0.0.2.55555: 0 1/0/0 A 222.222.222.222 (45)
22:16:21.739037 IP 10.0.0.2.55555 > 10.0.0.1.domain: 0+ A? www.ggg.com. (29)
22:16:21.751911 IP 10.0.0.1.domain > 10.0.0.2.55555: 0 1/0/0 A 222.222.222.222 (45)
22:16:21.924336 IP 10.0.0.2.55555 > 10.0.0.1.domain: 0+ A? www.ggg.com. (29)
22:16:21.926434 IP 10.0.0.1.domain > 10.0.0.2.55555: 0 1/0/0 A 222.222.222.222 (45)
22:16:22.004908 IP 10.0.0.2.55555 > 10.0.0.1.domain: 0+ A? www.ggg.com. (29)
22:16:22.028329 IP 10.0.0.1.domain > 10.0.0.2.55555: 0 1/0/0 A 222.222.222.222 (45)

