11:09:13.926348 IP 10.0.0.2.55555 > 10.0.0.1.domain: 0+ A? www.ggg.com. (29)
11:09:13.933792 IP 10.0.0.1.domain > 10.0.0.2.55555: 0 1/0/0 A 222.222.222.222 (45)
11:09:14.019462 IP 10.0.0.2.55555 > 10.0.0.1.domain: 0+ A? www.ggg.com. (29)
11:09:14.025684 IP 10.0.0.1.domain > 10.0.0.2.55555: 0 1/0/0 A 222.222.222.222 (45)
11:09:14.068609 IP 10.0.0.2.55555 > 10.0.0.1.domain: 0+ A? www.ggg.com. (29)
11:09:14.073575 IP 10.0.0.1.domain > 10.0.0.2.55555: 0 1/0/0 A 222.222.222.222 (45)
11:09:14.116566 IP 10.0.0.2.55555 > 10.0.0.1.domain: 0+ A? www.ggg.com. (29)
11:09:14.121987 IP 10.0.0.1.domain > 10.0.0.2.55555: 0 1/0/0 A 222.222.222.222 (45)
11:09:14.165311 IP 10.0.0.2.55555 > 10.0.0.1.domain: 0+ A? www.ggg.com. (29)
11:09:14.171143 IP 10.0.0.1.domain > 10.0.0.2.55555: 0 1/0/0 A 222.222.222.222 (45)
11:09:14.228167 IP 10.0.0.2.55555 > 10.0.0.1.domain: 0+ A? www.ggg.com. (29)
11:09:14.235746 IP 10.0.0.1.domain > 10.0.0.2.55555: 0 1/0/0 A 222.222.222.222 (45)
11:09:14.303567 IP 10.0.0.2.55555 > 10.0.0.1.domain: 0+ A? www.ggg.com. (29)
11:09:14.310029 IP 10.0.0.1.domain > 10.0.0.2.55555: 0 1/0/0 A 222.222.222.222 (45)
11:09:14.360940 IP 10.0.0.2.55555 > 10.0.0.1.domain: 0+ A? www.ggg.com. (29)
11:09:14.366878 IP 10.0.0.1.domain > 10.0.0.2.55555: 0 1/0/0 A 222.222.222.222 (45)
11:09:14.405039 IP 10.0.0.2.55555 > 10.0.0.1.domain: 0+ A? www.ggg.com. (29)
11:09:14.412349 IP 10.0.0.1.domain > 10.0.0.2.55555: 0 1/0/0 A 222.222.222.222 (45)
11:09:14.441597 IP 10.0.0.2.55555 > 10.0.0.1.domain: 0+ A? www.ggg.com. (29)
11:09:14.446236 IP 10.0.0.1.domain > 10.0.0.2.55555: 0 1/0/0 A 222.222.222.222 (45)

