22:18:45.143717 IP 10.0.0.2.55555 > 10.0.0.1.domain: 0+ A? www.ggg.com. (29)
22:18:45.149816 IP 10.0.0.1.domain > 10.0.0.2.55555: 0 1/0/0 A 222.222.222.222 (45)
22:18:45.287308 IP 10.0.0.2.55555 > 10.0.0.1.domain: 0+ A? www.ggg.com. (29)
22:18:45.288542 IP 10.0.0.1.domain > 10.0.0.2.55555: 0 1/0/0 A 222.222.222.222 (45)
22:18:45.400003 IP 10.0.0.2.55555 > 10.0.0.1.domain: 0+ A? www.ggg.com. (29)
22:18:45.404269 IP 10.0.0.1.domain > 10.0.0.2.55555: 0 1/0/0 A 222.222.222.222 (45)
22:18:45.519183 IP 10.0.0.2.55555 > 10.0.0.1.domain: 0+ A? www.ggg.com. (29)
22:18:45.521248 IP 10.0.0.1.domain > 10.0.0.2.55555: 0 1/0/0 A 222.222.222.222 (45)
22:18:45.656385 IP 10.0.0.2.55555 > 10.0.0.1.domain: 0+ A? www.ggg.com. (29)
22:18:45.657642 IP 10.0.0.1.domain > 10.0.0.2.55555: 0 1/0/0 A 222.222.222.222 (45)
22:18:45.740009 IP 10.0.0.2.55555 > 10.0.0.1.domain: 0+ A? www.ggg.com. (29)
22:18:45.742954 IP 10.0.0.1.domain > 10.0.0.2.55555: 0 1/0/0 A 222.222.222.222 (45)
22:18:45.843491 IP 10.0.0.2.55555 > 10.0.0.1.domain: 0+ A? www.ggg.com. (29)
22:18:45.846116 IP 10.0.0.1.domain > 10.0.0.2.55555: 0 1/0/0 A 222.222.222.222 (45)
22:18:45.978143 IP 10.0.0.2.55555 > 10.0.0.1.domain: 0+ A? www.ggg.com. (29)
22:18:45.995361 IP 10.0.0.1.domain > 10.0.0.2.55555: 0 1/0/0 A 222.222.222.222 (45)
22:18:46.177713 IP 10.0.0.2.55555 > 10.0.0.1.domain: 0+ A? www.ggg.com. (29)
22:18:46.179779 IP 10.0.0.1.domain > 10.0.0.2.55555: 0 1/0/0 A 222.222.222.222 (45)
22:18:46.268924 IP 10.0.0.2.55555 > 10.0.0.1.domain: 0+ A? www.ggg.com. (29)
22:18:46.270767 IP 10.0.0.1.domain > 10.0.0.2.55555: 0 1/0/0 A 222.222.222.222 (45)
22:18:46.338066 IP 10.0.0.2.55555 > 10.0.0.1.domain: 0+ A? www.ggg.com. (29)
22:18:46.344554 IP 10.0.0.1.domain > 10.0.0.2.55555: 0 1/0/0 A 222.222.222.222 (45)
22:18:46.423707 IP 10.0.0.2.55555 > 10.0.0.1.domain: 0+ A? www.ggg.com. (29)
22:18:46.426547 IP 10.0.0.1.domain > 10.0.0.2.55555: 0 1/0/0 A 222.222.222.222 (45)
22:18:46.555111 IP 10.0.0.2.55555 > 10.0.0.1.domain: 0+ A? www.ggg.com. (29)
22:18:46.564221 IP 10.0.0.1.domain > 10.0.0.2.55555: 0 1/0/0 A 222.222.222.222 (45)
22:18:46.666150 IP 10.0.0.2.55555 > 10.0.0.1.domain: 0+ A? www.ggg.com. (29)
22:18:46.667428 IP 10.0.0.1.domain > 10.0.0.2.55555: 0 1/0/0 A 222.222.222.222 (45)
22:18:46.780002 IP 10.0.0.2.55555 > 10.0.0.1.domain: 0+ A? www.ggg.com. (29)
22:18:46.782289 IP 10.0.0.1.domain > 10.0.0.2.55555: 0 1/0/0 A 222.222.222.222 (45)
22:18:46.925522 IP 10.0.0.2.55555 > 10.0.0.1.domain: 0+ A? www.ggg.com. (29)
22:18:46.927470 IP 10.0.0.1.domain > 10.0.0.2.55555: 0 1/0/0 A 222.222.222.222 (45)
22:18:47.023890 IP 10.0.0.2.55555 > 10.0.0.1.domain: 0+ A? www.ggg.com. (29)
22:18:47.029526 IP 10.0.0.1.domain > 10.0.0.2.55555: 0 1/0/0 A 222.222.222.222 (45)
22:18:47.084343 IP 10.0.0.2.55555 > 10.0.0.1.domain: 0+ A? www.ggg.com. (29)
22:18:47.085520 IP 10.0.0.1.domain > 10.0.0.2.55555: 0 1/0/0 A 222.222.222.222 (45)
22:18:47.146947 IP 10.0.0.2.55555 > 10.0.0.1.domain: 0+ A? www.ggg.com. (29)
22:18:47.150589 IP 10.0.0.1.domain > 10.0.0.2.55555: 0 1/0/0 A 222.222.222.222 (45)
22:18:47.268190 IP 10.0.0.2.55555 > 10.0.0.1.domain: 0+ A? www.ggg.com. (29)
22:18:47.269753 IP 10.0.0.1.domain > 10.0.0.2.55555: 0 1/0/0 A 222.222.222.222 (45)
22:18:47.338885 IP 10.0.0.2.55555 > 10.0.0.1.domain: 0+ A? www.ggg.com. (29)
22:18:47.340026 IP 10.0.0.1.domain > 10.0.0.2.55555: 0 1/0/0 A 222.222.222.222 (45)
22:18:47.403413 IP 10.0.0.2.55555 > 10.0.0.1.domain: 0+ A? www.ggg.com. (29)
22:18:47.407146 IP 10.0.0.1.domain > 10.0.0.2.55555: 0 1/0/0 A 222.222.222.222 (45)
22:18:47.488608 IP 10.0.0.2.55555 > 10.0.0.1.domain: 0+ A? www.ggg.com. (29)
22:18:47.490091 IP 10.0.0.1.domain > 10.0.0.2.55555: 0 1/0/0 A 222.222.222.222 (45)
22:18:47.564726 IP 10.0.0.2.55555 > 10.0.0.1.domain: 0+ A? www.ggg.com. (29)
22:18:47.565880 IP 10.0.0.1.domain > 10.0.0.2.55555: 0 1/0/0 A 222.222.222.222 (45)
22:18:47.607552 IP 10.0.0.2.55555 > 10.0.0.1.domain: 0+ A? www.ggg.com. (29)
22:18:47.612628 IP 10.0.0.1.domain > 10.0.0.2.55555: 0 1/0/0 A 222.222.222.222 (45)
22:18:47.668611 IP 10.0.0.2.55555 > 10.0.0.1.domain: 0+ A? www.ggg.com. (29)
22:18:47.671634 IP 10.0.0.1.domain > 10.0.0.2.55555: 0 1/0/0 A 222.222.222.222 (45)
22:18:47.716733 IP 10.0.0.2.55555 > 10.0.0.1.domain: 0+ A? www.ggg.com. (29)
22:18:47.720439 IP 10.0.0.1.domain > 10.0.0.2.55555: 0 1/0/0 A 222.222.222.222 (45)
22:18:47.792509 IP 10.0.0.2.55555 > 10.0.0.1.domain: 0+ A? www.ggg.com. (29)
22:18:47.801764 IP 10.0.0.1.domain > 10.0.0.2.55555: 0 1/0/0 A 222.222.222.222 (45)
22:18:47.867257 IP 10.0.0.2.55555 > 10.0.0.1.domain: 0+ A? www.ggg.com. (29)
22:18:47.872305 IP 10.0.0.1.domain > 10.0.0.2.55555: 0 1/0/0 A 222.222.222.222 (45)
22:18:47.938130 IP 10.0.0.2.55555 > 10.0.0.1.domain: 0+ A? www.ggg.com. (29)
22:18:47.939492 IP 10.0.0.1.domain > 10.0.0.2.55555: 0 1/0/0 A 222.222.222.222 (45)
22:18:48.027166 IP 10.0.0.2.55555 > 10.0.0.1.domain: 0+ A? www.ggg.com. (29)
22:18:48.052205 IP 10.0.0.1.domain > 10.0.0.2.55555: 0 1/0/0 A 222.222.222.222 (45)
22:18:48.241385 IP 10.0.0.2.55555 > 10.0.0.1.domain: 0+ A? www.ggg.com. (29)
22:18:48.248757 IP 10.0.0.1.domain > 10.0.0.2.55555: 0 1/0/0 A 222.222.222.222 (45)
22:18:48.354375 IP 10.0.0.2.55555 > 10.0.0.1.domain: 0+ A? www.ggg.com. (29)
22:18:48.355626 IP 10.0.0.1.domain > 10.0.0.2.55555: 0 1/0/0 A 222.222.222.222 (45)
22:18:48.421497 IP 10.0.0.2.55555 > 10.0.0.1.domain: 0+ A? www.ggg.com. (29)
22:18:48.422805 IP 10.0.0.1.domain > 10.0.0.2.55555: 0 1/0/0 A 222.222.222.222 (45)
22:18:48.454008 IP 10.0.0.2.55555 > 10.0.0.1.domain: 0+ A? www.ggg.com. (29)
22:18:48.464315 IP 10.0.0.1.domain > 10.0.0.2.55555: 0 1/0/0 A 222.222.222.222 (45)
22:18:48.530405 IP 10.0.0.2.55555 > 10.0.0.1.domain: 0+ A? www.ggg.com. (29)
22:18:48.532240 IP 10.0.0.1.domain > 10.0.0.2.55555: 0 1/0/0 A 222.222.222.222 (45)
22:18:48.590434 IP 10.0.0.2.55555 > 10.0.0.1.domain: 0+ A? www.ggg.com. (29)
22:18:48.596418 IP 10.0.0.1.domain > 10.0.0.2.55555: 0 1/0/0 A 222.222.222.222 (45)
22:18:48.679834 IP 10.0.0.2.55555 > 10.0.0.1.domain: 0+ A? www.ggg.com. (29)
22:18:48.681571 IP 10.0.0.1.domain > 10.0.0.2.55555: 0 1/0/0 A 222.222.222.222 (45)
22:18:48.802637 IP 10.0.0.2.55555 > 10.0.0.1.domain: 0+ A? www.ggg.com. (29)
22:18:48.810550 IP 10.0.0.1.domain > 10.0.0.2.55555: 0 1/0/0 A 222.222.222.222 (45)
22:18:48.988484 IP 10.0.0.2.55555 > 10.0.0.1.domain: 0+ A? www.ggg.com. (29)
22:18:48.992408 IP 10.0.0.1.domain > 10.0.0.2.55555: 0 1/0/0 A 222.222.222.222 (45)
22:18:49.098614 IP 10.0.0.2.55555 > 10.0.0.1.domain: 0+ A? www.ggg.com. (29)
22:18:49.101995 IP 10.0.0.1.domain > 10.0.0.2.55555: 0 1/0/0 A 222.222.222.222 (45)
22:18:49.178739 IP 10.0.0.2.55555 > 10.0.0.1.domain: 0+ A? www.ggg.com. (29)
22:18:49.188060 IP 10.0.0.1.domain > 10.0.0.2.55555: 0 1/0/0 A 222.222.222.222 (45)
22:18:49.282404 IP 10.0.0.2.55555 > 10.0.0.1.domain: 0+ A? www.ggg.com. (29)
22:18:49.289637 IP 10.0.0.1.domain > 10.0.0.2.55555: 0 1/0/0 A 222.222.222.222 (45)
22:18:49.394255 IP 10.0.0.2.55555 > 10.0.0.1.domain: 0+ A? www.ggg.com. (29)
22:18:49.399094 IP 10.0.0.1.domain > 10.0.0.2.55555: 0 1/0/0 A 222.222.222.222 (45)
22:18:49.515341 IP 10.0.0.2.55555 > 10.0.0.1.domain: 0+ A? www.ggg.com. (29)
22:18:49.517134 IP 10.0.0.1.domain > 10.0.0.2.55555: 0 1/0/0 A 222.222.222.222 (45)
22:18:49.621240 IP 10.0.0.2.55555 > 10.0.0.1.domain: 0+ A? www.ggg.com. (29)
22:18:49.633082 IP 10.0.0.1.domain > 10.0.0.2.55555: 0 1/0/0 A 222.222.222.222 (45)
22:18:49.751429 IP 10.0.0.2.55555 > 10.0.0.1.domain: 0+ A? www.ggg.com. (29)
22:18:49.752566 IP 10.0.0.1.domain > 10.0.0.2.55555: 0 1/0/0 A 222.222.222.222 (45)
22:18:49.900013 IP 10.0.0.2.55555 > 10.0.0.1.domain: 0+ A? www.ggg.com. (29)
22:18:49.902635 IP 10.0.0.1.domain > 10.0.0.2.55555: 0 1/0/0 A 222.222.222.222 (45)
22:18:50.079427 IP 10.0.0.2.55555 > 10.0.0.1.domain: 0+ A? www.ggg.com. (29)
22:18:50.080859 IP 10.0.0.1.domain > 10.0.0.2.55555: 0 1/0/0 A 222.222.222.222 (45)
22:18:50.214721 IP 10.0.0.2.55555 > 10.0.0.1.domain: 0+ A? www.ggg.com. (29)
22:18:50.242128 IP 10.0.0.1.domain > 10.0.0.2.55555: 0 1/0/0 A 222.222.222.222 (45)
22:18:50.401086 IP 10.0.0.2.55555 > 10.0.0.1.domain: 0+ A? www.ggg.com. (29)
22:18:50.420031 IP 10.0.0.1.domain > 10.0.0.2.55555: 0 1/0/0 A 222.222.222.222 (45)
22:18:50.599389 IP 10.0.0.2.55555 > 10.0.0.1.domain: 0+ A? www.ggg.com. (29)
22:18:50.616305 IP 10.0.0.1.domain > 10.0.0.2.55555: 0 1/0/0 A 222.222.222.222 (45)
22:18:50.737799 IP 10.0.0.2.55555 > 10.0.0.1.domain: 0+ A? www.ggg.com. (29)
22:18:50.738796 IP 10.0.0.1.domain > 10.0.0.2.55555: 0 1/0/0 A 222.222.222.222 (45)
22:18:50.865859 IP 10.0.0.2.55555 > 10.0.0.1.domain: 0+ A? www.ggg.com. (29)
22:18:50.866881 IP 10.0.0.1.domain > 10.0.0.2.55555: 0 1/0/0 A 222.222.222.222 (45)
22:18:50.939758 IP 10.0.0.2.55555 > 10.0.0.1.domain: 0+ A? www.ggg.com. (29)
22:18:50.954641 IP 10.0.0.1.domain > 10.0.0.2.55555: 0 1/0/0 A 222.222.222.222 (45)
22:18:51.024361 IP 10.0.0.2.55555 > 10.0.0.1.domain: 0+ A? www.ggg.com. (29)
22:18:51.025805 IP 10.0.0.1.domain > 10.0.0.2.55555: 0 1/0/0 A 222.222.222.222 (45)
22:18:51.106202 IP 10.0.0.2.55555 > 10.0.0.1.domain: 0+ A? www.ggg.com. (29)
22:18:51.115772 IP 10.0.0.1.domain > 10.0.0.2.55555: 0 1/0/0 A 222.222.222.222 (45)
22:18:51.159397 IP 10.0.0.2.55555 > 10.0.0.1.domain: 0+ A? www.ggg.com. (29)
22:18:51.162996 IP 10.0.0.1.domain > 10.0.0.2.55555: 0 1/0/0 A 222.222.222.222 (45)
22:18:51.261877 IP 10.0.0.2.55555 > 10.0.0.1.domain: 0+ A? www.ggg.com. (29)
22:18:51.267277 IP 10.0.0.1.domain > 10.0.0.2.55555: 0 1/0/0 A 222.222.222.222 (45)
22:18:51.418774 IP 10.0.0.2.55555 > 10.0.0.1.domain: 0+ A? www.ggg.com. (29)
22:18:51.420155 IP 10.0.0.1.domain > 10.0.0.2.55555: 0 1/0/0 A 222.222.222.222 (45)
22:18:51.551973 IP 10.0.0.2.55555 > 10.0.0.1.domain: 0+ A? www.ggg.com. (29)
22:18:51.565826 IP 10.0.0.1.domain > 10.0.0.2.55555: 0 1/0/0 A 222.222.222.222 (45)
22:18:51.697977 IP 10.0.0.2.55555 > 10.0.0.1.domain: 0+ A? www.ggg.com. (29)
22:18:51.701977 IP 10.0.0.1.domain > 10.0.0.2.55555: 0 1/0/0 A 222.222.222.222 (45)
22:18:51.803757 IP 10.0.0.2.55555 > 10.0.0.1.domain: 0+ A? www.ggg.com. (29)
22:18:51.808077 IP 10.0.0.1.domain > 10.0.0.2.55555: 0 1/0/0 A 222.222.222.222 (45)
22:18:51.934759 IP 10.0.0.2.55555 > 10.0.0.1.domain: 0+ A? www.ggg.com. (29)
22:18:51.938799 IP 10.0.0.1.domain > 10.0.0.2.55555: 0 1/0/0 A 222.222.222.222 (45)
22:18:52.066685 IP 10.0.0.2.55555 > 10.0.0.1.domain: 0+ A? www.ggg.com. (29)
22:18:52.069518 IP 10.0.0.1.domain > 10.0.0.2.55555: 0 1/0/0 A 222.222.222.222 (45)
22:18:52.172319 IP 10.0.0.2.55555 > 10.0.0.1.domain: 0+ A? www.ggg.com. (29)
22:18:52.174806 IP 10.0.0.1.domain > 10.0.0.2.55555: 0 1/0/0 A 222.222.222.222 (45)
22:18:52.314055 IP 10.0.0.2.55555 > 10.0.0.1.domain: 0+ A? www.ggg.com. (29)
22:18:52.321812 IP 10.0.0.1.domain > 10.0.0.2.55555: 0 1/0/0 A 222.222.222.222 (45)
22:18:52.386371 IP 10.0.0.2.55555 > 10.0.0.1.domain: 0+ A? www.ggg.com. (29)
22:18:52.388386 IP 10.0.0.1.domain > 10.0.0.2.55555: 0 1/0/0 A 222.222.222.222 (45)
22:18:52.461738 IP 10.0.0.2.55555 > 10.0.0.1.domain: 0+ A? www.ggg.com. (29)
22:18:52.464133 IP 10.0.0.1.domain > 10.0.0.2.55555: 0 1/0/0 A 222.222.222.222 (45)
22:18:52.550504 IP 10.0.0.2.55555 > 10.0.0.1.domain: 0+ A? www.ggg.com. (29)
22:18:52.555921 IP 10.0.0.1.domain > 10.0.0.2.55555: 0 1/0/0 A 222.222.222.222 (45)
22:18:52.653745 IP 10.0.0.2.55555 > 10.0.0.1.domain: 0+ A? www.ggg.com. (29)
22:18:52.660008 IP 10.0.0.1.domain > 10.0.0.2.55555: 0 1/0/0 A 222.222.222.222 (45)
22:18:52.785677 IP 10.0.0.2.55555 > 10.0.0.1.domain: 0+ A? www.ggg.com. (29)
22:18:52.789035 IP 10.0.0.1.domain > 10.0.0.2.55555: 0 1/0/0 A 222.222.222.222 (45)
22:18:52.899469 IP 10.0.0.2.55555 > 10.0.0.1.domain: 0+ A? www.ggg.com. (29)
22:18:52.900511 IP 10.0.0.1.domain > 10.0.0.2.55555: 0 1/0/0 A 222.222.222.222 (45)
22:18:53.006478 IP 10.0.0.2.55555 > 10.0.0.1.domain: 0+ A? www.ggg.com. (29)
22:18:53.011374 IP 10.0.0.1.domain > 10.0.0.2.55555: 0 1/0/0 A 222.222.222.222 (45)
22:18:53.098254 IP 10.0.0.2.55555 > 10.0.0.1.domain: 0+ A? www.ggg.com. (29)
22:18:53.103660 IP 10.0.0.1.domain > 10.0.0.2.55555: 0 1/0/0 A 222.222.222.222 (45)
22:18:53.264641 IP 10.0.0.2.55555 > 10.0.0.1.domain: 0+ A? www.ggg.com. (29)
22:18:53.266094 IP 10.0.0.1.domain > 10.0.0.2.55555: 0 1/0/0 A 222.222.222.222 (45)
22:18:53.389327 IP 10.0.0.2.55555 > 10.0.0.1.domain: 0+ A? www.ggg.com. (29)
22:18:53.391735 IP 10.0.0.1.domain > 10.0.0.2.55555: 0 1/0/0 A 222.222.222.222 (45)
22:18:53.489335 IP 10.0.0.2.55555 > 10.0.0.1.domain: 0+ A? www.ggg.com. (29)
22:18:53.491628 IP 10.0.0.1.domain > 10.0.0.2.55555: 0 1/0/0 A 222.222.222.222 (45)
22:18:53.590478 IP 10.0.0.2.55555 > 10.0.0.1.domain: 0+ A? www.ggg.com. (29)
22:18:53.593703 IP 10.0.0.1.domain > 10.0.0.2.55555: 0 1/0/0 A 222.222.222.222 (45)
22:18:53.690021 IP 10.0.0.2.55555 > 10.0.0.1.domain: 0+ A? www.ggg.com. (29)
22:18:53.691551 IP 10.0.0.1.domain > 10.0.0.2.55555: 0 1/0/0 A 222.222.222.222 (45)
22:18:53.773005 IP 10.0.0.2.55555 > 10.0.0.1.domain: 0+ A? www.ggg.com. (29)
22:18:53.778212 IP 10.0.0.1.domain > 10.0.0.2.55555: 0 1/0/0 A 222.222.222.222 (45)
22:18:53.940751 IP 10.0.0.2.55555 > 10.0.0.1.domain: 0+ A? www.ggg.com. (29)
22:18:53.942835 IP 10.0.0.1.domain > 10.0.0.2.55555: 0 1/0/0 A 222.222.222.222 (45)
22:18:54.007598 IP 10.0.0.2.55555 > 10.0.0.1.domain: 0+ A? www.ggg.com. (29)
22:18:54.013140 IP 10.0.0.1.domain > 10.0.0.2.55555: 0 1/0/0 A 222.222.222.222 (45)
22:18:54.083684 IP 10.0.0.2.55555 > 10.0.0.1.domain: 0+ A? www.ggg.com. (29)
22:18:54.086015 IP 10.0.0.1.domain > 10.0.0.2.55555: 0 1/0/0 A 222.222.222.222 (45)
22:18:54.188920 IP 10.0.0.2.55555 > 10.0.0.1.domain: 0+ A? www.ggg.com. (29)
22:18:54.190216 IP 10.0.0.1.domain > 10.0.0.2.55555: 0 1/0/0 A 222.222.222.222 (45)
22:18:54.258442 IP 10.0.0.2.55555 > 10.0.0.1.domain: 0+ A? www.ggg.com. (29)
22:18:54.260482 IP 10.0.0.1.domain > 10.0.0.2.55555: 0 1/0/0 A 222.222.222.222 (45)
22:18:54.397614 IP 10.0.0.2.55555 > 10.0.0.1.domain: 0+ A? www.ggg.com. (29)
22:18:54.406453 IP 10.0.0.1.domain > 10.0.0.2.55555: 0 1/0/0 A 222.222.222.222 (45)
22:18:54.526176 IP 10.0.0.2.55555 > 10.0.0.1.domain: 0+ A? www.ggg.com. (29)
22:18:54.528621 IP 10.0.0.1.domain > 10.0.0.2.55555: 0 1/0/0 A 222.222.222.222 (45)
22:18:54.599351 IP 10.0.0.2.55555 > 10.0.0.1.domain: 0+ A? www.ggg.com. (29)
22:18:54.605326 IP 10.0.0.1.domain > 10.0.0.2.55555: 0 1/0/0 A 222.222.222.222 (45)
22:18:54.686098 IP 10.0.0.2.55555 > 10.0.0.1.domain: 0+ A? www.ggg.com. (29)
22:18:54.697155 IP 10.0.0.1.domain > 10.0.0.2.55555: 0 1/0/0 A 222.222.222.222 (45)
22:18:54.838196 IP 10.0.0.2.55555 > 10.0.0.1.domain: 0+ A? www.ggg.com. (29)
22:18:54.839434 IP 10.0.0.1.domain > 10.0.0.2.55555: 0 1/0/0 A 222.222.222.222 (45)
22:18:54.948921 IP 10.0.0.2.55555 > 10.0.0.1.domain: 0+ A? www.ggg.com. (29)
22:18:54.951325 IP 10.0.0.1.domain > 10.0.0.2.55555: 0 1/0/0 A 222.222.222.222 (45)
22:18:55.023573 IP 10.0.0.2.55555 > 10.0.0.1.domain: 0+ A? www.ggg.com. (29)
22:18:55.030258 IP 10.0.0.1.domain > 10.0.0.2.55555: 0 1/0/0 A 222.222.222.222 (45)
22:18:55.173739 IP 10.0.0.2.55555 > 10.0.0.1.domain: 0+ A? www.ggg.com. (29)
22:18:55.180251 IP 10.0.0.1.domain > 10.0.0.2.55555: 0 1/0/0 A 222.222.222.222 (45)
22:18:55.333944 IP 10.0.0.2.55555 > 10.0.0.1.domain: 0+ A? www.ggg.com. (29)
22:18:55.347678 IP 10.0.0.1.domain > 10.0.0.2.55555: 0 1/0/0 A 222.222.222.222 (45)
22:18:55.484378 IP 10.0.0.2.55555 > 10.0.0.1.domain: 0+ A? www.ggg.com. (29)
22:18:55.510504 IP 10.0.0.1.domain > 10.0.0.2.55555: 0 1/0/0 A 222.222.222.222 (45)
22:18:55.722141 IP 10.0.0.2.55555 > 10.0.0.1.domain: 0+ A? www.ggg.com. (29)
22:18:55.730465 IP 10.0.0.1.domain > 10.0.0.2.55555: 0 1/0/0 A 222.222.222.222 (45)
22:18:55.858288 IP 10.0.0.2.55555 > 10.0.0.1.domain: 0+ A? www.ggg.com. (29)
22:18:55.860107 IP 10.0.0.1.domain > 10.0.0.2.55555: 0 1/0/0 A 222.222.222.222 (45)
22:18:55.973607 IP 10.0.0.2.55555 > 10.0.0.1.domain: 0+ A? www.ggg.com. (29)
22:18:55.978948 IP 10.0.0.1.domain > 10.0.0.2.55555: 0 1/0/0 A 222.222.222.222 (45)
22:18:56.036726 IP 10.0.0.2.55555 > 10.0.0.1.domain: 0+ A? www.ggg.com. (29)
22:18:56.038473 IP 10.0.0.1.domain > 10.0.0.2.55555: 0 1/0/0 A 222.222.222.222 (45)

