06:52:46.157278 IP 10.0.0.2.55555 > 10.0.0.1.domain: 0+ A? www.fffffffffff.com. (37)
06:52:46.158323 IP 10.0.0.1.domain > 10.0.0.2.55555: 0 1/0/0 A 111.111.111.111 (53)
06:52:46.169438 IP 10.0.0.2.55555 > 10.0.0.1.domain: 0+ A? www.fffffffffff.com. (37)
06:52:46.169634 IP 10.0.0.1.domain > 10.0.0.2.55555: 0 1/0/0 A 111.111.111.111 (53)
06:52:46.178365 IP 10.0.0.2.55555 > 10.0.0.1.domain: 0+ A? www.fffffffffff.com. (37)
06:52:46.178599 IP 10.0.0.1.domain > 10.0.0.2.55555: 0 1/0/0 A 111.111.111.111 (53)
06:52:46.183484 IP 10.0.0.2.55555 > 10.0.0.1.domain: 0+ A? www.fffffffffff.com. (37)
06:52:46.183643 IP 10.0.0.1.domain > 10.0.0.2.55555: 0 1/0/0 A 111.111.111.111 (53)
06:52:46.190621 IP 10.0.0.2.55555 > 10.0.0.1.domain: 0+ A? www.fffffffffff.com. (37)
06:52:46.190790 IP 10.0.0.1.domain > 10.0.0.2.55555: 0 1/0/0 A 111.111.111.111 (53)
06:52:46.196358 IP 10.0.0.2.55555 > 10.0.0.1.domain: 0+ A? www.fffffffffff.com. (37)
06:52:46.196531 IP 10.0.0.1.domain > 10.0.0.2.55555: 0 1/0/0 A 111.111.111.111 (53)
06:52:46.205352 IP 10.0.0.2.55555 > 10.0.0.1.domain: 0+ A? www.fffffffffff.com. (37)
06:52:46.205565 IP 10.0.0.1.domain > 10.0.0.2.55555: 0 1/0/0 A 111.111.111.111 (53)
06:52:46.217370 IP 10.0.0.2.55555 > 10.0.0.1.domain: 0+ A? www.fffffffffff.com. (37)
06:52:46.217543 IP 10.0.0.1.domain > 10.0.0.2.55555: 0 1/0/0 A 111.111.111.111 (53)
06:52:46.227023 IP 10.0.0.2.55555 > 10.0.0.1.domain: 0+ A? www.fffffffffff.com. (37)
06:52:46.227195 IP 10.0.0.1.domain > 10.0.0.2.55555: 0 1/0/0 A 111.111.111.111 (53)
06:52:46.233829 IP 10.0.0.2.55555 > 10.0.0.1.domain: 0+ A? www.fffffffffff.com. (37)
06:52:46.234001 IP 10.0.0.1.domain > 10.0.0.2.55555: 0 1/0/0 A 111.111.111.111 (53)
06:52:46.240103 IP 10.0.0.2.55555 > 10.0.0.1.domain: 0+ A? www.fffffffffff.com. (37)
06:52:46.240266 IP 10.0.0.1.domain > 10.0.0.2.55555: 0 1/0/0 A 111.111.111.111 (53)
06:52:46.244184 IP 10.0.0.2.55555 > 10.0.0.1.domain: 0+ A? www.fffffffffff.com. (37)
06:52:46.244349 IP 10.0.0.1.domain > 10.0.0.2.55555: 0 1/0/0 A 111.111.111.111 (53)
06:52:46.252569 IP 10.0.0.2.55555 > 10.0.0.1.domain: 0+ A? www.fffffffffff.com. (37)
06:52:46.252813 IP 10.0.0.1.domain > 10.0.0.2.55555: 0 1/0/0 A 111.111.111.111 (53)
06:52:46.258817 IP 10.0.0.2.55555 > 10.0.0.1.domain: 0+ A? www.fffffffffff.com. (37)
06:52:46.258944 IP 10.0.0.1.domain > 10.0.0.2.55555: 0 1/0/0 A 111.111.111.111 (53)
06:52:46.264236 IP 10.0.0.2.55555 > 10.0.0.1.domain: 0+ A? www.fffffffffff.com. (37)
06:52:46.264358 IP 10.0.0.1.domain > 10.0.0.2.55555: 0 1/0/0 A 111.111.111.111 (53)
06:52:46.272324 IP 10.0.0.2.55555 > 10.0.0.1.domain: 0+ A? www.fffffffffff.com. (37)
06:52:46.272547 IP 10.0.0.1.domain > 10.0.0.2.55555: 0 1/0/0 A 111.111.111.111 (53)
06:52:46.278481 IP 10.0.0.2.55555 > 10.0.0.1.domain: 0+ A? www.fffffffffff.com. (37)
06:52:46.278602 IP 10.0.0.1.domain > 10.0.0.2.55555: 0 1/0/0 A 111.111.111.111 (53)
06:52:46.281630 IP 10.0.0.2.55555 > 10.0.0.1.domain: 0+ A? www.fffffffffff.com. (37)
06:52:46.281761 IP 10.0.0.1.domain > 10.0.0.2.55555: 0 1/0/0 A 111.111.111.111 (53)
06:52:46.284943 IP 10.0.0.2.55555 > 10.0.0.1.domain: 0+ A? www.fffffffffff.com. (37)
06:52:46.285068 IP 10.0.0.1.domain > 10.0.0.2.55555: 0 1/0/0 A 111.111.111.111 (53)
06:52:46.291039 IP 10.0.0.2.55555 > 10.0.0.1.domain: 0+ A? www.fffffffffff.com. (37)
06:52:46.291192 IP 10.0.0.1.domain > 10.0.0.2.55555: 0 1/0/0 A 111.111.111.111 (53)
06:52:46.297200 IP 10.0.0.2.55555 > 10.0.0.1.domain: 0+ A? www.fffffffffff.com. (37)
06:52:46.297485 IP 10.0.0.1.domain > 10.0.0.2.55555: 0 1/0/0 A 111.111.111.111 (53)
06:52:46.304398 IP 10.0.0.2.55555 > 10.0.0.1.domain: 0+ A? www.fffffffffff.com. (37)
06:52:46.304573 IP 10.0.0.1.domain > 10.0.0.2.55555: 0 1/0/0 A 111.111.111.111 (53)
06:52:46.309529 IP 10.0.0.2.55555 > 10.0.0.1.domain: 0+ A? www.fffffffffff.com. (37)
06:52:46.309684 IP 10.0.0.1.domain > 10.0.0.2.55555: 0 1/0/0 A 111.111.111.111 (53)
06:52:46.315342 IP 10.0.0.2.55555 > 10.0.0.1.domain: 0+ A? www.fffffffffff.com. (37)
06:52:46.315477 IP 10.0.0.1.domain > 10.0.0.2.55555: 0 1/0/0 A 111.111.111.111 (53)
06:52:46.322239 IP 10.0.0.2.55555 > 10.0.0.1.domain: 0+ A? www.fffffffffff.com. (37)
06:52:46.322581 IP 10.0.0.1.domain > 10.0.0.2.55555: 0 1/0/0 A 111.111.111.111 (53)
06:52:46.327972 IP 10.0.0.2.55555 > 10.0.0.1.domain: 0+ A? www.fffffffffff.com. (37)
06:52:46.328144 IP 10.0.0.1.domain > 10.0.0.2.55555: 0 1/0/0 A 111.111.111.111 (53)
06:52:46.334417 IP 10.0.0.2.55555 > 10.0.0.1.domain: 0+ A? www.fffffffffff.com. (37)
06:52:46.334595 IP 10.0.0.1.domain > 10.0.0.2.55555: 0 1/0/0 A 111.111.111.111 (53)
06:52:46.341393 IP 10.0.0.2.55555 > 10.0.0.1.domain: 0+ A? www.fffffffffff.com. (37)
06:52:46.341678 IP 10.0.0.1.domain > 10.0.0.2.55555: 0 1/0/0 A 111.111.111.111 (53)
06:52:46.349364 IP 10.0.0.2.55555 > 10.0.0.1.domain: 0+ A? www.fffffffffff.com. (37)
06:52:46.349546 IP 10.0.0.1.domain > 10.0.0.2.55555: 0 1/0/0 A 111.111.111.111 (53)
06:52:46.361942 IP 10.0.0.2.55555 > 10.0.0.1.domain: 0+ A? www.fffffffffff.com. (37)
06:52:46.362334 IP 10.0.0.1.domain > 10.0.0.2.55555: 0 1/0/0 A 111.111.111.111 (53)
06:52:46.368244 IP 10.0.0.2.55555 > 10.0.0.1.domain: 0+ A? www.fffffffffff.com. (37)
06:52:46.368341 IP 10.0.0.1.domain > 10.0.0.2.55555: 0 1/0/0 A 111.111.111.111 (53)
06:52:46.373462 IP 10.0.0.2.55555 > 10.0.0.1.domain: 0+ A? www.fffffffffff.com. (37)
06:52:46.373641 IP 10.0.0.1.domain > 10.0.0.2.55555: 0 1/0/0 A 111.111.111.111 (53)
06:52:46.380220 IP 10.0.0.2.55555 > 10.0.0.1.domain: 0+ A? www.fffffffffff.com. (37)
06:52:46.380398 IP 10.0.0.1.domain > 10.0.0.2.55555: 0 1/0/0 A 111.111.111.111 (53)
06:52:46.384631 IP 10.0.0.2.55555 > 10.0.0.1.domain: 0+ A? www.fffffffffff.com. (37)
06:52:46.384803 IP 10.0.0.1.domain > 10.0.0.2.55555: 0 1/0/0 A 111.111.111.111 (53)
06:52:46.391688 IP 10.0.0.2.55555 > 10.0.0.1.domain: 0+ A? www.fffffffffff.com. (37)
06:52:46.391853 IP 10.0.0.1.domain > 10.0.0.2.55555: 0 1/0/0 A 111.111.111.111 (53)
06:52:46.401237 IP 10.0.0.2.55555 > 10.0.0.1.domain: 0+ A? www.fffffffffff.com. (37)
06:52:46.401401 IP 10.0.0.1.domain > 10.0.0.2.55555: 0 1/0/0 A 111.111.111.111 (53)
06:52:46.408173 IP 10.0.0.2.55555 > 10.0.0.1.domain: 0+ A? www.fffffffffff.com. (37)
06:52:46.408340 IP 10.0.0.1.domain > 10.0.0.2.55555: 0 1/0/0 A 111.111.111.111 (53)
06:52:46.414982 IP 10.0.0.2.55555 > 10.0.0.1.domain: 0+ A? www.fffffffffff.com. (37)
06:52:46.415130 IP 10.0.0.1.domain > 10.0.0.2.55555: 0 1/0/0 A 111.111.111.111 (53)
06:52:46.425801 IP 10.0.0.2.55555 > 10.0.0.1.domain: 0+ A? www.fffffffffff.com. (37)
06:52:46.426058 IP 10.0.0.1.domain > 10.0.0.2.55555: 0 1/0/0 A 111.111.111.111 (53)
06:52:46.433151 IP 10.0.0.2.55555 > 10.0.0.1.domain: 0+ A? www.fffffffffff.com. (37)
06:52:46.433334 IP 10.0.0.1.domain > 10.0.0.2.55555: 0 1/0/0 A 111.111.111.111 (53)
06:52:46.437671 IP 10.0.0.2.55555 > 10.0.0.1.domain: 0+ A? www.fffffffffff.com. (37)
06:52:46.437792 IP 10.0.0.1.domain > 10.0.0.2.55555: 0 1/0/0 A 111.111.111.111 (53)
06:52:46.445068 IP 10.0.0.2.55555 > 10.0.0.1.domain: 0+ A? www.fffffffffff.com. (37)
06:52:46.445236 IP 10.0.0.1.domain > 10.0.0.2.55555: 0 1/0/0 A 111.111.111.111 (53)
06:52:46.451790 IP 10.0.0.2.55555 > 10.0.0.1.domain: 0+ A? www.fffffffffff.com. (37)
06:52:46.451952 IP 10.0.0.1.domain > 10.0.0.2.55555: 0 1/0/0 A 111.111.111.111 (53)
06:52:46.455673 IP 10.0.0.2.55555 > 10.0.0.1.domain: 0+ A? www.fffffffffff.com. (37)
06:52:46.455915 IP 10.0.0.1.domain > 10.0.0.2.55555: 0 1/0/0 A 111.111.111.111 (53)
06:52:46.462855 IP 10.0.0.2.55555 > 10.0.0.1.domain: 0+ A? www.fffffffffff.com. (37)
06:52:46.463020 IP 10.0.0.1.domain > 10.0.0.2.55555: 0 1/0/0 A 111.111.111.111 (53)
06:52:46.470724 IP 10.0.0.2.55555 > 10.0.0.1.domain: 0+ A? www.fffffffffff.com. (37)
06:52:46.470965 IP 10.0.0.1.domain > 10.0.0.2.55555: 0 1/0/0 A 111.111.111.111 (53)
06:52:46.476528 IP 10.0.0.2.55555 > 10.0.0.1.domain: 0+ A? www.fffffffffff.com. (37)
06:52:46.476648 IP 10.0.0.1.domain > 10.0.0.2.55555: 0 1/0/0 A 111.111.111.111 (53)
06:52:46.485330 IP 10.0.0.2.55555 > 10.0.0.1.domain: 0+ A? www.fffffffffff.com. (37)
06:52:46.485453 IP 10.0.0.1.domain > 10.0.0.2.55555: 0 1/0/0 A 111.111.111.111 (53)
06:52:46.490208 IP 10.0.0.2.55555 > 10.0.0.1.domain: 0+ A? www.fffffffffff.com. (37)
06:52:46.490387 IP 10.0.0.1.domain > 10.0.0.2.55555: 0 1/0/0 A 111.111.111.111 (53)
06:52:46.495706 IP 10.0.0.2.55555 > 10.0.0.1.domain: 0+ A? www.fffffffffff.com. (37)
06:52:46.495888 IP 10.0.0.1.domain > 10.0.0.2.55555: 0 1/0/0 A 111.111.111.111 (53)
06:52:46.503378 IP 10.0.0.2.55555 > 10.0.0.1.domain: 0+ A? www.fffffffffff.com. (37)
06:52:46.503614 IP 10.0.0.1.domain > 10.0.0.2.55555: 0 1/0/0 A 111.111.111.111 (53)
06:52:46.509029 IP 10.0.0.2.55555 > 10.0.0.1.domain: 0+ A? www.fffffffffff.com. (37)
06:52:46.509329 IP 10.0.0.1.domain > 10.0.0.2.55555: 0 1/0/0 A 111.111.111.111 (53)
06:52:46.514322 IP 10.0.0.2.55555 > 10.0.0.1.domain: 0+ A? www.fffffffffff.com. (37)
06:52:46.514491 IP 10.0.0.1.domain > 10.0.0.2.55555: 0 1/0/0 A 111.111.111.111 (53)
06:52:46.523399 IP 10.0.0.2.55555 > 10.0.0.1.domain: 0+ A? www.fffffffffff.com. (37)
06:52:46.523538 IP 10.0.0.1.domain > 10.0.0.2.55555: 0 1/0/0 A 111.111.111.111 (53)
06:52:46.532200 IP 10.0.0.2.55555 > 10.0.0.1.domain: 0+ A? www.fffffffffff.com. (37)
06:52:46.532441 IP 10.0.0.1.domain > 10.0.0.2.55555: 0 1/0/0 A 111.111.111.111 (53)
06:52:46.537615 IP 10.0.0.2.55555 > 10.0.0.1.domain: 0+ A? www.fffffffffff.com. (37)
06:52:46.537750 IP 10.0.0.1.domain > 10.0.0.2.55555: 0 1/0/0 A 111.111.111.111 (53)
06:52:46.547129 IP 10.0.0.2.55555 > 10.0.0.1.domain: 0+ A? www.fffffffffff.com. (37)
06:52:46.547296 IP 10.0.0.1.domain > 10.0.0.2.55555: 0 1/0/0 A 111.111.111.111 (53)
06:52:46.552702 IP 10.0.0.2.55555 > 10.0.0.1.domain: 0+ A? www.fffffffffff.com. (37)
06:52:46.552859 IP 10.0.0.1.domain > 10.0.0.2.55555: 0 1/0/0 A 111.111.111.111 (53)
06:52:46.557963 IP 10.0.0.2.55555 > 10.0.0.1.domain: 0+ A? www.fffffffffff.com. (37)
06:52:46.558109 IP 10.0.0.1.domain > 10.0.0.2.55555: 0 1/0/0 A 111.111.111.111 (53)
06:52:46.566477 IP 10.0.0.2.55555 > 10.0.0.1.domain: 0+ A? www.fffffffffff.com. (37)
06:52:46.566643 IP 10.0.0.1.domain > 10.0.0.2.55555: 0 1/0/0 A 111.111.111.111 (53)
06:52:46.570879 IP 10.0.0.2.55555 > 10.0.0.1.domain: 0+ A? www.fffffffffff.com. (37)
06:52:46.571038 IP 10.0.0.1.domain > 10.0.0.2.55555: 0 1/0/0 A 111.111.111.111 (53)
06:52:46.576412 IP 10.0.0.2.55555 > 10.0.0.1.domain: 0+ A? www.fffffffffff.com. (37)
06:52:46.576550 IP 10.0.0.1.domain > 10.0.0.2.55555: 0 1/0/0 A 111.111.111.111 (53)
06:52:46.581441 IP 10.0.0.2.55555 > 10.0.0.1.domain: 0+ A? www.fffffffffff.com. (37)
06:52:46.581638 IP 10.0.0.1.domain > 10.0.0.2.55555: 0 1/0/0 A 111.111.111.111 (53)
06:52:46.590192 IP 10.0.0.2.55555 > 10.0.0.1.domain: 0+ A? www.fffffffffff.com. (37)
06:52:46.590398 IP 10.0.0.1.domain > 10.0.0.2.55555: 0 1/0/0 A 111.111.111.111 (53)
06:52:46.599664 IP 10.0.0.2.55555 > 10.0.0.1.domain: 0+ A? www.fffffffffff.com. (37)
06:52:46.599941 IP 10.0.0.1.domain > 10.0.0.2.55555: 0 1/0/0 A 111.111.111.111 (53)
06:52:46.605112 IP 10.0.0.2.55555 > 10.0.0.1.domain: 0+ A? www.fffffffffff.com. (37)
06:52:46.605282 IP 10.0.0.1.domain > 10.0.0.2.55555: 0 1/0/0 A 111.111.111.111 (53)
06:52:46.611729 IP 10.0.0.2.55555 > 10.0.0.1.domain: 0+ A? www.fffffffffff.com. (37)
06:52:46.611896 IP 10.0.0.1.domain > 10.0.0.2.55555: 0 1/0/0 A 111.111.111.111 (53)
06:52:46.618774 IP 10.0.0.2.55555 > 10.0.0.1.domain: 0+ A? www.fffffffffff.com. (37)
06:52:46.618938 IP 10.0.0.1.domain > 10.0.0.2.55555: 0 1/0/0 A 111.111.111.111 (53)
06:52:46.624749 IP 10.0.0.2.55555 > 10.0.0.1.domain: 0+ A? www.fffffffffff.com. (37)
06:52:46.624922 IP 10.0.0.1.domain > 10.0.0.2.55555: 0 1/0/0 A 111.111.111.111 (53)
06:52:46.631967 IP 10.0.0.2.55555 > 10.0.0.1.domain: 0+ A? www.fffffffffff.com. (37)
06:52:46.632130 IP 10.0.0.1.domain > 10.0.0.2.55555: 0 1/0/0 A 111.111.111.111 (53)
06:52:46.641726 IP 10.0.0.2.55555 > 10.0.0.1.domain: 0+ A? www.fffffffffff.com. (37)
06:52:46.641860 IP 10.0.0.1.domain > 10.0.0.2.55555: 0 1/0/0 A 111.111.111.111 (53)
06:52:46.648722 IP 10.0.0.2.55555 > 10.0.0.1.domain: 0+ A? www.fffffffffff.com. (37)
06:52:46.648839 IP 10.0.0.1.domain > 10.0.0.2.55555: 0 1/0/0 A 111.111.111.111 (53)
06:52:46.653475 IP 10.0.0.2.55555 > 10.0.0.1.domain: 0+ A? www.fffffffffff.com. (37)
06:52:46.653629 IP 10.0.0.1.domain > 10.0.0.2.55555: 0 1/0/0 A 111.111.111.111 (53)
06:52:46.659391 IP 10.0.0.2.55555 > 10.0.0.1.domain: 0+ A? www.fffffffffff.com. (37)
06:52:46.659555 IP 10.0.0.1.domain > 10.0.0.2.55555: 0 1/0/0 A 111.111.111.111 (53)
06:52:46.669802 IP 10.0.0.2.55555 > 10.0.0.1.domain: 0+ A? www.fffffffffff.com. (37)
06:52:46.670064 IP 10.0.0.1.domain > 10.0.0.2.55555: 0 1/0/0 A 111.111.111.111 (53)
06:52:46.676247 IP 10.0.0.2.55555 > 10.0.0.1.domain: 0+ A? www.fffffffffff.com. (37)
06:52:46.676412 IP 10.0.0.1.domain > 10.0.0.2.55555: 0 1/0/0 A 111.111.111.111 (53)
06:52:46.688126 IP 10.0.0.2.55555 > 10.0.0.1.domain: 0+ A? www.fffffffffff.com. (37)
06:52:46.688298 IP 10.0.0.1.domain > 10.0.0.2.55555: 0 1/0/0 A 111.111.111.111 (53)
06:52:46.695802 IP 10.0.0.2.55555 > 10.0.0.1.domain: 0+ A? www.fffffffffff.com. (37)
06:52:46.695978 IP 10.0.0.1.domain > 10.0.0.2.55555: 0 1/0/0 A 111.111.111.111 (53)
06:52:46.703623 IP 10.0.0.2.55555 > 10.0.0.1.domain: 0+ A? www.fffffffffff.com. (37)
06:52:46.703803 IP 10.0.0.1.domain > 10.0.0.2.55555: 0 1/0/0 A 111.111.111.111 (53)
06:52:46.709224 IP 10.0.0.2.55555 > 10.0.0.1.domain: 0+ A? www.fffffffffff.com. (37)
06:52:46.709389 IP 10.0.0.1.domain > 10.0.0.2.55555: 0 1/0/0 A 111.111.111.111 (53)
06:52:46.716187 IP 10.0.0.2.55555 > 10.0.0.1.domain: 0+ A? www.fffffffffff.com. (37)
06:52:46.716363 IP 10.0.0.1.domain > 10.0.0.2.55555: 0 1/0/0 A 111.111.111.111 (53)
06:52:46.721408 IP 10.0.0.2.55555 > 10.0.0.1.domain: 0+ A? www.fffffffffff.com. (37)
06:52:46.721564 IP 10.0.0.1.domain > 10.0.0.2.55555: 0 1/0/0 A 111.111.111.111 (53)
06:52:46.728003 IP 10.0.0.2.55555 > 10.0.0.1.domain: 0+ A? www.fffffffffff.com. (37)
06:52:46.728138 IP 10.0.0.1.domain > 10.0.0.2.55555: 0 1/0/0 A 111.111.111.111 (53)
06:52:46.738288 IP 10.0.0.2.55555 > 10.0.0.1.domain: 0+ A? www.fffffffffff.com. (37)
06:52:46.738465 IP 10.0.0.1.domain > 10.0.0.2.55555: 0 1/0/0 A 111.111.111.111 (53)
06:52:46.748434 IP 10.0.0.2.55555 > 10.0.0.1.domain: 0+ A? www.fffffffffff.com. (37)
06:52:46.748608 IP 10.0.0.1.domain > 10.0.0.2.55555: 0 1/0/0 A 111.111.111.111 (53)
06:52:46.752803 IP 10.0.0.2.55555 > 10.0.0.1.domain: 0+ A? www.fffffffffff.com. (37)
06:52:46.752918 IP 10.0.0.1.domain > 10.0.0.2.55555: 0 1/0/0 A 111.111.111.111 (53)
06:52:46.759595 IP 10.0.0.2.55555 > 10.0.0.1.domain: 0+ A? www.fffffffffff.com. (37)
06:52:46.759760 IP 10.0.0.1.domain > 10.0.0.2.55555: 0 1/0/0 A 111.111.111.111 (53)
06:52:46.766330 IP 10.0.0.2.55555 > 10.0.0.1.domain: 0+ A? www.fffffffffff.com. (37)
06:52:46.766520 IP 10.0.0.1.domain > 10.0.0.2.55555: 0 1/0/0 A 111.111.111.111 (53)
06:52:46.774992 IP 10.0.0.2.55555 > 10.0.0.1.domain: 0+ A? www.fffffffffff.com. (37)
06:52:46.775157 IP 10.0.0.1.domain > 10.0.0.2.55555: 0 1/0/0 A 111.111.111.111 (53)
06:52:46.779121 IP 10.0.0.2.55555 > 10.0.0.1.domain: 0+ A? www.fffffffffff.com. (37)
06:52:46.779347 IP 10.0.0.1.domain > 10.0.0.2.55555: 0 1/0/0 A 111.111.111.111 (53)
06:52:46.790231 IP 10.0.0.2.55555 > 10.0.0.1.domain: 0+ A? www.fffffffffff.com. (37)
06:52:46.790357 IP 10.0.0.1.domain > 10.0.0.2.55555: 0 1/0/0 A 111.111.111.111 (53)
06:52:46.796934 IP 10.0.0.2.55555 > 10.0.0.1.domain: 0+ A? www.fffffffffff.com. (37)
06:52:46.797103 IP 10.0.0.1.domain > 10.0.0.2.55555: 0 1/0/0 A 111.111.111.111 (53)
06:52:46.803658 IP 10.0.0.2.55555 > 10.0.0.1.domain: 0+ A? www.fffffffffff.com. (37)
06:52:46.803841 IP 10.0.0.1.domain > 10.0.0.2.55555: 0 1/0/0 A 111.111.111.111 (53)
06:52:46.808573 IP 10.0.0.2.55555 > 10.0.0.1.domain: 0+ A? www.fffffffffff.com. (37)
06:52:46.808734 IP 10.0.0.1.domain > 10.0.0.2.55555: 0 1/0/0 A 111.111.111.111 (53)
06:52:46.816822 IP 10.0.0.2.55555 > 10.0.0.1.domain: 0+ A? www.fffffffffff.com. (37)
06:52:46.816984 IP 10.0.0.1.domain > 10.0.0.2.55555: 0 1/0/0 A 111.111.111.111 (53)
06:52:46.824800 IP 10.0.0.2.55555 > 10.0.0.1.domain: 0+ A? www.fffffffffff.com. (37)
06:52:46.825098 IP 10.0.0.1.domain > 10.0.0.2.55555: 0 1/0/0 A 111.111.111.111 (53)
06:52:46.831694 IP 10.0.0.2.55555 > 10.0.0.1.domain: 0+ A? www.fffffffffff.com. (37)
06:52:46.831873 IP 10.0.0.1.domain > 10.0.0.2.55555: 0 1/0/0 A 111.111.111.111 (53)
06:52:46.836726 IP 10.0.0.2.55555 > 10.0.0.1.domain: 0+ A? www.fffffffffff.com. (37)
06:52:46.836839 IP 10.0.0.1.domain > 10.0.0.2.55555: 0 1/0/0 A 111.111.111.111 (53)
06:52:46.840384 IP 10.0.0.2.55555 > 10.0.0.1.domain: 0+ A? www.fffffffffff.com. (37)
06:52:46.840513 IP 10.0.0.1.domain > 10.0.0.2.55555: 0 1/0/0 A 111.111.111.111 (53)
06:52:46.844392 IP 10.0.0.2.55555 > 10.0.0.1.domain: 0+ A? www.fffffffffff.com. (37)
06:52:46.844499 IP 10.0.0.1.domain > 10.0.0.2.55555: 0 1/0/0 A 111.111.111.111 (53)
06:52:51.032615 IP 10.0.0.2.55555 > 10.0.0.1.domain: 0+ A? www.ggg.com. (29)
06:52:51.032781 IP 10.0.0.1.domain > 10.0.0.2.55555: 0 1/0/0 A 222.222.222.222 (45)
06:52:51.044358 IP 10.0.0.2.55555 > 10.0.0.1.domain: 0+ A? www.ggg.com. (29)
06:52:51.044527 IP 10.0.0.1.domain > 10.0.0.2.55555: 0 1/0/0 A 222.222.222.222 (45)
06:52:51.054856 IP 10.0.0.2.55555 > 10.0.0.1.domain: 0+ A? www.ggg.com. (29)
06:52:51.055022 IP 10.0.0.1.domain > 10.0.0.2.55555: 0 1/0/0 A 222.222.222.222 (45)
06:52:51.060633 IP 10.0.0.2.55555 > 10.0.0.1.domain: 0+ A? www.ggg.com. (29)
06:52:51.060796 IP 10.0.0.1.domain > 10.0.0.2.55555: 0 1/0/0 A 222.222.222.222 (45)
06:52:51.067094 IP 10.0.0.2.55555 > 10.0.0.1.domain: 0+ A? www.ggg.com. (29)
06:52:51.067246 IP 10.0.0.1.domain > 10.0.0.2.55555: 0 1/0/0 A 222.222.222.222 (45)
06:52:51.072233 IP 10.0.0.2.55555 > 10.0.0.1.domain: 0+ A? www.ggg.com. (29)
06:52:51.072397 IP 10.0.0.1.domain > 10.0.0.2.55555: 0 1/0/0 A 222.222.222.222 (45)
06:52:51.081737 IP 10.0.0.2.55555 > 10.0.0.1.domain: 0+ A? www.ggg.com. (29)
06:52:51.081863 IP 10.0.0.1.domain > 10.0.0.2.55555: 0 1/0/0 A 222.222.222.222 (45)
06:52:51.088732 IP 10.0.0.2.55555 > 10.0.0.1.domain: 0+ A? www.ggg.com. (29)
06:52:51.088946 IP 10.0.0.1.domain > 10.0.0.2.55555: 0 1/0/0 A 222.222.222.222 (45)
06:52:51.093489 IP 10.0.0.2.55555 > 10.0.0.1.domain: 0+ A? www.ggg.com. (29)
06:52:51.093664 IP 10.0.0.1.domain > 10.0.0.2.55555: 0 1/0/0 A 222.222.222.222 (45)
06:52:51.100130 IP 10.0.0.2.55555 > 10.0.0.1.domain: 0+ A? www.ggg.com. (29)
06:52:51.100266 IP 10.0.0.1.domain > 10.0.0.2.55555: 0 1/0/0 A 222.222.222.222 (45)

