22:11:18.715313 IP 10.0.0.2.55555 > 10.0.0.1.domain: 0+ A? www.ggg.com. (29)
22:11:18.715878 IP 10.0.0.1.domain > 10.0.0.2.55555: 0 1/0/0 A 222.222.222.222 (45)
22:11:18.909442 IP 10.0.0.2.55555 > 10.0.0.1.domain: 0+ A? www.ggg.com. (29)
22:11:18.909557 IP 10.0.0.1.domain > 10.0.0.2.55555: 0 1/0/0 A 222.222.222.222 (45)
22:11:19.055597 IP 10.0.0.2.55555 > 10.0.0.1.domain: 0+ A? www.ggg.com. (29)
22:11:19.055734 IP 10.0.0.1.domain > 10.0.0.2.55555: 0 1/0/0 A 222.222.222.222 (45)
22:11:19.199161 IP 10.0.0.2.55555 > 10.0.0.1.domain: 0+ A? www.ggg.com. (29)
22:11:19.199390 IP 10.0.0.1.domain > 10.0.0.2.55555: 0 1/0/0 A 222.222.222.222 (45)
22:11:19.298365 IP 10.0.0.2.55555 > 10.0.0.1.domain: 0+ A? www.ggg.com. (29)
22:11:19.298490 IP 10.0.0.1.domain > 10.0.0.2.55555: 0 1/0/0 A 222.222.222.222 (45)
22:11:19.453437 IP 10.0.0.2.55555 > 10.0.0.1.domain: 0+ A? www.ggg.com. (29)
22:11:19.454080 IP 10.0.0.1.domain > 10.0.0.2.55555: 0 1/0/0 A 222.222.222.222 (45)
22:11:19.576968 IP 10.0.0.2.55555 > 10.0.0.1.domain: 0+ A? www.ggg.com. (29)
22:11:19.577193 IP 10.0.0.1.domain > 10.0.0.2.55555: 0 1/0/0 A 222.222.222.222 (45)
22:11:19.712817 IP 10.0.0.2.55555 > 10.0.0.1.domain: 0+ A? www.ggg.com. (29)
22:11:19.713016 IP 10.0.0.1.domain > 10.0.0.2.55555: 0 1/0/0 A 222.222.222.222 (45)
22:11:19.845615 IP 10.0.0.2.55555 > 10.0.0.1.domain: 0+ A? www.ggg.com. (29)
22:11:19.845821 IP 10.0.0.1.domain > 10.0.0.2.55555: 0 1/0/0 A 222.222.222.222 (45)
22:11:20.020995 IP 10.0.0.2.55555 > 10.0.0.1.domain: 0+ A? www.ggg.com. (29)
22:11:20.021112 IP 10.0.0.1.domain > 10.0.0.2.55555: 0 1/0/0 A 222.222.222.222 (45)
22:11:20.158149 IP 10.0.0.2.55555 > 10.0.0.1.domain: 0+ A? www.ggg.com. (29)
22:11:20.158343 IP 10.0.0.1.domain > 10.0.0.2.55555: 0 1/0/0 A 222.222.222.222 (45)
22:11:20.239053 IP 10.0.0.2.55555 > 10.0.0.1.domain: 0+ A? www.ggg.com. (29)
22:11:20.239861 IP 10.0.0.1.domain > 10.0.0.2.55555: 0 1/0/0 A 222.222.222.222 (45)
22:11:20.319545 IP 10.0.0.2.55555 > 10.0.0.1.domain: 0+ A? www.ggg.com. (29)
22:11:20.320563 IP 10.0.0.1.domain > 10.0.0.2.55555: 0 1/0/0 A 222.222.222.222 (45)
22:11:20.474579 IP 10.0.0.2.55555 > 10.0.0.1.domain: 0+ A? www.ggg.com. (29)
22:11:20.474728 IP 10.0.0.1.domain > 10.0.0.2.55555: 0 1/0/0 A 222.222.222.222 (45)
22:11:20.622596 IP 10.0.0.2.55555 > 10.0.0.1.domain: 0+ A? www.ggg.com. (29)
22:11:20.622834 IP 10.0.0.1.domain > 10.0.0.2.55555: 0 1/0/0 A 222.222.222.222 (45)
22:11:20.729504 IP 10.0.0.2.55555 > 10.0.0.1.domain: 0+ A? www.ggg.com. (29)
22:11:20.729616 IP 10.0.0.1.domain > 10.0.0.2.55555: 0 1/0/0 A 222.222.222.222 (45)
22:11:20.888537 IP 10.0.0.2.55555 > 10.0.0.1.domain: 0+ A? www.ggg.com. (29)
22:11:20.888747 IP 10.0.0.1.domain > 10.0.0.2.55555: 0 1/0/0 A 222.222.222.222 (45)
22:11:21.032536 IP 10.0.0.2.55555 > 10.0.0.1.domain: 0+ A? www.ggg.com. (29)
22:11:21.033099 IP 10.0.0.1.domain > 10.0.0.2.55555: 0 1/0/0 A 222.222.222.222 (45)
22:11:21.163576 IP 10.0.0.2.55555 > 10.0.0.1.domain: 0+ A? www.ggg.com. (29)
22:11:21.163714 IP 10.0.0.1.domain > 10.0.0.2.55555: 0 1/0/0 A 222.222.222.222 (45)
22:11:21.303866 IP 10.0.0.2.55555 > 10.0.0.1.domain: 0+ A? www.ggg.com. (29)
22:11:21.304012 IP 10.0.0.1.domain > 10.0.0.2.55555: 0 1/0/0 A 222.222.222.222 (45)
22:11:21.430590 IP 10.0.0.2.55555 > 10.0.0.1.domain: 0+ A? www.ggg.com. (29)
22:11:21.431000 IP 10.0.0.1.domain > 10.0.0.2.55555: 0 1/0/0 A 222.222.222.222 (45)
22:11:21.508895 IP 10.0.0.2.55555 > 10.0.0.1.domain: 0+ A? www.ggg.com. (29)
22:11:21.509060 IP 10.0.0.1.domain > 10.0.0.2.55555: 0 1/0/0 A 222.222.222.222 (45)
22:11:21.611974 IP 10.0.0.2.55555 > 10.0.0.1.domain: 0+ A? www.ggg.com. (29)
22:11:21.612196 IP 10.0.0.1.domain > 10.0.0.2.55555: 0 1/0/0 A 222.222.222.222 (45)
22:11:21.712435 IP 10.0.0.2.55555 > 10.0.0.1.domain: 0+ A? www.ggg.com. (29)
22:11:21.712510 IP 10.0.0.1.domain > 10.0.0.2.55555: 0 1/0/0 A 222.222.222.222 (45)
22:11:21.910720 IP 10.0.0.2.55555 > 10.0.0.1.domain: 0+ A? www.ggg.com. (29)
22:11:21.910840 IP 10.0.0.1.domain > 10.0.0.2.55555: 0 1/0/0 A 222.222.222.222 (45)
22:11:22.047116 IP 10.0.0.2.55555 > 10.0.0.1.domain: 0+ A? www.ggg.com. (29)
22:11:22.047373 IP 10.0.0.1.domain > 10.0.0.2.55555: 0 1/0/0 A 222.222.222.222 (45)
22:11:22.162213 IP 10.0.0.2.55555 > 10.0.0.1.domain: 0+ A? www.ggg.com. (29)
22:11:22.162382 IP 10.0.0.1.domain > 10.0.0.2.55555: 0 1/0/0 A 222.222.222.222 (45)
22:11:22.270081 IP 10.0.0.2.55555 > 10.0.0.1.domain: 0+ A? www.ggg.com. (29)
22:11:22.270364 IP 10.0.0.1.domain > 10.0.0.2.55555: 0 1/0/0 A 222.222.222.222 (45)
22:11:22.352420 IP 10.0.0.2.55555 > 10.0.0.1.domain: 0+ A? www.ggg.com. (29)
22:11:22.353147 IP 10.0.0.1.domain > 10.0.0.2.55555: 0 1/0/0 A 222.222.222.222 (45)
22:11:22.459682 IP 10.0.0.2.55555 > 10.0.0.1.domain: 0+ A? www.ggg.com. (29)
22:11:22.459952 IP 10.0.0.1.domain > 10.0.0.2.55555: 0 1/0/0 A 222.222.222.222 (45)
22:11:22.597446 IP 10.0.0.2.55555 > 10.0.0.1.domain: 0+ A? www.ggg.com. (29)
22:11:22.597918 IP 10.0.0.1.domain > 10.0.0.2.55555: 0 1/0/0 A 222.222.222.222 (45)
22:11:22.763779 IP 10.0.0.2.55555 > 10.0.0.1.domain: 0+ A? www.ggg.com. (29)
22:11:22.763913 IP 10.0.0.1.domain > 10.0.0.2.55555: 0 1/0/0 A 222.222.222.222 (45)
22:11:22.944287 IP 10.0.0.2.55555 > 10.0.0.1.domain: 0+ A? www.ggg.com. (29)
22:11:22.944856 IP 10.0.0.1.domain > 10.0.0.2.55555: 0 1/0/0 A 222.222.222.222 (45)
22:11:23.092911 IP 10.0.0.2.55555 > 10.0.0.1.domain: 0+ A? www.ggg.com. (29)
22:11:23.093112 IP 10.0.0.1.domain > 10.0.0.2.55555: 0 1/0/0 A 222.222.222.222 (45)
22:11:23.246321 IP 10.0.0.2.55555 > 10.0.0.1.domain: 0+ A? www.ggg.com. (29)
22:11:23.246994 IP 10.0.0.1.domain > 10.0.0.2.55555: 0 1/0/0 A 222.222.222.222 (45)
22:11:23.363386 IP 10.0.0.2.55555 > 10.0.0.1.domain: 0+ A? www.ggg.com. (29)
22:11:23.363604 IP 10.0.0.1.domain > 10.0.0.2.55555: 0 1/0/0 A 222.222.222.222 (45)
22:11:23.491189 IP 10.0.0.2.55555 > 10.0.0.1.domain: 0+ A? www.ggg.com. (29)
22:11:23.491336 IP 10.0.0.1.domain > 10.0.0.2.55555: 0 1/0/0 A 222.222.222.222 (45)
22:11:23.679969 IP 10.0.0.2.55555 > 10.0.0.1.domain: 0+ A? www.ggg.com. (29)
22:11:23.680335 IP 10.0.0.1.domain > 10.0.0.2.55555: 0 1/0/0 A 222.222.222.222 (45)
22:11:23.837130 IP 10.0.0.2.55555 > 10.0.0.1.domain: 0+ A? www.ggg.com. (29)
22:11:23.837421 IP 10.0.0.1.domain > 10.0.0.2.55555: 0 1/0/0 A 222.222.222.222 (45)
22:11:23.961533 IP 10.0.0.2.55555 > 10.0.0.1.domain: 0+ A? www.ggg.com. (29)
22:11:23.961787 IP 10.0.0.1.domain > 10.0.0.2.55555: 0 1/0/0 A 222.222.222.222 (45)
22:11:24.070828 IP 10.0.0.2.55555 > 10.0.0.1.domain: 0+ A? www.ggg.com. (29)
22:11:24.070974 IP 10.0.0.1.domain > 10.0.0.2.55555: 0 1/0/0 A 222.222.222.222 (45)
22:11:24.217389 IP 10.0.0.2.55555 > 10.0.0.1.domain: 0+ A? www.ggg.com. (29)
22:11:24.217571 IP 10.0.0.1.domain > 10.0.0.2.55555: 0 1/0/0 A 222.222.222.222 (45)
22:11:24.349267 IP 10.0.0.2.55555 > 10.0.0.1.domain: 0+ A? www.ggg.com. (29)
22:11:24.349568 IP 10.0.0.1.domain > 10.0.0.2.55555: 0 1/0/0 A 222.222.222.222 (45)
22:11:24.492537 IP 10.0.0.2.55555 > 10.0.0.1.domain: 0+ A? www.ggg.com. (29)
22:11:24.492781 IP 10.0.0.1.domain > 10.0.0.2.55555: 0 1/0/0 A 222.222.222.222 (45)
22:11:24.592493 IP 10.0.0.2.55555 > 10.0.0.1.domain: 0+ A? www.ggg.com. (29)
22:11:24.592750 IP 10.0.0.1.domain > 10.0.0.2.55555: 0 1/0/0 A 222.222.222.222 (45)
22:11:24.685830 IP 10.0.0.2.55555 > 10.0.0.1.domain: 0+ A? www.ggg.com. (29)
22:11:24.685967 IP 10.0.0.1.domain > 10.0.0.2.55555: 0 1/0/0 A 222.222.222.222 (45)
22:11:24.829574 IP 10.0.0.2.55555 > 10.0.0.1.domain: 0+ A? www.ggg.com. (29)
22:11:24.829775 IP 10.0.0.1.domain > 10.0.0.2.55555: 0 1/0/0 A 222.222.222.222 (45)
22:11:25.002644 IP 10.0.0.2.55555 > 10.0.0.1.domain: 0+ A? www.ggg.com. (29)
22:11:25.003186 IP 10.0.0.1.domain > 10.0.0.2.55555: 0 1/0/0 A 222.222.222.222 (45)
22:11:25.093704 IP 10.0.0.2.55555 > 10.0.0.1.domain: 0+ A? www.ggg.com. (29)
22:11:25.093868 IP 10.0.0.1.domain > 10.0.0.2.55555: 0 1/0/0 A 222.222.222.222 (45)
22:11:25.192052 IP 10.0.0.2.55555 > 10.0.0.1.domain: 0+ A? www.ggg.com. (29)
22:11:25.192403 IP 10.0.0.1.domain > 10.0.0.2.55555: 0 1/0/0 A 222.222.222.222 (45)
22:11:25.307098 IP 10.0.0.2.55555 > 10.0.0.1.domain: 0+ A? www.ggg.com. (29)
22:11:25.307248 IP 10.0.0.1.domain > 10.0.0.2.55555: 0 1/0/0 A 222.222.222.222 (45)
22:11:25.450367 IP 10.0.0.2.55555 > 10.0.0.1.domain: 0+ A? www.ggg.com. (29)
22:11:25.450500 IP 10.0.0.1.domain > 10.0.0.2.55555: 0 1/0/0 A 222.222.222.222 (45)
22:11:25.554842 IP 10.0.0.2.55555 > 10.0.0.1.domain: 0+ A? www.ggg.com. (29)
22:11:25.555048 IP 10.0.0.1.domain > 10.0.0.2.55555: 0 1/0/0 A 222.222.222.222 (45)
22:11:25.655528 IP 10.0.0.2.55555 > 10.0.0.1.domain: 0+ A? www.ggg.com. (29)
22:11:25.655705 IP 10.0.0.1.domain > 10.0.0.2.55555: 0 1/0/0 A 222.222.222.222 (45)
22:11:25.731174 IP 10.0.0.2.55555 > 10.0.0.1.domain: 0+ A? www.ggg.com. (29)
22:11:25.731319 IP 10.0.0.1.domain > 10.0.0.2.55555: 0 1/0/0 A 222.222.222.222 (45)
22:11:25.835163 IP 10.0.0.2.55555 > 10.0.0.1.domain: 0+ A? www.ggg.com. (29)
22:11:25.835315 IP 10.0.0.1.domain > 10.0.0.2.55555: 0 1/0/0 A 222.222.222.222 (45)
22:11:25.936836 IP 10.0.0.2.55555 > 10.0.0.1.domain: 0+ A? www.ggg.com. (29)
22:11:25.937060 IP 10.0.0.1.domain > 10.0.0.2.55555: 0 1/0/0 A 222.222.222.222 (45)
22:11:26.055850 IP 10.0.0.2.55555 > 10.0.0.1.domain: 0+ A? www.ggg.com. (29)
22:11:26.055987 IP 10.0.0.1.domain > 10.0.0.2.55555: 0 1/0/0 A 222.222.222.222 (45)
22:11:26.222513 IP 10.0.0.2.55555 > 10.0.0.1.domain: 0+ A? www.ggg.com. (29)
22:11:26.222680 IP 10.0.0.1.domain > 10.0.0.2.55555: 0 1/0/0 A 222.222.222.222 (45)
22:11:26.326229 IP 10.0.0.2.55555 > 10.0.0.1.domain: 0+ A? www.ggg.com. (29)
22:11:26.326515 IP 10.0.0.1.domain > 10.0.0.2.55555: 0 1/0/0 A 222.222.222.222 (45)
22:11:26.472289 IP 10.0.0.2.55555 > 10.0.0.1.domain: 0+ A? www.ggg.com. (29)
22:11:26.472496 IP 10.0.0.1.domain > 10.0.0.2.55555: 0 1/0/0 A 222.222.222.222 (45)
22:11:26.634376 IP 10.0.0.2.55555 > 10.0.0.1.domain: 0+ A? www.ggg.com. (29)
22:11:26.634532 IP 10.0.0.1.domain > 10.0.0.2.55555: 0 1/0/0 A 222.222.222.222 (45)
22:11:26.758871 IP 10.0.0.2.55555 > 10.0.0.1.domain: 0+ A? www.ggg.com. (29)
22:11:26.759133 IP 10.0.0.1.domain > 10.0.0.2.55555: 0 1/0/0 A 222.222.222.222 (45)
22:11:26.874362 IP 10.0.0.2.55555 > 10.0.0.1.domain: 0+ A? www.ggg.com. (29)
22:11:26.874527 IP 10.0.0.1.domain > 10.0.0.2.55555: 0 1/0/0 A 222.222.222.222 (45)
22:11:26.977818 IP 10.0.0.2.55555 > 10.0.0.1.domain: 0+ A? www.ggg.com. (29)
22:11:26.977974 IP 10.0.0.1.domain > 10.0.0.2.55555: 0 1/0/0 A 222.222.222.222 (45)
22:11:27.120583 IP 10.0.0.2.55555 > 10.0.0.1.domain: 0+ A? www.ggg.com. (29)
22:11:27.120698 IP 10.0.0.1.domain > 10.0.0.2.55555: 0 1/0/0 A 222.222.222.222 (45)
22:11:27.286938 IP 10.0.0.2.55555 > 10.0.0.1.domain: 0+ A? www.ggg.com. (29)
22:11:27.287162 IP 10.0.0.1.domain > 10.0.0.2.55555: 0 1/0/0 A 222.222.222.222 (45)
22:11:27.406960 IP 10.0.0.2.55555 > 10.0.0.1.domain: 0+ A? www.ggg.com. (29)
22:11:27.407271 IP 10.0.0.1.domain > 10.0.0.2.55555: 0 1/0/0 A 222.222.222.222 (45)
22:11:27.526935 IP 10.0.0.2.55555 > 10.0.0.1.domain: 0+ A? www.ggg.com. (29)
22:11:27.527073 IP 10.0.0.1.domain > 10.0.0.2.55555: 0 1/0/0 A 222.222.222.222 (45)
22:11:27.669979 IP 10.0.0.2.55555 > 10.0.0.1.domain: 0+ A? www.ggg.com. (29)
22:11:27.670273 IP 10.0.0.1.domain > 10.0.0.2.55555: 0 1/0/0 A 222.222.222.222 (45)
22:11:27.822940 IP 10.0.0.2.55555 > 10.0.0.1.domain: 0+ A? www.ggg.com. (29)
22:11:27.823061 IP 10.0.0.1.domain > 10.0.0.2.55555: 0 1/0/0 A 222.222.222.222 (45)
22:11:27.953578 IP 10.0.0.2.55555 > 10.0.0.1.domain: 0+ A? www.ggg.com. (29)
22:11:27.953687 IP 10.0.0.1.domain > 10.0.0.2.55555: 0 1/0/0 A 222.222.222.222 (45)
22:11:28.090173 IP 10.0.0.2.55555 > 10.0.0.1.domain: 0+ A? www.ggg.com. (29)
22:11:28.090467 IP 10.0.0.1.domain > 10.0.0.2.55555: 0 1/0/0 A 222.222.222.222 (45)
22:11:28.209737 IP 10.0.0.2.55555 > 10.0.0.1.domain: 0+ A? www.ggg.com. (29)
22:11:28.209910 IP 10.0.0.1.domain > 10.0.0.2.55555: 0 1/0/0 A 222.222.222.222 (45)
22:11:28.329955 IP 10.0.0.2.55555 > 10.0.0.1.domain: 0+ A? www.ggg.com. (29)
22:11:28.330118 IP 10.0.0.1.domain > 10.0.0.2.55555: 0 1/0/0 A 222.222.222.222 (45)
22:11:28.427313 IP 10.0.0.2.55555 > 10.0.0.1.domain: 0+ A? www.ggg.com. (29)
22:11:28.427643 IP 10.0.0.1.domain > 10.0.0.2.55555: 0 1/0/0 A 222.222.222.222 (45)
22:11:28.559270 IP 10.0.0.2.55555 > 10.0.0.1.domain: 0+ A? www.ggg.com. (29)
22:11:28.559570 IP 10.0.0.1.domain > 10.0.0.2.55555: 0 1/0/0 A 222.222.222.222 (45)
22:11:28.702887 IP 10.0.0.2.55555 > 10.0.0.1.domain: 0+ A? www.ggg.com. (29)
22:11:28.703081 IP 10.0.0.1.domain > 10.0.0.2.55555: 0 1/0/0 A 222.222.222.222 (45)
22:11:28.828595 IP 10.0.0.2.55555 > 10.0.0.1.domain: 0+ A? www.ggg.com. (29)
22:11:28.828778 IP 10.0.0.1.domain > 10.0.0.2.55555: 0 1/0/0 A 222.222.222.222 (45)
22:11:28.959405 IP 10.0.0.2.55555 > 10.0.0.1.domain: 0+ A? www.ggg.com. (29)
22:11:28.959638 IP 10.0.0.1.domain > 10.0.0.2.55555: 0 1/0/0 A 222.222.222.222 (45)
22:11:29.078298 IP 10.0.0.2.55555 > 10.0.0.1.domain: 0+ A? www.ggg.com. (29)
22:11:29.078471 IP 10.0.0.1.domain > 10.0.0.2.55555: 0 1/0/0 A 222.222.222.222 (45)
22:11:29.232360 IP 10.0.0.2.55555 > 10.0.0.1.domain: 0+ A? www.ggg.com. (29)
22:11:29.232408 IP 10.0.0.1.domain > 10.0.0.2.55555: 0 1/0/0 A 222.222.222.222 (45)
22:11:29.323822 IP 10.0.0.2.55555 > 10.0.0.1.domain: 0+ A? www.ggg.com. (29)
22:11:29.323929 IP 10.0.0.1.domain > 10.0.0.2.55555: 0 1/0/0 A 222.222.222.222 (45)
22:11:29.406175 IP 10.0.0.2.55555 > 10.0.0.1.domain: 0+ A? www.ggg.com. (29)
22:11:29.406316 IP 10.0.0.1.domain > 10.0.0.2.55555: 0 1/0/0 A 222.222.222.222 (45)
22:11:29.539292 IP 10.0.0.2.55555 > 10.0.0.1.domain: 0+ A? www.ggg.com. (29)
22:11:29.539432 IP 10.0.0.1.domain > 10.0.0.2.55555: 0 1/0/0 A 222.222.222.222 (45)
22:11:29.702255 IP 10.0.0.2.55555 > 10.0.0.1.domain: 0+ A? www.ggg.com. (29)
22:11:29.702397 IP 10.0.0.1.domain > 10.0.0.2.55555: 0 1/0/0 A 222.222.222.222 (45)
22:11:29.885398 IP 10.0.0.2.55555 > 10.0.0.1.domain: 0+ A? www.ggg.com. (29)
22:11:29.886555 IP 10.0.0.1.domain > 10.0.0.2.55555: 0 1/0/0 A 222.222.222.222 (45)
22:11:30.040225 IP 10.0.0.2.55555 > 10.0.0.1.domain: 0+ A? www.ggg.com. (29)
22:11:30.040342 IP 10.0.0.1.domain > 10.0.0.2.55555: 0 1/0/0 A 222.222.222.222 (45)
22:11:30.190451 IP 10.0.0.2.55555 > 10.0.0.1.domain: 0+ A? www.ggg.com. (29)
22:11:30.190602 IP 10.0.0.1.domain > 10.0.0.2.55555: 0 1/0/0 A 222.222.222.222 (45)
22:11:30.320931 IP 10.0.0.2.55555 > 10.0.0.1.domain: 0+ A? www.ggg.com. (29)
22:11:30.321051 IP 10.0.0.1.domain > 10.0.0.2.55555: 0 1/0/0 A 222.222.222.222 (45)
22:11:30.518429 IP 10.0.0.2.55555 > 10.0.0.1.domain: 0+ A? www.ggg.com. (29)
22:11:30.518701 IP 10.0.0.1.domain > 10.0.0.2.55555: 0 1/0/0 A 222.222.222.222 (45)
22:11:30.659193 IP 10.0.0.2.55555 > 10.0.0.1.domain: 0+ A? www.ggg.com. (29)
22:11:30.659463 IP 10.0.0.1.domain > 10.0.0.2.55555: 0 1/0/0 A 222.222.222.222 (45)
22:11:30.813338 IP 10.0.0.2.55555 > 10.0.0.1.domain: 0+ A? www.ggg.com. (29)
22:11:30.813530 IP 10.0.0.1.domain > 10.0.0.2.55555: 0 1/0/0 A 222.222.222.222 (45)
22:11:30.971794 IP 10.0.0.2.55555 > 10.0.0.1.domain: 0+ A? www.ggg.com. (29)
22:11:30.972137 IP 10.0.0.1.domain > 10.0.0.2.55555: 0 1/0/0 A 222.222.222.222 (45)
22:11:31.117417 IP 10.0.0.2.55555 > 10.0.0.1.domain: 0+ A? www.ggg.com. (29)
22:11:31.117623 IP 10.0.0.1.domain > 10.0.0.2.55555: 0 1/0/0 A 222.222.222.222 (45)
22:11:31.304943 IP 10.0.0.2.55555 > 10.0.0.1.domain: 0+ A? www.ggg.com. (29)
22:11:31.305266 IP 10.0.0.1.domain > 10.0.0.2.55555: 0 1/0/0 A 222.222.222.222 (45)
22:11:31.447433 IP 10.0.0.2.55555 > 10.0.0.1.domain: 0+ A? www.ggg.com. (29)
22:11:31.447620 IP 10.0.0.1.domain > 10.0.0.2.55555: 0 1/0/0 A 222.222.222.222 (45)
22:11:31.606236 IP 10.0.0.2.55555 > 10.0.0.1.domain: 0+ A? www.ggg.com. (29)
22:11:31.606406 IP 10.0.0.1.domain > 10.0.0.2.55555: 0 1/0/0 A 222.222.222.222 (45)
22:11:31.742305 IP 10.0.0.2.55555 > 10.0.0.1.domain: 0+ A? www.ggg.com. (29)
22:11:31.742442 IP 10.0.0.1.domain > 10.0.0.2.55555: 0 1/0/0 A 222.222.222.222 (45)
22:11:31.899851 IP 10.0.0.2.55555 > 10.0.0.1.domain: 0+ A? www.ggg.com. (29)
22:11:31.900463 IP 10.0.0.1.domain > 10.0.0.2.55555: 0 1/0/0 A 222.222.222.222 (45)

