13:48:45.053943 IP 10.0.0.1.domain > 10.0.0.2.55556: 0 1/0/0 A 111.111.111.111 (53)
13:48:45.082948 IP 10.0.0.1.domain > 10.0.0.2.55556: 0 1/0/0 A 111.111.111.111 (53)
13:48:45.116236 IP 10.0.0.1.domain > 10.0.0.2.55556: 0 1/0/0 A 111.111.111.111 (53)
13:48:45.155807 IP 10.0.0.1.domain > 10.0.0.2.55556: 0 1/0/0 A 111.111.111.111 (53)
13:48:45.190419 IP 10.0.0.1.domain > 10.0.0.2.55556: 0 1/0/0 A 111.111.111.111 (53)
13:48:45.226365 IP 10.0.0.1.domain > 10.0.0.2.55556: 0 1/0/0 A 111.111.111.111 (53)
13:48:45.262637 IP 10.0.0.1.domain > 10.0.0.2.55556: 0 1/0/0 A 111.111.111.111 (53)
13:48:45.297319 IP 10.0.0.1.domain > 10.0.0.2.55556: 0 1/0/0 A 111.111.111.111 (53)
13:48:45.331702 IP 10.0.0.1.domain > 10.0.0.2.55556: 0 1/0/0 A 111.111.111.111 (53)
13:48:45.368185 IP 10.0.0.1.domain > 10.0.0.2.55556: 0 1/0/0 A 111.111.111.111 (53)
13:48:45.404890 IP 10.0.0.1.domain > 10.0.0.2.55556: 0 1/0/0 A 111.111.111.111 (53)
13:48:45.441813 IP 10.0.0.1.domain > 10.0.0.2.55556: 0 1/0/0 A 111.111.111.111 (53)
13:48:45.477389 IP 10.0.0.1.domain > 10.0.0.2.55556: 0 1/0/0 A 111.111.111.111 (53)
13:48:45.512980 IP 10.0.0.1.domain > 10.0.0.2.55556: 0 1/0/0 A 111.111.111.111 (53)
13:48:45.548576 IP 10.0.0.1.domain > 10.0.0.2.55556: 0 1/0/0 A 111.111.111.111 (53)
13:48:45.584888 IP 10.0.0.1.domain > 10.0.0.2.55556: 0 1/0/0 A 111.111.111.111 (53)
13:48:45.620561 IP 10.0.0.1.domain > 10.0.0.2.55556: 0 1/0/0 A 111.111.111.111 (53)
13:48:45.655074 IP 10.0.0.1.domain > 10.0.0.2.55556: 0 1/0/0 A 111.111.111.111 (53)
13:48:45.687338 IP 10.0.0.1.domain > 10.0.0.2.55556: 0 1/0/0 A 111.111.111.111 (53)
13:48:45.724047 IP 10.0.0.1.domain > 10.0.0.2.55556: 0 1/0/0 A 111.111.111.111 (53)
13:48:45.760187 IP 10.0.0.1.domain > 10.0.0.2.55556: 0 1/0/0 A 111.111.111.111 (53)
13:48:45.796578 IP 10.0.0.1.domain > 10.0.0.2.55556: 0 1/0/0 A 111.111.111.111 (53)
13:48:45.834310 IP 10.0.0.1.domain > 10.0.0.2.55556: 0 1/0/0 A 111.111.111.111 (53)
13:48:45.874019 IP 10.0.0.1.domain > 10.0.0.2.55556: 0 1/0/0 A 111.111.111.111 (53)
13:48:45.911542 IP 10.0.0.1.domain > 10.0.0.2.55556: 0 1/0/0 A 111.111.111.111 (53)
13:48:45.949425 IP 10.0.0.1.domain > 10.0.0.2.55556: 0 1/0/0 A 111.111.111.111 (53)
13:48:45.986348 IP 10.0.0.1.domain > 10.0.0.2.55556: 0 1/0/0 A 111.111.111.111 (53)
13:48:46.024912 IP 10.0.0.1.domain > 10.0.0.2.55556: 0 1/0/0 A 111.111.111.111 (53)
13:48:46.058461 IP 10.0.0.1.domain > 10.0.0.2.55556: 0 1/0/0 A 111.111.111.111 (53)
13:48:46.094566 IP 10.0.0.1.domain > 10.0.0.2.55556: 0 1/0/0 A 111.111.111.111 (53)
13:48:46.128916 IP 10.0.0.1.domain > 10.0.0.2.55556: 0 1/0/0 A 111.111.111.111 (53)
13:48:46.169068 IP 10.0.0.1.domain > 10.0.0.2.55556: 0 1/0/0 A 111.111.111.111 (53)
13:48:46.203225 IP 10.0.0.1.domain > 10.0.0.2.55556: 0 1/0/0 A 111.111.111.111 (53)
13:48:46.238251 IP 10.0.0.1.domain > 10.0.0.2.55556: 0 1/0/0 A 111.111.111.111 (53)
13:48:46.272761 IP 10.0.0.1.domain > 10.0.0.2.55556: 0 1/0/0 A 111.111.111.111 (53)
13:48:46.308766 IP 10.0.0.1.domain > 10.0.0.2.55556: 0 1/0/0 A 111.111.111.111 (53)
13:48:46.346154 IP 10.0.0.1.domain > 10.0.0.2.55556: 0 1/0/0 A 111.111.111.111 (53)
13:48:46.384598 IP 10.0.0.1.domain > 10.0.0.2.55556: 0 1/0/0 A 111.111.111.111 (53)
13:48:46.423226 IP 10.0.0.1.domain > 10.0.0.2.55556: 0 1/0/0 A 111.111.111.111 (53)
13:48:46.455263 IP 10.0.0.1.domain > 10.0.0.2.55556: 0 1/0/0 A 111.111.111.111 (53)
13:48:46.490353 IP 10.0.0.1.domain > 10.0.0.2.55556: 0 1/0/0 A 111.111.111.111 (53)
13:48:46.527304 IP 10.0.0.1.domain > 10.0.0.2.55556: 0 1/0/0 A 111.111.111.111 (53)
13:48:46.565109 IP 10.0.0.1.domain > 10.0.0.2.55556: 0 1/0/0 A 111.111.111.111 (53)
13:48:46.598476 IP 10.0.0.1.domain > 10.0.0.2.55556: 0 1/0/0 A 111.111.111.111 (53)
13:48:46.640532 IP 10.0.0.1.domain > 10.0.0.2.55556: 0 1/0/0 A 111.111.111.111 (53)
13:48:46.680574 IP 10.0.0.1.domain > 10.0.0.2.55556: 0 1/0/0 A 111.111.111.111 (53)
13:48:46.717938 IP 10.0.0.1.domain > 10.0.0.2.55556: 0 1/0/0 A 111.111.111.111 (53)
13:48:46.756962 IP 10.0.0.1.domain > 10.0.0.2.55556: 0 1/0/0 A 111.111.111.111 (53)
13:48:46.790811 IP 10.0.0.1.domain > 10.0.0.2.55556: 0 1/0/0 A 111.111.111.111 (53)
13:48:46.824950 IP 10.0.0.1.domain > 10.0.0.2.55556: 0 1/0/0 A 111.111.111.111 (53)
13:48:46.865101 IP 10.0.0.1.domain > 10.0.0.2.55556: 0 1/0/0 A 111.111.111.111 (53)
13:48:46.901495 IP 10.0.0.1.domain > 10.0.0.2.55556: 0 1/0/0 A 111.111.111.111 (53)
13:48:46.939664 IP 10.0.0.1.domain > 10.0.0.2.55556: 0 1/0/0 A 111.111.111.111 (53)
13:48:46.979193 IP 10.0.0.1.domain > 10.0.0.2.55556: 0 1/0/0 A 111.111.111.111 (53)
13:48:47.017468 IP 10.0.0.1.domain > 10.0.0.2.55556: 0 1/0/0 A 111.111.111.111 (53)
13:48:47.050184 IP 10.0.0.1.domain > 10.0.0.2.55556: 0 1/0/0 A 111.111.111.111 (53)
13:48:47.088718 IP 10.0.0.1.domain > 10.0.0.2.55556: 0 1/0/0 A 111.111.111.111 (53)
13:48:47.126006 IP 10.0.0.1.domain > 10.0.0.2.55556: 0 1/0/0 A 111.111.111.111 (53)
13:48:47.161638 IP 10.0.0.1.domain > 10.0.0.2.55556: 0 1/0/0 A 111.111.111.111 (53)
13:48:47.198405 IP 10.0.0.1.domain > 10.0.0.2.55556: 0 1/0/0 A 111.111.111.111 (53)
13:48:47.236375 IP 10.0.0.1.domain > 10.0.0.2.55556: 0 1/0/0 A 111.111.111.111 (53)
13:48:47.272796 IP 10.0.0.1.domain > 10.0.0.2.55556: 0 1/0/0 A 111.111.111.111 (53)
13:48:47.308928 IP 10.0.0.1.domain > 10.0.0.2.55556: 0 1/0/0 A 111.111.111.111 (53)
13:48:47.340695 IP 10.0.0.1.domain > 10.0.0.2.55556: 0 1/0/0 A 111.111.111.111 (53)
13:48:47.374988 IP 10.0.0.1.domain > 10.0.0.2.55556: 0 1/0/0 A 111.111.111.111 (53)
13:48:47.406157 IP 10.0.0.1.domain > 10.0.0.2.55556: 0 1/0/0 A 111.111.111.111 (53)
13:48:47.444579 IP 10.0.0.1.domain > 10.0.0.2.55556: 0 1/0/0 A 111.111.111.111 (53)
13:48:47.481371 IP 10.0.0.1.domain > 10.0.0.2.55556: 0 1/0/0 A 111.111.111.111 (53)
13:48:47.514970 IP 10.0.0.1.domain > 10.0.0.2.55556: 0 1/0/0 A 111.111.111.111 (53)
13:48:47.567084 IP 10.0.0.1.domain > 10.0.0.2.55556: 0 1/0/0 A 111.111.111.111 (53)
13:48:47.610996 IP 10.0.0.1.domain > 10.0.0.2.55556: 0 1/0/0 A 111.111.111.111 (53)
13:48:47.673159 IP 10.0.0.1.domain > 10.0.0.2.55556: 0 1/0/0 A 111.111.111.111 (53)
13:48:47.733016 IP 10.0.0.1.domain > 10.0.0.2.55556: 0 1/0/0 A 111.111.111.111 (53)
13:48:47.785339 IP 10.0.0.1.domain > 10.0.0.2.55556: 0 1/0/0 A 111.111.111.111 (53)
13:48:47.842299 IP 10.0.0.1.domain > 10.0.0.2.55556: 0 1/0/0 A 111.111.111.111 (53)
13:48:47.894873 IP 10.0.0.1.domain > 10.0.0.2.55556: 0 1/0/0 A 111.111.111.111 (53)
13:48:47.951509 IP 10.0.0.1.domain > 10.0.0.2.55556: 0 1/0/0 A 111.111.111.111 (53)
13:48:47.988730 IP 10.0.0.1.domain > 10.0.0.2.55556: 0 1/0/0 A 111.111.111.111 (53)
13:48:48.024432 IP 10.0.0.1.domain > 10.0.0.2.55556: 0 1/0/0 A 111.111.111.111 (53)
13:48:48.061266 IP 10.0.0.1.domain > 10.0.0.2.55556: 0 1/0/0 A 111.111.111.111 (53)
13:48:48.099491 IP 10.0.0.1.domain > 10.0.0.2.55556: 0 1/0/0 A 111.111.111.111 (53)
13:48:48.134382 IP 10.0.0.1.domain > 10.0.0.2.55556: 0 1/0/0 A 111.111.111.111 (53)
13:48:48.172455 IP 10.0.0.1.domain > 10.0.0.2.55556: 0 1/0/0 A 111.111.111.111 (53)
13:48:48.210728 IP 10.0.0.1.domain > 10.0.0.2.55556: 0 1/0/0 A 111.111.111.111 (53)
13:48:48.251477 IP 10.0.0.1.domain > 10.0.0.2.55556: 0 1/0/0 A 111.111.111.111 (53)
13:48:48.288408 IP 10.0.0.1.domain > 10.0.0.2.55556: 0 1/0/0 A 111.111.111.111 (53)
13:48:48.324869 IP 10.0.0.1.domain > 10.0.0.2.55556: 0 1/0/0 A 111.111.111.111 (53)
13:48:48.358690 IP 10.0.0.1.domain > 10.0.0.2.55556: 0 1/0/0 A 111.111.111.111 (53)
13:48:48.391808 IP 10.0.0.1.domain > 10.0.0.2.55556: 0 1/0/0 A 111.111.111.111 (53)
13:48:48.431938 IP 10.0.0.1.domain > 10.0.0.2.55556: 0 1/0/0 A 111.111.111.111 (53)
13:48:48.468490 IP 10.0.0.1.domain > 10.0.0.2.55556: 0 1/0/0 A 111.111.111.111 (53)
13:48:48.504513 IP 10.0.0.1.domain > 10.0.0.2.55556: 0 1/0/0 A 111.111.111.111 (53)
13:48:48.543798 IP 10.0.0.1.domain > 10.0.0.2.55556: 0 1/0/0 A 111.111.111.111 (53)
13:48:48.578723 IP 10.0.0.1.domain > 10.0.0.2.55556: 0 1/0/0 A 111.111.111.111 (53)
13:48:48.616607 IP 10.0.0.1.domain > 10.0.0.2.55556: 0 1/0/0 A 111.111.111.111 (53)
13:48:48.653026 IP 10.0.0.1.domain > 10.0.0.2.55556: 0 1/0/0 A 111.111.111.111 (53)
13:48:48.689786 IP 10.0.0.1.domain > 10.0.0.2.55556: 0 1/0/0 A 111.111.111.111 (53)
13:48:48.721719 IP 10.0.0.1.domain > 10.0.0.2.55556: 0 1/0/0 A 111.111.111.111 (53)
13:48:48.756672 IP 10.0.0.1.domain > 10.0.0.2.55556: 0 1/0/0 A 111.111.111.111 (53)
13:48:48.790905 IP 10.0.0.1.domain > 10.0.0.2.55556: 0 1/0/0 A 111.111.111.111 (53)
13:48:48.831155 IP 10.0.0.1.domain > 10.0.0.2.55556: 0 1/0/0 A 111.111.111.111 (53)
13:48:48.869512 IP 10.0.0.1.domain > 10.0.0.2.55556: 0 1/0/0 A 111.111.111.111 (53)
13:48:48.910109 IP 10.0.0.1.domain > 10.0.0.2.55556: 0 1/0/0 A 111.111.111.111 (53)
13:48:48.946498 IP 10.0.0.1.domain > 10.0.0.2.55556: 0 1/0/0 A 111.111.111.111 (53)
13:48:48.986357 IP 10.0.0.1.domain > 10.0.0.2.55556: 0 1/0/0 A 111.111.111.111 (53)
13:48:49.027211 IP 10.0.0.1.domain > 10.0.0.2.55556: 0 1/0/0 A 111.111.111.111 (53)
13:48:49.066480 IP 10.0.0.1.domain > 10.0.0.2.55556: 0 1/0/0 A 111.111.111.111 (53)
13:48:49.102006 IP 10.0.0.1.domain > 10.0.0.2.55556: 0 1/0/0 A 111.111.111.111 (53)
13:48:49.133751 IP 10.0.0.1.domain > 10.0.0.2.55556: 0 1/0/0 A 111.111.111.111 (53)
13:48:49.168730 IP 10.0.0.1.domain > 10.0.0.2.55556: 0 1/0/0 A 111.111.111.111 (53)
13:48:49.202394 IP 10.0.0.1.domain > 10.0.0.2.55556: 0 1/0/0 A 111.111.111.111 (53)
13:48:49.240368 IP 10.0.0.1.domain > 10.0.0.2.55556: 0 1/0/0 A 111.111.111.111 (53)
13:48:49.279305 IP 10.0.0.1.domain > 10.0.0.2.55556: 0 1/0/0 A 111.111.111.111 (53)
13:48:49.318380 IP 10.0.0.1.domain > 10.0.0.2.55556: 0 1/0/0 A 111.111.111.111 (53)
13:48:49.354632 IP 10.0.0.1.domain > 10.0.0.2.55556: 0 1/0/0 A 111.111.111.111 (53)
13:48:49.390561 IP 10.0.0.1.domain > 10.0.0.2.55556: 0 1/0/0 A 111.111.111.111 (53)
13:48:49.430677 IP 10.0.0.1.domain > 10.0.0.2.55556: 0 1/0/0 A 111.111.111.111 (53)
13:48:49.468707 IP 10.0.0.1.domain > 10.0.0.2.55556: 0 1/0/0 A 111.111.111.111 (53)
13:48:49.504910 IP 10.0.0.1.domain > 10.0.0.2.55556: 0 1/0/0 A 111.111.111.111 (53)
13:48:49.541824 IP 10.0.0.1.domain > 10.0.0.2.55556: 0 1/0/0 A 111.111.111.111 (53)
13:48:49.581186 IP 10.0.0.1.domain > 10.0.0.2.55556: 0 1/0/0 A 111.111.111.111 (53)
13:48:49.616948 IP 10.0.0.1.domain > 10.0.0.2.55556: 0 1/0/0 A 111.111.111.111 (53)
13:48:49.650749 IP 10.0.0.1.domain > 10.0.0.2.55556: 0 1/0/0 A 111.111.111.111 (53)
13:48:49.688289 IP 10.0.0.1.domain > 10.0.0.2.55556: 0 1/0/0 A 111.111.111.111 (53)
13:48:49.726246 IP 10.0.0.1.domain > 10.0.0.2.55556: 0 1/0/0 A 111.111.111.111 (53)
13:48:49.759680 IP 10.0.0.1.domain > 10.0.0.2.55556: 0 1/0/0 A 111.111.111.111 (53)
13:48:49.791780 IP 10.0.0.1.domain > 10.0.0.2.55556: 0 1/0/0 A 111.111.111.111 (53)
13:48:49.827428 IP 10.0.0.1.domain > 10.0.0.2.55556: 0 1/0/0 A 111.111.111.111 (53)
13:48:49.864869 IP 10.0.0.1.domain > 10.0.0.2.55556: 0 1/0/0 A 111.111.111.111 (53)
13:48:49.901054 IP 10.0.0.1.domain > 10.0.0.2.55556: 0 1/0/0 A 111.111.111.111 (53)
13:48:49.945427 IP 10.0.0.1.domain > 10.0.0.2.55556: 0 1/0/0 A 111.111.111.111 (53)
13:48:49.980954 IP 10.0.0.1.domain > 10.0.0.2.55556: 0 1/0/0 A 111.111.111.111 (53)
13:48:50.015900 IP 10.0.0.1.domain > 10.0.0.2.55556: 0 1/0/0 A 111.111.111.111 (53)
13:48:50.051351 IP 10.0.0.1.domain > 10.0.0.2.55556: 0 1/0/0 A 111.111.111.111 (53)
13:48:50.087149 IP 10.0.0.1.domain > 10.0.0.2.55556: 0 1/0/0 A 111.111.111.111 (53)
13:48:50.121901 IP 10.0.0.1.domain > 10.0.0.2.55556: 0 1/0/0 A 111.111.111.111 (53)
13:48:50.154697 IP 10.0.0.1.domain > 10.0.0.2.55556: 0 1/0/0 A 111.111.111.111 (53)
13:48:50.190110 IP 10.0.0.1.domain > 10.0.0.2.55556: 0 1/0/0 A 111.111.111.111 (53)
13:48:50.225254 IP 10.0.0.1.domain > 10.0.0.2.55556: 0 1/0/0 A 111.111.111.111 (53)
13:48:50.260378 IP 10.0.0.1.domain > 10.0.0.2.55556: 0 1/0/0 A 111.111.111.111 (53)
13:48:50.296996 IP 10.0.0.1.domain > 10.0.0.2.55556: 0 1/0/0 A 111.111.111.111 (53)
13:48:50.336455 IP 10.0.0.1.domain > 10.0.0.2.55556: 0 1/0/0 A 111.111.111.111 (53)
13:48:50.372548 IP 10.0.0.1.domain > 10.0.0.2.55556: 0 1/0/0 A 111.111.111.111 (53)
13:48:50.407608 IP 10.0.0.1.domain > 10.0.0.2.55556: 0 1/0/0 A 111.111.111.111 (53)
13:48:50.443507 IP 10.0.0.1.domain > 10.0.0.2.55556: 0 1/0/0 A 111.111.111.111 (53)
13:48:50.478781 IP 10.0.0.1.domain > 10.0.0.2.55556: 0 1/0/0 A 111.111.111.111 (53)
13:48:50.516075 IP 10.0.0.1.domain > 10.0.0.2.55556: 0 1/0/0 A 111.111.111.111 (53)
13:48:50.554290 IP 10.0.0.1.domain > 10.0.0.2.55556: 0 1/0/0 A 111.111.111.111 (53)
13:48:50.593949 IP 10.0.0.1.domain > 10.0.0.2.55556: 0 1/0/0 A 111.111.111.111 (53)
13:48:50.632958 IP 10.0.0.1.domain > 10.0.0.2.55556: 0 1/0/0 A 111.111.111.111 (53)
13:48:50.668273 IP 10.0.0.1.domain > 10.0.0.2.55556: 0 1/0/0 A 111.111.111.111 (53)
13:48:50.700068 IP 10.0.0.1.domain > 10.0.0.2.55556: 0 1/0/0 A 111.111.111.111 (53)
13:48:50.736779 IP 10.0.0.1.domain > 10.0.0.2.55556: 0 1/0/0 A 111.111.111.111 (53)
13:48:50.770381 IP 10.0.0.1.domain > 10.0.0.2.55556: 0 1/0/0 A 111.111.111.111 (53)
13:48:50.806748 IP 10.0.0.1.domain > 10.0.0.2.55556: 0 1/0/0 A 111.111.111.111 (53)
13:48:50.842832 IP 10.0.0.1.domain > 10.0.0.2.55556: 0 1/0/0 A 111.111.111.111 (53)
13:48:50.907178 IP 10.0.0.1.domain > 10.0.0.2.55556: 0 1/0/0 A 111.111.111.111 (53)
13:48:50.974982 IP 10.0.0.1.domain > 10.0.0.2.55556: 0 1/0/0 A 111.111.111.111 (53)
13:48:51.059293 IP 10.0.0.1.domain > 10.0.0.2.55556: 0 1/0/0 A 111.111.111.111 (53)
13:48:51.129170 IP 10.0.0.1.domain > 10.0.0.2.55556: 0 1/0/0 A 111.111.111.111 (53)
13:48:51.200805 IP 10.0.0.1.domain > 10.0.0.2.55556: 0 1/0/0 A 111.111.111.111 (53)
13:48:51.259673 IP 10.0.0.1.domain > 10.0.0.2.55556: 0 1/0/0 A 111.111.111.111 (53)
13:48:51.325062 IP 10.0.0.1.domain > 10.0.0.2.55556: 0 1/0/0 A 111.111.111.111 (53)
13:48:51.379839 IP 10.0.0.2.55555 > 10.0.0.1.domain: 0+ A? www.ggg.com. (29)
13:48:51.380058 IP 10.0.0.1.domain > 10.0.0.2.55555: 0 1/0/0 A 222.222.222.222 (45)
13:48:51.408258 IP 10.0.0.1.domain > 10.0.0.2.55556: 0 1/0/0 A 111.111.111.111 (53)
13:48:51.475142 IP 10.0.0.2.55555 > 10.0.0.1.domain: 0+ A? www.ggg.com. (29)
13:48:51.475221 IP 10.0.0.1.domain > 10.0.0.2.55555: 0 1/0/0 A 222.222.222.222 (45)
13:48:51.486657 IP 10.0.0.1.domain > 10.0.0.2.55556: 0 1/0/0 A 111.111.111.111 (53)
13:48:51.553583 IP 10.0.0.2.55555 > 10.0.0.1.domain: 0+ A? www.ggg.com. (29)
13:48:51.553774 IP 10.0.0.1.domain > 10.0.0.2.55555: 0 1/0/0 A 222.222.222.222 (45)
13:48:51.567442 IP 10.0.0.1.domain > 10.0.0.2.55556: 0 1/0/0 A 111.111.111.111 (53)
13:48:51.618915 IP 10.0.0.2.55555 > 10.0.0.1.domain: 0+ A? www.ggg.com. (29)
13:48:51.619138 IP 10.0.0.1.domain > 10.0.0.2.55555: 0 1/0/0 A 222.222.222.222 (45)
13:48:51.652923 IP 10.0.0.1.domain > 10.0.0.2.55556: 0 1/0/0 A 111.111.111.111 (53)
13:48:51.694945 IP 10.0.0.2.55555 > 10.0.0.1.domain: 0+ A? www.ggg.com. (29)
13:48:51.695993 IP 10.0.0.1.domain > 10.0.0.2.55555: 0 1/0/0 A 222.222.222.222 (45)
13:48:51.715559 IP 10.0.0.1.domain > 10.0.0.2.55556: 0 1/0/0 A 111.111.111.111 (53)
13:48:51.759286 IP 10.0.0.2.55555 > 10.0.0.1.domain: 0+ A? www.ggg.com. (29)
13:48:51.760462 IP 10.0.0.1.domain > 10.0.0.2.55555: 0 1/0/0 A 222.222.222.222 (45)
13:48:51.801581 IP 10.0.0.1.domain > 10.0.0.2.55556: 0 1/0/0 A 111.111.111.111 (53)
13:48:51.821315 IP 10.0.0.2.55555 > 10.0.0.1.domain: 0+ A? www.ggg.com. (29)
13:48:51.821454 IP 10.0.0.1.domain > 10.0.0.2.55555: 0 1/0/0 A 222.222.222.222 (45)
13:48:51.877269 IP 10.0.0.1.domain > 10.0.0.2.55556: 0 1/0/0 A 111.111.111.111 (53)
13:48:51.888819 IP 10.0.0.2.55555 > 10.0.0.1.domain: 0+ A? www.ggg.com. (29)
13:48:51.889000 IP 10.0.0.1.domain > 10.0.0.2.55555: 0 1/0/0 A 222.222.222.222 (45)
13:48:51.956887 IP 10.0.0.2.55555 > 10.0.0.1.domain: 0+ A? www.ggg.com. (29)
13:48:51.957076 IP 10.0.0.1.domain > 10.0.0.2.55555: 0 1/0/0 A 222.222.222.222 (45)
13:48:51.962510 IP 10.0.0.1.domain > 10.0.0.2.55556: 0 1/0/0 A 111.111.111.111 (53)
13:48:51.988904 IP 10.0.0.2.55555 > 10.0.0.1.domain: 0+ A? www.ggg.com. (29)
13:48:51.989061 IP 10.0.0.1.domain > 10.0.0.2.55555: 0 1/0/0 A 222.222.222.222 (45)
13:48:52.034482 IP 10.0.0.1.domain > 10.0.0.2.55556: 0 1/0/0 A 111.111.111.111 (53)
13:48:52.092710 IP 10.0.0.1.domain > 10.0.0.2.55556: 0 1/0/0 A 111.111.111.111 (53)
13:48:52.126657 IP 10.0.0.1.domain > 10.0.0.2.55556: 0 1/0/0 A 111.111.111.111 (53)
13:48:52.161865 IP 10.0.0.1.domain > 10.0.0.2.55556: 0 1/0/0 A 111.111.111.111 (53)
13:48:52.197716 IP 10.0.0.1.domain > 10.0.0.2.55556: 0 1/0/0 A 111.111.111.111 (53)
13:48:52.233359 IP 10.0.0.1.domain > 10.0.0.2.55556: 0 1/0/0 A 111.111.111.111 (53)
13:48:52.265495 IP 10.0.0.1.domain > 10.0.0.2.55556: 0 1/0/0 A 111.111.111.111 (53)
13:48:52.299463 IP 10.0.0.1.domain > 10.0.0.2.55556: 0 1/0/0 A 111.111.111.111 (53)
13:48:52.334182 IP 10.0.0.1.domain > 10.0.0.2.55556: 0 1/0/0 A 111.111.111.111 (53)
13:48:52.370985 IP 10.0.0.1.domain > 10.0.0.2.55556: 0 1/0/0 A 111.111.111.111 (53)
13:48:52.407513 IP 10.0.0.1.domain > 10.0.0.2.55556: 0 1/0/0 A 111.111.111.111 (53)
13:48:52.442992 IP 10.0.0.1.domain > 10.0.0.2.55556: 0 1/0/0 A 111.111.111.111 (53)
13:48:52.477707 IP 10.0.0.1.domain > 10.0.0.2.55556: 0 1/0/0 A 111.111.111.111 (53)
13:48:52.517689 IP 10.0.0.1.domain > 10.0.0.2.55556: 0 1/0/0 A 111.111.111.111 (53)
13:48:52.552993 IP 10.0.0.1.domain > 10.0.0.2.55556: 0 1/0/0 A 111.111.111.111 (53)
13:48:52.587758 IP 10.0.0.1.domain > 10.0.0.2.55556: 0 1/0/0 A 111.111.111.111 (53)
13:48:52.622523 IP 10.0.0.1.domain > 10.0.0.2.55556: 0 1/0/0 A 111.111.111.111 (53)
13:48:52.660867 IP 10.0.0.1.domain > 10.0.0.2.55556: 0 1/0/0 A 111.111.111.111 (53)
13:48:52.696960 IP 10.0.0.1.domain > 10.0.0.2.55556: 0 1/0/0 A 111.111.111.111 (53)
13:48:52.734521 IP 10.0.0.1.domain > 10.0.0.2.55556: 0 1/0/0 A 111.111.111.111 (53)
13:48:52.774991 IP 10.0.0.1.domain > 10.0.0.2.55556: 0 1/0/0 A 111.111.111.111 (53)
13:48:52.814141 IP 10.0.0.1.domain > 10.0.0.2.55556: 0 1/0/0 A 111.111.111.111 (53)
13:48:52.847037 IP 10.0.0.1.domain > 10.0.0.2.55556: 0 1/0/0 A 111.111.111.111 (53)
13:48:52.884749 IP 10.0.0.1.domain > 10.0.0.2.55556: 0 1/0/0 A 111.111.111.111 (53)
13:48:52.924421 IP 10.0.0.1.domain > 10.0.0.2.55556: 0 1/0/0 A 111.111.111.111 (53)
13:48:52.957558 IP 10.0.0.1.domain > 10.0.0.2.55556: 0 1/0/0 A 111.111.111.111 (53)
13:48:52.991774 IP 10.0.0.1.domain > 10.0.0.2.55556: 0 1/0/0 A 111.111.111.111 (53)
13:48:53.026492 IP 10.0.0.1.domain > 10.0.0.2.55556: 0 1/0/0 A 111.111.111.111 (53)
13:48:53.062469 IP 10.0.0.1.domain > 10.0.0.2.55556: 0 1/0/0 A 111.111.111.111 (53)
13:48:53.094553 IP 10.0.0.1.domain > 10.0.0.2.55556: 0 1/0/0 A 111.111.111.111 (53)
13:48:53.127428 IP 10.0.0.1.domain > 10.0.0.2.55556: 0 1/0/0 A 111.111.111.111 (53)
13:48:53.161572 IP 10.0.0.1.domain > 10.0.0.2.55556: 0 1/0/0 A 111.111.111.111 (53)
13:48:53.196200 IP 10.0.0.1.domain > 10.0.0.2.55556: 0 1/0/0 A 111.111.111.111 (53)
13:48:53.230338 IP 10.0.0.1.domain > 10.0.0.2.55556: 0 1/0/0 A 111.111.111.111 (53)
13:48:53.269470 IP 10.0.0.1.domain > 10.0.0.2.55556: 0 1/0/0 A 111.111.111.111 (53)
13:48:53.307336 IP 10.0.0.1.domain > 10.0.0.2.55556: 0 1/0/0 A 111.111.111.111 (53)
13:48:53.342666 IP 10.0.0.1.domain > 10.0.0.2.55556: 0 1/0/0 A 111.111.111.111 (53)
13:48:53.379601 IP 10.0.0.1.domain > 10.0.0.2.55556: 0 1/0/0 A 111.111.111.111 (53)
13:48:53.413429 IP 10.0.0.1.domain > 10.0.0.2.55556: 0 1/0/0 A 111.111.111.111 (53)
13:48:53.445983 IP 10.0.0.1.domain > 10.0.0.2.55556: 0 1/0/0 A 111.111.111.111 (53)
13:48:53.478063 IP 10.0.0.1.domain > 10.0.0.2.55556: 0 1/0/0 A 111.111.111.111 (53)
13:48:53.514433 IP 10.0.0.1.domain > 10.0.0.2.55556: 0 1/0/0 A 111.111.111.111 (53)
13:48:53.548451 IP 10.0.0.1.domain > 10.0.0.2.55556: 0 1/0/0 A 111.111.111.111 (53)
13:48:53.587592 IP 10.0.0.1.domain > 10.0.0.2.55556: 0 1/0/0 A 111.111.111.111 (53)
13:48:53.622416 IP 10.0.0.1.domain > 10.0.0.2.55556: 0 1/0/0 A 111.111.111.111 (53)
13:48:53.663294 IP 10.0.0.1.domain > 10.0.0.2.55556: 0 1/0/0 A 111.111.111.111 (53)
13:48:53.701664 IP 10.0.0.1.domain > 10.0.0.2.55556: 0 1/0/0 A 111.111.111.111 (53)
13:48:53.735917 IP 10.0.0.1.domain > 10.0.0.2.55556: 0 1/0/0 A 111.111.111.111 (53)
13:48:53.767327 IP 10.0.0.1.domain > 10.0.0.2.55556: 0 1/0/0 A 111.111.111.111 (53)
13:48:53.806478 IP 10.0.0.1.domain > 10.0.0.2.55556: 0 1/0/0 A 111.111.111.111 (53)
13:48:53.838610 IP 10.0.0.1.domain > 10.0.0.2.55556: 0 1/0/0 A 111.111.111.111 (53)
13:48:53.870926 IP 10.0.0.1.domain > 10.0.0.2.55556: 0 1/0/0 A 111.111.111.111 (53)
13:48:53.907930 IP 10.0.0.1.domain > 10.0.0.2.55556: 0 1/0/0 A 111.111.111.111 (53)
13:48:53.942893 IP 10.0.0.1.domain > 10.0.0.2.55556: 0 1/0/0 A 111.111.111.111 (53)
13:48:53.980581 IP 10.0.0.1.domain > 10.0.0.2.55556: 0 1/0/0 A 111.111.111.111 (53)
13:48:54.018818 IP 10.0.0.1.domain > 10.0.0.2.55556: 0 1/0/0 A 111.111.111.111 (53)
13:48:54.049512 IP 10.0.0.1.domain > 10.0.0.2.55556: 0 1/0/0 A 111.111.111.111 (53)
13:48:54.087434 IP 10.0.0.1.domain > 10.0.0.2.55556: 0 1/0/0 A 111.111.111.111 (53)
13:48:54.122362 IP 10.0.0.1.domain > 10.0.0.2.55556: 0 1/0/0 A 111.111.111.111 (53)
13:48:54.158324 IP 10.0.0.1.domain > 10.0.0.2.55556: 0 1/0/0 A 111.111.111.111 (53)
13:48:54.194603 IP 10.0.0.1.domain > 10.0.0.2.55556: 0 1/0/0 A 111.111.111.111 (53)
13:48:54.234392 IP 10.0.0.1.domain > 10.0.0.2.55556: 0 1/0/0 A 111.111.111.111 (53)
13:48:54.272097 IP 10.0.0.1.domain > 10.0.0.2.55556: 0 1/0/0 A 111.111.111.111 (53)
13:48:54.308483 IP 10.0.0.1.domain > 10.0.0.2.55556: 0 1/0/0 A 111.111.111.111 (53)
13:48:54.345146 IP 10.0.0.1.domain > 10.0.0.2.55556: 0 1/0/0 A 111.111.111.111 (53)
13:48:54.380800 IP 10.0.0.1.domain > 10.0.0.2.55556: 0 1/0/0 A 111.111.111.111 (53)
13:48:54.417152 IP 10.0.0.1.domain > 10.0.0.2.55556: 0 1/0/0 A 111.111.111.111 (53)
13:48:54.455242 IP 10.0.0.1.domain > 10.0.0.2.55556: 0 1/0/0 A 111.111.111.111 (53)
13:48:54.494176 IP 10.0.0.1.domain > 10.0.0.2.55556: 0 1/0/0 A 111.111.111.111 (53)
13:48:54.528108 IP 10.0.0.1.domain > 10.0.0.2.55556: 0 1/0/0 A 111.111.111.111 (53)
13:48:54.563788 IP 10.0.0.1.domain > 10.0.0.2.55556: 0 1/0/0 A 111.111.111.111 (53)
13:48:54.601638 IP 10.0.0.1.domain > 10.0.0.2.55556: 0 1/0/0 A 111.111.111.111 (53)
13:48:54.639491 IP 10.0.0.1.domain > 10.0.0.2.55556: 0 1/0/0 A 111.111.111.111 (53)
13:48:54.676638 IP 10.0.0.1.domain > 10.0.0.2.55556: 0 1/0/0 A 111.111.111.111 (53)
13:48:54.712988 IP 10.0.0.1.domain > 10.0.0.2.55556: 0 1/0/0 A 111.111.111.111 (53)
13:48:54.752175 IP 10.0.0.1.domain > 10.0.0.2.55556: 0 1/0/0 A 111.111.111.111 (53)
13:48:54.786995 IP 10.0.0.1.domain > 10.0.0.2.55556: 0 1/0/0 A 111.111.111.111 (53)
13:48:54.823565 IP 10.0.0.1.domain > 10.0.0.2.55556: 0 1/0/0 A 111.111.111.111 (53)
13:48:54.860398 IP 10.0.0.1.domain > 10.0.0.2.55556: 0 1/0/0 A 111.111.111.111 (53)
13:48:54.898670 IP 10.0.0.1.domain > 10.0.0.2.55556: 0 1/0/0 A 111.111.111.111 (53)
13:48:54.935300 IP 10.0.0.1.domain > 10.0.0.2.55556: 0 1/0/0 A 111.111.111.111 (53)
13:48:54.973904 IP 10.0.0.1.domain > 10.0.0.2.55556: 0 1/0/0 A 111.111.111.111 (53)
13:48:55.009524 IP 10.0.0.1.domain > 10.0.0.2.55556: 0 1/0/0 A 111.111.111.111 (53)
13:48:55.078230 IP 10.0.0.1.domain > 10.0.0.2.55556: 0 1/0/0 A 111.111.111.111 (53)
13:48:55.113378 IP 10.0.0.1.domain > 10.0.0.2.55556: 0 1/0/0 A 111.111.111.111 (53)
13:48:55.151575 IP 10.0.0.1.domain > 10.0.0.2.55556: 0 1/0/0 A 111.111.111.111 (53)
13:48:55.190023 IP 10.0.0.1.domain > 10.0.0.2.55556: 0 1/0/0 A 111.111.111.111 (53)
13:48:55.226425 IP 10.0.0.1.domain > 10.0.0.2.55556: 0 1/0/0 A 111.111.111.111 (53)
13:48:55.266044 IP 10.0.0.1.domain > 10.0.0.2.55556: 0 1/0/0 A 111.111.111.111 (53)
13:48:55.304038 IP 10.0.0.1.domain > 10.0.0.2.55556: 0 1/0/0 A 111.111.111.111 (53)
13:48:55.340966 IP 10.0.0.1.domain > 10.0.0.2.55556: 0 1/0/0 A 111.111.111.111 (53)
13:48:55.377881 IP 10.0.0.1.domain > 10.0.0.2.55556: 0 1/0/0 A 111.111.111.111 (53)
13:48:55.414734 IP 10.0.0.1.domain > 10.0.0.2.55556: 0 1/0/0 A 111.111.111.111 (53)
13:48:55.450248 IP 10.0.0.1.domain > 10.0.0.2.55556: 0 1/0/0 A 111.111.111.111 (53)
13:48:55.486329 IP 10.0.0.1.domain > 10.0.0.2.55556: 0 1/0/0 A 111.111.111.111 (53)
13:48:55.526125 IP 10.0.0.1.domain > 10.0.0.2.55556: 0 1/0/0 A 111.111.111.111 (53)
13:48:55.566342 IP 10.0.0.1.domain > 10.0.0.2.55556: 0 1/0/0 A 111.111.111.111 (53)
13:48:55.596611 IP 10.0.0.1.domain > 10.0.0.2.55556: 0 1/0/0 A 111.111.111.111 (53)

